title,link,description,pubdate,location
Software Developer (m/f/d),https://jooble.org/desc/-1567072634554005690?ckey=NONE&rgn=55157&pos=82&elckey=828530011852031490&p=1&sid=-1110650161605457098&jobAge=16&relb=10&brelb=10&bscr=11466.549775521053&scr=11466.549775521053&searchTestGroup=1_944_1&iid=8347470085275076629,"For our division Software Development we are looking for Software Developer (m/f/d) The assignment can take place at our office in Darmstadt, Gießen or Kassel. Further ekom21 location from June 2023 also in Fulda!!! From summer 2023, there is the...",2023-05-06,Remote jobFull timePart timeSummer workWork at officeTrainingFieldTravelFlexible hours
Software Developer (m/f/d),https://jooble.org/desc/2179346983772040431?ckey=NONE&rgn=55157&pos=83&elckey=828530011852031490&p=1&sid=-1110650161605457098&jobAge=16&relb=10&brelb=10&bscr=11466.549775521053&scr=11466.549775521053&searchTestGroup=1_944_1&iid=5534140791656174298,Digitize with us! easy-soft GmbH Dresden is a nationwide operating medium-sized company based in Dresden and specialized in the development of software systems for the public health service. Our software is in use in approximately 130 health offices throughout Germany...,2023-05-06,Remote jobTrainingFieldWithout locationFlexible hours
Spare parts salesman (m/f/d) with in-depth SAP knowledge,https://jooble.org/desc/8201728652432037408?ckey=NONE&rgn=55157&pos=84&elckey=828530011852031490&p=1&sid=-1110650161605457098&jobAge=16&relb=10&brelb=10&bscr=11466.549775521053&scr=11466.549775521053&searchTestGroup=1_944_1&iid=5885718139517632003,"What began as a blacksmiths shop in 1705 is now a globally operating company with extensive experience and great innovative strength. Every day, we forge plans for extremely robust and intelligent transport solutions in heavy-duty and special transport - on the road, ...",2023-05-06,Remote jobTrainingOnlineField
IT Application Support Manager Hospital Information System - Focus on User Management (m/f/d),https://jooble.org/desc/-8181117237716433495?ckey=NONE&rgn=55157&pos=85&elckey=828530011852031490&p=1&sid=-1110650161605457098&jobAge=20&relb=10&brelb=10&bscr=11466.549775521053&scr=11466.549775521053&searchTestGroup=1_944_1&iid=9072455179618836584,"IT Application Support Specialist* Hospital Information System - Focus on User Management. UKSH Gesellschaft für IT Services mbH, based in Lübeck, provides all IT services for the University Hospital Schleswig-Holstein (UKSH), supporting cutting-edge medicine and ...",2023-05-06,Remote jobFull timeRemote jobPart timeTrainingFlexible hours
Full Stack Web Developer (m/w/d),https://jooble.org/desc/-5481617218730200258?ckey=NONE&rgn=55157&pos=86&elckey=828530011852031490&p=1&sid=-1110650161605457098&jobAge=16&relb=10&brelb=10&bscr=11466.549775521053&scr=11466.549775521053&searchTestGroup=1_944_1&iid=-2076175617086105187,"Full Stack Web Developer (m/f/d) FULL STACK WEB DEVELOPER* WHO WE ARE Do IT yourself is our credo. To meet the constantly changing demands on our IT, we have NEW YORKER Information Services International (ISI), where we keep all core competencies in-house...",2023-05-06,Remote jobFieldWorldwide
IT System Specialist - DataCenter Services (m/w/d),https://jooble.org/desc/-3853582941868902293?ckey=NONE&rgn=55157&pos=87&elckey=828530011852031490&p=1&sid=-1110650161605457098&jobAge=16&relb=10&brelb=10&bscr=11466.549775521053&scr=11466.549775521053&searchTestGroup=1_944_1&iid=-3854925470882984306,"thyssenkrupp is an international group of largely independent industrial and technology businesses with around 96,000 employees. In 48 countries the Group generated sales of €41 billion in fiscal year 2021/22. With extensive technology expertise, the businesses and all...",2023-05-06,Remote jobRemote jobTrainingFieldWork from homeHome officeWithout locationFlexible hours
IT System Administration (f/m/d) Software Distribution / Profile Management,https://jooble.org/desc/-1554699190018776769?ckey=NONE&rgn=55157&pos=88&elckey=828530011852031490&p=1&sid=-1110650161605457098&jobAge=16&relb=10&brelb=10&bscr=11466.549775521053&scr=11466.549775521053&searchTestGroup=1_944_1&iid=6566977692649202154,IT System Administration (f/m/d) Software distribution / profile management uk-it business unit As of the next possible Date Full-time; initially limited to 2 years Remuneration is in accordance with the provisions of the TV-L Your tasks ...,2023-05-06,Remote jobFull timePart timeTrainingUnit
Integration Developer Field-2-Cloud (m/w/d),https://jooble.org/desc/-1236007455618608692?ckey=NONE&rgn=55157&pos=89&elckey=828530011852031490&p=1&sid=-1110650161605457098&jobAge=16&relb=10&brelb=10&bscr=11466.549775521053&scr=11466.549775521053&searchTestGroup=1_944_1&iid=3095912125417677255,Integration Developer Field-2-Cloud (m/f/d) Techem has been a leader in the real estate industry for almost 70 years: we offer smart solutions for greater energy efficiency in buildings in around 20 countries worldwide. For our fast-growing Digital IT team...,2023-05-06,Remote jobOnlineFieldWorldwideWithout locationTravelFlexible hours
Head of Enterprise Architecture and Business Application Management (m/w/d),https://jooble.org/desc/5687691133026176317?ckey=NONE&rgn=55157&pos=90&elckey=828530011852031490&p=1&sid=-1110650161605457098&jobAge=16&relb=10&brelb=10&bscr=11466.549775521053&scr=11466.549775521053&searchTestGroup=1_944_1&iid=1030540066137447044,"HEAD OF ENTERPRISE ARCHITECTURE AND BUSINESS APPLICATION MANAGEMENT (M/F/D). IN COLOGNE. We are one of the best consultancies for strategic sourcing and supply chain management. As an independent part of BCG, we offer the best of both worlds: deep expertise and ...",2023-05-06,Remote jobNight shiftWeekend work
IT Inhouse Consultant (w/m/d) - Demand to Goods,https://jooble.org/desc/-7864970571507316913?ckey=NONE&rgn=55157&pos=91&elckey=828530011852031490&p=1&sid=-1110650161605457098&jobAge=16&relb=10&brelb=10&bscr=11466.549775521053&scr=11466.549775521053&searchTestGroup=1_944_1&iid=-9194177572534299654,"You are an important part of our future. And hopefully we are also a part of yours! At B. Braun, we protect and improve the health of people worldwide. Thats our vision, and IT is no exception. Because you see technology as an opportunity and develop solutions that sustain...",2023-05-06,Remote jobPart timeFieldWorldwide
Computer scientist as IT HCM / HR specialist (f/m/d),https://jooble.org/desc/-3215083030596911483?ckey=NONE&rgn=55157&pos=92&elckey=828530011852031490&p=1&sid=-1110650161605457098&jobAge=16&relb=10&brelb=10&bscr=11466.549775521053&scr=11466.549775521053&searchTestGroup=1_944_1&iid=-2431575597170790852,"Job ID 2023-642 TALENT IS COMPLETELY IN ITS ELEMENT WITH US Computer scientist as IT HCM / HR specialist (f/m/d) Technical expertise, reliability and enjoyment of performance make us the leading company for the development and operation of chemical and pharmaceutical...",2023-05-06,Remote jobFull timePart timeApprenticeshipWork experience placementTrainingOnlineLocal areaWithout locationFlexible hours
Computer scientist as IT system administrator (m/f/d),https://jooble.org/desc/9088124791721713078?ckey=NONE&rgn=55157&pos=93&elckey=828530011852031490&p=1&sid=-1110650161605457098&jobAge=16&relb=10&brelb=10&bscr=11466.549775521053&scr=11466.549775521053&searchTestGroup=1_944_1&iid=-3178865065518138491,"To strengthen our team in ?Aachen? we are looking for you as a Computer scientist as IT system administrator (m/f/d) Location Aachen ?temporary ?full time At Graphic Packaging International (NYSE: GPK), we make the box you may have served your child...",2023-05-06,Remote jobFull timeTemporary workTrainingOnlineWorldwideDay shift
IT System Integrator Infrastructure (m/f/d),https://jooble.org/desc/8250536828469210966?ckey=NONE&rgn=55157&pos=94&elckey=828530011852031490&p=1&sid=-1110650161605457098&jobAge=16&relb=10&brelb=10&bscr=11466.549775521053&scr=11466.549775521053&searchTestGroup=1_944_1&iid=-3099528959229627163,IT System Integrator Infrastructure (m/f/d) Join us immediately part-time and full-time as a /*Your tasks You will perform first-level failure analyses of internal test routines using checklists You are co-responsible for provider and service...,2023-05-06,Remote jobFull timeRemote jobPart timeTrainingImmediate startFieldTravelFlexible hoursNight shiftWeekend work
IT-Support / User Help Desk (w/m/d) - IT Infrastructure,https://jooble.org/desc/5662488064102895327?ckey=NONE&rgn=55157&pos=95&elckey=828530011852031490&p=1&sid=-1110650161605457098&jobAge=16&relb=10&brelb=10&bscr=11466.549775521053&scr=11466.549775521053&searchTestGroup=1_944_1&iid=6044328030884857674,"The Matthäi Group is successful in all disciplines of construction. Together with our approximately 3,000 employees at over 70 locations, we build high-performance infrastructures that provide valuable services to society today and tomorrow. In doing so, we impress with...",2023-05-06,Remote jobWork at officeTraining
Project Manager IT Organization (m/f/d),https://jooble.org/desc/-5450741633352565669?ckey=NONE&rgn=55157&pos=96&elckey=828530011852031490&p=1&sid=-1110650161605457098&jobAge=16&relb=10&brelb=10&bscr=11466.549775521053&scr=11466.549775521053&searchTestGroup=1_944_1&iid=-7838052540655619842,Project Manager IT Organization (m/f/d) H.P. Kaysser GmbH + Co. KG is a modern family business with ideas and innovative strength. Highly interesting future projects on sustainable environmental topics are part of our tasks. From development to machining to completely...,2023-05-06,Remote jobPermanent employmentContract workOnlineWorldwideHome officeFlexible hours
Network Technology Specialist (f/m/d),https://jooble.org/desc/3797266880656525141?ckey=NONE&rgn=55157&pos=97&elckey=828530011852031490&p=1&sid=-1110650161605457098&jobAge=16&relb=10&brelb=10&bscr=11463.436138206751&scr=11463.436138206751&searchTestGroup=1_944_1&iid=-700411125038045236,"Network Engineering Specialist (f/m/d) We are a leading and expanding company in the food industry, producing high-quality cereal products for the food retail and processing industries. Our crunchy cereals, tasty muesli compositions and innovative muesli and cereal...",2023-05-06,Remote jobPermanent employmentTrainingOnlineWithout locationFlexible hours
Specialist IT-Sicherheit / Cyber Security (m/w/d),https://jooble.org/desc/6307959319957603703?ckey=NONE&rgn=55157&pos=98&elckey=828530011852031490&p=1&sid=-1110650161605457098&jobAge=16&relb=10&brelb=10&bscr=11463.436138206751&scr=11463.436138206751&searchTestGroup=1_944_1&iid=-2400911018894476398,"With the HR platform P&amp;I LogaHR for integrated and automated HR work, P&amp;I AG is shaping the HR industry and is considered a market pioneer in Germany with its guiding principle Rethink HR. As the first HR cloud data center of its kind, P&amp;Is security-of-the-cloud strategy...",2023-05-06,Remote jobPermanent employmentTrainingPrivateFieldFlexible hours
Senior Enterprise Architect (m/w/d),https://jooble.org/desc/-786762880826057367?ckey=NONE&rgn=55157&pos=99&elckey=828530011852031490&p=1&sid=-1110650161605457098&jobAge=16&relb=10&brelb=10&bscr=11463.436138206751&scr=11463.436138206751&searchTestGroup=1_944_1&iid=-7852859222577688024,"Join our team at Boerse Stuttgart Group as. Senior Enterprise Architect (m/f/d) As Boerse Stuttgart Group, we are the sixth largest exchange group in Europe with strategic pillars in the capital markets business as well as in the digital and crypto business. ...",2023-05-06,Remote jobPrivateUnitWithout locationTravelFlexible hours
Employee Support JTL Products (f/m/d),https://jooble.org/desc/-7691590753004988324?ckey=NONE&rgn=55157&pos=100&elckey=828530011852031490&p=1&sid=-1110650161605457098&jobAge=16&relb=10&brelb=10&bscr=11463.436138206751&scr=11463.436138206751&searchTestGroup=1_944_1&iid=5122371868971704855,"JTL-Software was founded in 2008 and today employs around 200 people at four locations. Over the past ten years, we have established ourselves as a force to be reckoned with in the German e-commerce industry. Thus, we are constantly developing our software solutions, are...",2023-05-06,Remote jobPermanent employmentContract workTrainingOnlineWithout locationTravelFlexible hours
Specialist (m/f/d) in IT Service Desk,https://jooble.org/desc/8632435355142713962?ckey=NONE&rgn=55157&pos=101&elckey=828530011852031490&p=1&sid=-1110650161605457098&jobAge=16&relb=10&brelb=10&bscr=11434.687998131563&scr=11434.687998131563&searchTestGroup=1_944_1&iid=218045144442162753,"Join our team at Boerse Stuttgart Group as. Specialist (m/f/d) in the IT Service Desk As Boerse Stuttgart Group, we are the sixth largest exchange group in Europe with strategic pillars in the capital markets business as well as in the digital and crypto business...",2023-05-06,Remote jobPrivateWithout locationTravelFlexible hoursShift work
"Senior Director, Financial Planning &amp; Analysis (FP&amp;A)",https://jooble.org/desc/1359421528578505630?ckey=NONE&rgn=55157&pos=102&elckey=828530011852031490&p=1&sid=-1110650161605457098&jobAge=40&relb=100&brelb=100&bscr=11171.98719184005&scr=11171.98719184005&searchTestGroup=1_944_1&iid=-7107329666167823171,"The Senior Director, Financial Planning &amp; Analysis (FP&amp;A) role is expected to lead a team within a high performing organization working collaboratively with the business and finance leaders in to assist with collaborating on driving profitable growth in Americas, Europe...",2023-05-06,Remote jobHoliday workRemote jobLocal areaFieldTravelFlexible hours
"Administration and Operations Coordinator, Kiwi Partners",https://jooble.org/desc/7954149953934695119?ckey=NONE&rgn=55157&pos=103&elckey=828530011852031490&p=1&sid=-1110650161605457098&jobAge=232&relb=100&brelb=100&bscr=11068.059304031141&scr=11068.059304031141&searchTestGroup=1_944_1&iid=-3422958213424005510,"About Kiwi Partners / Arabella Advisors&nbsp; Our firm helps foundations, philanthropists and investors who are serious about impact, achieve the greatest good with their resources. We work on issues ranging from the social and economic advancement of women and girls, and...",2023-05-06,Remote jobContract workWork experience placementFor subcontractorSummer workWork at officeOnlineField2 days per week3 days per week1 day per week
Security Engineering Manager,https://jooble.org/desc/-2798394764438687233?ckey=NONE&rgn=55157&pos=104&elckey=828530011852031490&p=1&sid=-1110650161605457098&jobAge=448&relb=100&brelb=100&bscr=10806.386241084228&scr=10806.386241084228&searchTestGroup=1_944_1&iid=493037684842798762,"Abbott is a global healthcare leader that helps people live more fully at all stages of life. Our portfolio of life-changing technologies spans the spectrum of healthcare, with leading businesses and products in diagnostics, medical devices, nutritionals and branded generic...",2023-05-06,Remote jobLocal areaPrivateWork alone
Remote Database Administrator - Platform,https://jooble.org/desc/-3450109954440503806?ckey=NONE&rgn=55157&pos=105&elckey=828530011852031490&p=1&sid=-1110650161605457098&jobAge=16&relb=100&brelb=100&bscr=10730.251703428981&scr=10730.251703428981&searchTestGroup=1_944_1&iid=9074921330128565001,"DocuSign helps organizations connect and automate how they agree. Our flagship product, eSignature, is the world’s #1 way to sign electronically on practically any device, from virtually anywhere, at any time. Today, more than a million customers and a billion users in...",2023-05-06,Remote jobRemote jobWork at office
Remote Freelance Financial Writer,https://jooble.org/desc/-4517070503296346092?ckey=NONE&rgn=55157&pos=106&elckey=828530011852031490&p=1&sid=-1110650161605457098&jobAge=16&relb=100&brelb=100&bscr=10704.411057094549&scr=10704.411057094549&searchTestGroup=1_944_1&iid=-9029806273178992321,"Angi® is transforming the home services industry, creating an environment for homeowners, service professionals and employees to feel right at “home.” For most home maintenance needs, our platform makes it easier than ever to find a qualified service professional for indoor...",2023-05-06,Remote jobRemote jobFor contractorsFreelanceOnlineOutdoor
Remote Sr. Growth Marketing Manager,https://jooble.org/desc/9129448942722478304?ckey=NONE&rgn=55157&pos=107&elckey=828530011852031490&p=1&sid=-1110650161605457098&jobAge=16&relb=100&brelb=100&bscr=10698.389926039492&scr=10698.389926039492&searchTestGroup=1_944_1&iid=-2550334945184534333,"Calm is the leading mental health brand, on a mission to support everyone on every step of their mental health journey. With the #1 app for sleep, meditation and relaxation, Calm’s transformational mindfulness content supports users across seven languages in more than ...",2023-05-06,Remote jobRemote jobFor contractorsLocal areaFlexible hours
Senior Software Engineer,https://jooble.org/desc/-1190319539050312883?ckey=NONE&rgn=55157&pos=108&elckey=828530011852031490&p=1&sid=-1110650161605457098&jobAge=136&relb=110&brelb=110&bscr=10679.934807283344&scr=10679.934807283344&searchTestGroup=1_944_1&iid=-4995192504134613868,"Wolfe is growing, and we need a passionate Senior Software Engineer to help us scale. With twenty developers spanning five distinct teams, we need to level up our enterprise-readiness by ensuring our code is robust, secure, performant, and maintainable. Were looking...",2023-05-06,Remote jobHoliday workContract workRemote jobFor contractorsWork experience placementLocal areaUnit
Remote Business Sales Representative,https://jooble.org/desc/8201212814779213226?ckey=NONE&rgn=55157&pos=109&elckey=828530011852031490&p=1&sid=-1110650161605457098&jobAge=136&relb=110&brelb=110&bscr=10679.934807283344&scr=10679.934807283344&searchTestGroup=1_944_1&iid=4502494850606908801,"Are you interested in beginning a job as a Business Representative? Do you want a custom schedule, with immediate rewards on every deal, complimentary education, and advancement opportunities? In our commercial real estate business, we work closely with individual...",2023-05-06,Remote jobRemote jobImmediate start
Customer Support Specialist - Tier 1,https://jooble.org/desc/2362337414204765657?ckey=NONE&rgn=55157&pos=110&elckey=828530011852031490&p=1&sid=-1110650161605457098&jobAge=136&relb=110&brelb=110&bscr=10676.821169969042&scr=10676.821169969042&searchTestGroup=1_944_1&iid=8115437725990457880,"Customer Support Specialist - Tier 1 Canopy, Draper UT Location: Remote - Utah About Us Canopy is a fast-growing SaaS company in Draper, Utah building simple, efficient software for accounting firms. We are looking to revolutionize the accounting space with...",2023-05-06,Remote jobHoliday workTemporary workRemote jobImmediate startEapFlexible hours
"FSP Senior Biostatistician (GI) - Remote, US",https://jooble.org/desc/7877747718176316877?ckey=NONE&rgn=55157&pos=111&elckey=828530011852031490&p=1&sid=-1110650161605457098&jobAge=40&relb=100&brelb=100&bscr=10675.041138469562&scr=10675.041138469562&searchTestGroup=1_944_1&iid=8078761090437102612,"About Phastar Phastar brings data to life! We are an award-winning specialist biometrics contract research organization (CRO) that works with pharmaceutical, biotechnology, and medical device companies to provide statistical consulting, analysis and reporting, data management...",2023-05-06,Remote jobContract workRemote jobWork at office
"Associate Director, Conference, Meetings &amp; Events (Remote, US)",https://jooble.org/desc/1232765022384546394?ckey=NONE&rgn=55157&pos=112&elckey=828530011852031490&p=1&sid=-1110650161605457098&jobAge=40&relb=100&brelb=100&bscr=10675.041138469562&scr=10675.041138469562&searchTestGroup=1_944_1&iid=-4829130984152093519,"Description Associate Director, Conference, Meetings &amp; Events The Global Corporate Communications &amp; Marketing (GCC&amp;M) team is seeking an Associate Director, Conferences, Meetings and Events, to streamline, centralize and harmonize conference execution...",2023-05-06,Remote jobFull timeContract workRemote jobWork experience placementTravel
"Senior Vice President, Real World &amp; Late Phase",https://jooble.org/desc/6290851887795000653?ckey=NONE&rgn=55157&pos=113&elckey=828530011852031490&p=1&sid=-1110650161605457098&jobAge=40&relb=100&brelb=100&bscr=10624.074852531056&scr=10624.074852531056&searchTestGroup=1_944_1&iid=1009709162825398932,"Description Syneos Health is the only f ully integrated biopharmaceutical solutions organization purpose-built to accelerate customer success. We lead with a product development mindset, seamlessly connecting our capabilities to add high-value insights to speed...",2023-05-06,Remote jobContract workTrainingUnitDomesticEasy workTravelFlexible hours
Remote Principal Corporate Counsel,https://jooble.org/desc/-45377518430597559?ckey=NONE&rgn=55157&pos=114&elckey=828530011852031490&p=1&sid=-1110650161605457098&jobAge=16&relb=100&brelb=100&bscr=10577.19650413795&scr=10577.19650413795&searchTestGroup=1_944_1&iid=3604463902620614344,"GitHub is looking for a dynamic and motivated transactional lawyer to join its Commercial Legal team as part of GitHub’s growing Corporate, External, and Legal Affairs (CELA) organization. This position will provide legal support to the GitHub Sales and Revenue organization...",2023-05-06,Remote jobRemote jobApprenticeship
Director - Solutions Architecture,https://jooble.org/desc/-5442674832284777158?ckey=NONE&rgn=55157&pos=115&elckey=828530011852031490&p=1&sid=-1110650161605457098&jobAge=136&relb=110&brelb=110&bscr=10541.27939545961&scr=10541.27939545961&searchTestGroup=1_944_1&iid=-7858422288432320303,"Platinum Technologies is an integrated solutions firm that specializes in Cybersecurity, Cloud and Digital Services to the Public Sector. Our team provides high-end, quality resources to help our Mission Partners realize their goals. If you are self-motivated, possess ...",2023-05-06,Remote jobFull timeRemote jobWork experience placementTrainingCurrently hiringMonday friday
Resource Coordinator,https://jooble.org/desc/-2811493249690893301?ckey=NONE&rgn=55157&pos=116&elckey=828530011852031490&p=1&sid=-1110650161605457098&jobAge=136&relb=110&brelb=110&bscr=10541.27939545961&scr=10541.27939545961&searchTestGroup=1_944_1&iid=-6780369621211160338,"RESOURCE COORDINATOR Overall Objective ~ The Resource Coordinator schedules all production-level resources (Animators, Illustrators, Sound, etc.), oversees internal technicians capacity and utilization, manages project production budgets and timelines, coordinates...",2023-05-06,Remote jobHoliday workFull timeContract workRemote jobFreelanceFlexible hours
Rare Disease Account Manager - Endocrinology - North Carolina or South Carolina,https://jooble.org/desc/3057239410973968317?ckey=NONE&rgn=55157&pos=117&elckey=828530011852031490&p=1&sid=-1110650161605457098&jobAge=136&relb=110&brelb=110&bscr=10541.27939545961&scr=10541.27939545961&searchTestGroup=1_944_1&iid=3846434397113643524,"Recordati Rare Diseases, Inc. (RRD) develops high-impact therapies for devastating rare diseases. At RRD, we focus on the few - those affected by rare diseases. They are our top priority and at the core of everything we do. RRD is a biopharmaceutical company committed...",2023-05-06,Remote jobLocal areaDomesticTravelNight shiftWeekend work
Business Development Representative,https://jooble.org/desc/7800034975647053095?ckey=NONE&rgn=55157&pos=118&elckey=828530011852031490&p=1&sid=-1110650161605457098&jobAge=136&relb=110&brelb=110&bscr=10541.27939545961&scr=10541.27939545961&searchTestGroup=1_944_1&iid=-8963448031968267390,"Business Development Representative Virtual Peaker is looking for a high-performing Sales Development Representative who will help save the world by working to build the utility of the future. At Virtual Peaker, there are two key components of our company identity: ...",2023-05-06,Remote jobRemote jobWork at office
Legal Accounting Manager (Tax),https://jooble.org/desc/-1385027116918222852?ckey=NONE&rgn=55157&pos=119&elckey=828530011852031490&p=1&sid=-1110650161605457098&jobAge=136&relb=110&brelb=110&bscr=10538.165758145306&scr=10538.165758145306&searchTestGroup=1_944_1&iid=-6276251443645993225,"Do you describe yourself as a numbers AND people person? Do you thrive when focusing on compliance and quality control? Do you have experience and enjoy managing people and processes? If you answered yes to all these questions, we may have just the role for you at the ...",2023-05-06,Remote jobRemote jobLocal areaFieldOverseas
Construction Accountant,https://jooble.org/desc/-372758433006165776?ckey=NONE&rgn=55157&pos=120&elckey=828530011852031490&p=1&sid=-1110650161605457098&jobAge=136&relb=110&brelb=110&bscr=10538.165758145306&scr=10538.165758145306&searchTestGroup=1_944_1&iid=-3602719005280647789,"Job Description Summary We are seeking a qualified, safety-minded, detail-oriented, highly organized individual with strong computer and communication skills to work as a Construction&nbsp;Accountant. The successful candidates responsibilities will include: billing and ...",2023-05-06,Remote jobContract workWork at officeShift workMonday friday
Executive Producer,https://jooble.org/desc/5675399201413940626?ckey=NONE&rgn=55157&pos=121&elckey=828530011852031490&p=1&sid=-1110650161605457098&jobAge=136&relb=110&brelb=110&bscr=10528.494403242292&scr=10528.494403242292&searchTestGroup=1_944_1&iid=-686890131683604903,"About QS QS is the worlds leading provider of services, analytics, insights, and intelligence to the global higher education sector supporting university excellence across the world. Our student recruitment and enrolment solutions enable universities and business schools...",2023-05-06,Remote jobRemote jobWork at officeWorldwideFlexible hours
