title,link,description,pubdate,location
Career Counselor,https://jooble.org/desc/3342682870375791216?ckey=NONE&rgn=55157&pos=122&elckey=828530011852031490&p=1&sid=-1110650161605457098&jobAge=136&relb=110&brelb=110&bscr=10528.494403242292&scr=10528.494403242292&searchTestGroup=1_944_1&iid=3616938776231102995,"Career Counselor- Part-Time, Remote Industries: We are looking for counselors in the following industries: Investment Banking, Wealth Management, Private Equity, Management Consulting, Data analytics/Business Analytics, Data Science, Software Engineering and&nbsp;Product...",2023-05-06,Remote jobFull timeTemporary workRemote jobPart timeInternshipPrivate
Business Representative - Remote,https://jooble.org/desc/-7654108746932807524?ckey=NONE&rgn=55157&pos=123&elckey=828530011852031490&p=1&sid=-1110650161605457098&jobAge=136&relb=110&brelb=110&bscr=10528.494403242292&scr=10528.494403242292&searchTestGroup=1_944_1&iid=-2304422900162975657,"Are you looking to start a career as a Business Representative? Are you looking for a flexible schedule, with instant rewards on every deal, free training, and professional growth? In our commercial real estate business, we work closely with private investors and...",2023-05-06,Remote jobRemote jobTrainingImmediate startPrivateFlexible hours
Business Sales Representative - Remote,https://jooble.org/desc/8768966926366036118?ckey=NONE&rgn=55157&pos=124&elckey=828530011852031490&p=1&sid=-1110650161605457098&jobAge=136&relb=110&brelb=110&bscr=10528.494403242292&scr=10528.494403242292&searchTestGroup=1_944_1&iid=2209801148320904741,"Are you interested in beginning a job as a Business Representative? Are you looking for a custom schedule, with instant rewards on every deal, free training, and professional growth? In our commercial real estate business, we work closely with individual clients ...",2023-05-06,Remote jobRemote jobTrainingImmediate start
Remote SEO Senior Strategist,https://jooble.org/desc/8354693019866520739?ckey=NONE&rgn=55157&pos=125&elckey=828530011852031490&p=1&sid=-1110650161605457098&jobAge=16&relb=100&brelb=100&bscr=10504.092721239724&scr=10504.092721239724&searchTestGroup=1_944_1&iid=-5273825688937243850,"We believe that we are better together, and at Tripadvisor we welcome you for who you are. Our workplace is for everyone, as is our people powered platform. At Tripadvisor, we want you to bring your unique identities, abilities, and experiences, so we can collectively ...",2023-05-06,Remote jobRemote jobImmediate startTravel
Events Manager,https://jooble.org/desc/-5538366656402136407?ckey=NONE&rgn=55157&pos=126&elckey=828530011852031490&p=1&sid=-1110650161605457098&jobAge=136&relb=110&brelb=110&bscr=10484.138760419253&scr=10484.138760419253&searchTestGroup=1_944_1&iid=-4735306066987958424,"About QS QS is the worlds leading provider of services, analytics, insights, and intelligence to the global higher education sector supporting university excellence across the world. Our student recruitment and enrolment solutions enable universities and business schools...",2023-05-06,Remote jobWork at officeTravelFlexible hours
Senior Software Engineer,https://jooble.org/desc/-8205550127818754360?ckey=NONE&rgn=55157&pos=127&elckey=828530011852031490&p=1&sid=-1110650161605457098&jobAge=136&relb=110&brelb=110&bscr=10484.138760419253&scr=10484.138760419253&searchTestGroup=1_944_1&iid=-4327633007081659909,"Senior Software Engineer Location: Remote, preference for candidates based in DC Metropolitan Area or NY Eligible remote work States: FL, GA, MD, NY, PA, TN, TX, &amp; VA $120,000-$160,000 Base Salary , Position eligible for additional incentives including bonus...",2023-05-06,Remote jobRemote jobField
Digital Project Manager,https://jooble.org/desc/4612001188603624997?ckey=NONE&rgn=55157&pos=128&elckey=828530011852031490&p=1&sid=-1110650161605457098&jobAge=136&relb=110&brelb=110&bscr=10484.138760419253&scr=10484.138760419253&searchTestGroup=1_944_1&iid=2327041448587643676,"Digital Project Manager The Digital Project Manager will oversee the coordination and execution of complex, cross-functional projects, while providing expertise in Digital Project management and best practices. The PM will be responsible for planning timelines and...",2023-05-06,Remote jobRemote jobWork experience placementWork at officeFieldFlexible hours
"Analyst, MarTech Engineering &amp; Innovation (Entry Level - Remote)",https://jooble.org/desc/-7900330323752820318?ckey=NONE&rgn=55157&pos=129&elckey=828530011852031490&p=1&sid=-1110650161605457098&jobAge=12&relb=100&brelb=100&bscr=10345.80130857571&scr=10345.80130857571&searchTestGroup=1_944_1&iid=7906439159017866217,"&nbsp; Ready to Make your Mark? Are you ready to launch your career as a skilled Analyst? As an Analyst, youll be a contributor to our Consulting Martech Engineering &amp; Innovation team, responsible for delivering exceptional technical marketing technology implementations...",2023-05-06,Remote jobFull timeRemote jobPrivateFlexible hours
Principal Statistical Programmer,https://jooble.org/desc/-2774736587258789054?ckey=NONE&rgn=55157&pos=130&elckey=828530011852031490&p=1&sid=-1110650161605457098&jobAge=280&relb=100&brelb=100&bscr=10178.968364727803&scr=10178.968364727803&searchTestGroup=1_944_1&iid=4018730427978632521,"At Cytel, we work hard to create successful careers with significant professional growth for our employees, as a result of which they work hard to make Cytel successful. Cytel is a place where talent, experience and integrity come together to advance the state of clinical...",2023-05-06,Remote jobRemote jobWork at officeFieldWork from homeFlexible hours
"Life/Health Insurance Broker - Financial Services Consultant - Remote/Virtual Option - Part Time/Full Time $1,000-$5,000/week",https://jooble.org/desc/-506169820621330597?ckey=NONE&rgn=55157&pos=131&elckey=828530011852031490&p=1&sid=-1110650161605457098&jobAge=136&relb=110&brelb=110&bscr=10000&scr=10000&searchTestGroup=1_944_1&iid=5426319234887340542,"Seeking independent minded individuals who enjoy working with people and learning how to help others. We are looking for someone willing to learn, have a mentor, on-going training, and be coach-able and humble so that you can grow and improve and learn the products...",2023-05-06,Remote jobHourly payFull timeRemote jobPart timeWork at officeTrainingFieldWork from homeFlexible hours
IT Data Analyst (m/f/d),https://jooble.org/desc/4949249404265855278?ckey=NONE&rgn=55157&pos=132&elckey=828530011852031490&p=1&sid=-1110650161605457098&jobAge=16&relb=10&brelb=10&bscr=1999.9800001295475&scr=1999.9800001295475&searchTestGroup=1_944_1&iid=-8499672250204621107,"IT Data Analyst (m/f/d) Risk protection, pension provision, art, classic cars: we are top positioned in a wide variety of insurance lines. Always close to people, personally and digitally. Our team brings together tradition and modernity - with the highest quality...",2023-05-06,Remote jobPermanent employmentOnlineFieldWork from homeHome officeWithout locationTravelFlexible hours
Venture Scout / Linkedin Lead Generation Expert,https://jooble.org/desc/2583492671213491111?ckey=NONE&rgn=55157&pos=133&elckey=828530011852031490&p=1&sid=-1110650161605457098&jobAge=13&relb=100&brelb=100&bscr=1932.9310118095173&scr=1932.9310118095173&searchTestGroup=1_944_1&iid=4869865004789358338,About the company Our mission at Fulcrum Venture Accelerator is to help human potential flourish through supporting entrepreneurs in building impactful startups. We have already helped more than 90 entrepreneurs raise more than $35M to build projects that impact the...,2023-05-06,Remote jobRemote jobOnline
I am willing to start Math lessons online rich with real-world activities with an organized tutor,https://jooble.org/desc/-2513400258645380128?ckey=NONE&rgn=55157&pos=134&elckey=828530011852031490&p=1&sid=-1110650161605457098&jobAge=13&relb=110&brelb=110&bscr=1888.8940508777873&scr=1888.8940508777873&searchTestGroup=1_944_1&iid=-5319471895684544061,Tutoring jobs in Online: Math. Specialties: General. Age range of target audience: Not Specified (1-100). Good morning. My name is Tiara. I am studying to take my math GED test and would like to know if you can help me with the mission of passing that test...,2023-05-06,Remote jobOnlineFlexible hoursDay shift
Sales Analyst,https://jooble.org/desc/-8477256744790249992?ckey=NONE&rgn=55157&pos=135&elckey=828530011852031490&p=1&sid=-1110650161605457098&jobAge=136&relb=110&brelb=110&bscr=1728.1893589986842&scr=1728.1893589986842&searchTestGroup=1_944_1&iid=-4874559529481084373,"JOB TITLE: SALES ANALYST REPORTS TO: VP,SALES LOCATION: REMOTE FLSA STATUS: EXEMPT SCHEDULED HOURS: STANDARD BUSINESS HOUR MAJOR FUNCTION: The sales analyst will be responsible for compiling and analyzing sales and market data and providing valuable...",2023-05-06,Remote jobRemote job
IT Engineer / IT Engineer+,https://jooble.org/desc/5064709487671330250?ckey=NONE&rgn=55157&pos=136&elckey=828530011852031490&p=1&sid=-1110650161605457098&jobAge=136&relb=110&brelb=110&bscr=1727.8928397106633&scr=1727.8928397106633&searchTestGroup=1_944_1&iid=-8952598993526996383,"Join one of Ohios fastest growing IT/MSP companies! Proudly serving the great organizations assisting Ohios developmentally disabled, choose a career where you can be part of making a difference to others! Only one opening immediately available. We offer an excellent...",2023-05-06,Remote jobTemporary workRemote jobWork at officeImmediate startWork from home
Business Development &amp; Capture Manager,https://jooble.org/desc/7009483321297823805?ckey=NONE&rgn=55157&pos=137&elckey=828530011852031490&p=1&sid=-1110650161605457098&jobAge=136&relb=110&brelb=110&bscr=1704.19521523476&scr=1704.19521523476&searchTestGroup=1_944_1&iid=2165869003612050308,Job Summary : NavAide is currently seeking a Business Development/Capture Specialist that understands government contracts and will provide support with the development of winning proposals and acquiring new areas of business for NavAide. A successful Business Development...,2023-05-06,Remote jobContract workFor subcontractor
Software Developer JavaScript and / or C# (Web or Backend) (m/f/d),https://jooble.org/desc/1045609823376253271?ckey=NONE&rgn=55157&pos=138&elckey=828530011852031490&p=1&sid=-1110650161605457098&jobAge=16&relb=10&brelb=10&bscr=1664.6641704673248&scr=1664.6641704673248&searchTestGroup=1_944_1&iid=-559840333468913358,Software Developer JavaScript and / or C# (Web or Backend) (m/f/d) Who we are and what we do For 25 years we have been supporting our customers with excellent and very comprehensive software in the field of financial services and have earned the position of market...,2023-05-06,Remote jobPermanent employmentFull timePart timeChristmas workWork at officeTrainingFieldHome officeFlexible hours
Automation technician / mechatronics engineer / PLC programmer (m/f/d),https://jooble.org/desc/-5312026475137373090?ckey=NONE&rgn=55157&pos=139&elckey=828530011852031490&p=1&sid=-1110650161605457098&jobAge=16&relb=10&brelb=10&bscr=1664.6641704673248&scr=1664.6641704673248&searchTestGroup=1_944_1&iid=-8620574522494948995,"Automation technician:in / mechatronics technician:in / PLC programmer:in Custom. Robotics. Live! We develop custom camera systems that can be manually controlled or fully automated. Our products are used worldwide in news studios, on television shows, at international...",2023-05-06,Remote jobTemporary workFieldWorldwideTravel
Computer scientist:in (f/m/d),https://jooble.org/desc/-2898011867292086129?ckey=NONE&rgn=55157&pos=140&elckey=828530011852031490&p=1&sid=-1110650161605457098&jobAge=16&relb=10&brelb=10&bscr=1655.1934181143047&scr=1655.1934181143047&searchTestGroup=1_944_1&iid=5255741907359833402,"At the University of Bremen, in the Department 11 - Human and Health Sciences, in the research groups General Psychology, Research Methods and Cognitive Psychology, Developmental Psychology with Educational Psychology and Social Psychology with Industrial and Organizational...",2023-05-06,Remote jobPart timeTrainingFieldFlexible hours
Subject Matter Specialist,https://jooble.org/desc/7829619684579541943?ckey=NONE&rgn=55157&pos=141&elckey=828530011852031490&p=1&sid=-1110650161605457098&jobAge=136&relb=110&brelb=110&bscr=1626.8888406758938&scr=1626.8888406758938&searchTestGroup=1_944_1&iid=7283543451792421842,"Subject Matter Specialist (SMS) - Department of the Navy (DoN) General Ledger System Data Cleansing Project Position Overview: We are seeking a highly experienced Subject Matter Specialist (SMS) with a strong background in financial management, data cleansing, or...",2023-05-06,Remote jobTrainingField
Project Manager (m/f/d) as Product Owner with technical background,https://jooble.org/desc/-6804768622032794706?ckey=NONE&rgn=55157&pos=142&elckey=828530011852031490&p=1&sid=-1110650161605457098&jobAge=16&relb=10&brelb=10&bscr=1574.155335654023&scr=1574.155335654023&searchTestGroup=1_944_1&iid=8844385908818216525,"Project Manager (m/f/d) as Product Owner with technical background. We are an established, expanding Aachen-based company and specialist in the WiFi sector. Future-oriented technology is our passion and to always think one step ahead, we need a team of forward thinkers...",2023-05-06,Remote jobPermanent employmentImmediate startField
IT Administrator (f/m/d) Linux Systems,https://jooble.org/desc/-9087018313877822004?ckey=NONE&rgn=55157&pos=143&elckey=828530011852031490&p=1&sid=-1110650161605457098&jobAge=16&relb=10&brelb=10&bscr=1547.8666592296786&scr=1547.8666592296786&searchTestGroup=1_944_1&iid=-214504084345018937,"IT Administrator (f/m/d) Linux Systems - indefinite - For our Operating Systems and Operating team we are looking for an IT Administrator (f/m/d) Linux Systems as soon as possible. In this role, you will be responsible for topics and processes related to the ...",2023-05-06,Remote jobWork experience placementTrainingFieldWork from homeHome officeFlexible hours
IT Specialist System Integration / Electrical Engineer (m/f/d),https://jooble.org/desc/6015053984145166260?ckey=NONE&rgn=55157&pos=144&elckey=828530011852031490&p=1&sid=-1110650161605457098&jobAge=16&relb=10&brelb=10&bscr=1517.0179771369785&scr=1517.0179771369785&searchTestGroup=1_944_1&iid=1277008792743972383,"IT Specialist:in System Integration / Electrical Engineer:in (m/f/d) Taunusstr. 51, 80807 Munich, Germany Full-time red-ant is an owner-managed, medium-sized company that offers intelligent system solutions for all issues related to vibration measurement...",2023-05-06,Remote jobFull timeContract workPart timeTrainingImmediate startFieldFlexible hours
Community Manager / Online Editor (m/f/d) full-time,https://jooble.org/desc/1903271105908365442?ckey=NONE&rgn=55157&pos=145&elckey=828530011852031490&p=1&sid=-1110650161605457098&jobAge=16&relb=10&brelb=10&bscr=1517.0179771369785&scr=1517.0179771369785&searchTestGroup=1_944_1&iid=-2426238931581275511,"Community Manager / Online Editor (m/f/d) full time JTL-Software is a developer and provider of innovative e-commerce software, which facilitates the everyday life of online merchants in all business areas and helps them to grow. Among the best known are the ERP system...",2023-05-06,Remote jobFull timeOnlineImmediate startFieldWithout location
"System Administrator (m/f/d) - Focus on Windows Server, VMware and Network",https://jooble.org/desc/5096005208578821558?ckey=NONE&rgn=55157&pos=146&elckey=828530011852031490&p=1&sid=-1110650161605457098&jobAge=16&relb=10&brelb=10&bscr=1472.5010062002827&scr=1472.5010062002827&searchTestGroup=1_944_1&iid=-7161625410957972603,"To expand our team we are looking for you as System Administrator (m/f/d) - focus on Windows Server, VMware and network. Permanent position, full-time - Hamburg Your areas of responsibility Configuration, administration, monitoring, maintenance and...",2023-05-06,Remote jobPermanent employmentFull timeRemote jobWork at officeWork from homeHome office
IT-Security Consultant - Informatiker (m/w/d),https://jooble.org/desc/8859593188010156131?ckey=NONE&rgn=55157&pos=147&elckey=828530011852031490&p=1&sid=-1110650161605457098&jobAge=16&relb=10&brelb=10&bscr=1440.6876290875634&scr=1440.6876290875634&searchTestGroup=1_944_1&iid=5284626501653235958,Hesse ministry of the Interior and for Sport The Hessian Ministry of the Interior and for Sport has a vacancy for the next possible date as a IT Security Consultant - Computer Scientist (m/f/d) to be filled in Unit VII 12 Hessen CyberCompetenceCenter...,2023-05-06,Remote jobPermanent employmentFull timePart timeWork experience placementTrainingOnlineLocal areaFieldUnitWithout locationTravelFlexible hours
Lead Regional Customer Application Engineer (RCAE),https://jooble.org/desc/-2189287154316288433?ckey=NONE&rgn=55157&pos=148&elckey=828530011852031490&p=1&sid=-1110650161605457098&jobAge=40&relb=100&brelb=100&bscr=1376.7519936528915&scr=1376.7519936528915&searchTestGroup=1_944_1&iid=-3283372613090191110,"Job Description Summary The Regional Customer Application Engineer (RCAE) is the primary technical interface with New Unit Customers, mainly in North America, during the pre-ITO (pre-Inquiry-To-Order) phase (i.e. prior to a firm proposal). She/He is responsible at the...",2023-05-06,Remote jobRemote jobOnlineUnitTravel
IT-Cloud-Engineer (m/w/d),https://jooble.org/desc/-4617232849368527577?ckey=NONE&rgn=55157&pos=149&elckey=828530011852031490&p=1&sid=-1110650161605457098&jobAge=22&relb=10&brelb=10&bscr=1368.449565027895&scr=1368.449565027895&searchTestGroup=1_944_1&iid=8149627472209668994,"Cutting-edge research for a changing world IT Cloud Engineer (m/f/d) Reference code: 50093735_2 - 2023/IT 1 Start date: as soon as possible Place of work: Geesthacht Application deadline: 04.06.2023 In the IT division, we are looking for an IT ...",2023-05-06,Remote jobPermanent employmentFull timePrivateFieldUnitEapWithout locationFlexible hours
IT System Administration (f/m/d) VMware Focus Storage,https://jooble.org/desc/-1511103934162304885?ckey=NONE&rgn=55157&pos=150&elckey=828530011852031490&p=1&sid=-1110650161605457098&jobAge=16&relb=10&brelb=10&bscr=1368.1530457398737&scr=1368.1530457398737&searchTestGroup=1_944_1&iid=-4969850951473494418,"IT System Administration (f/m/d) VMware focus Storage uk-it business unit As of the next possible Date Full-time; indefinite Remuneration is in accordance with the provisions of the TV-L Your tasks In your role, you will be involved...",2023-05-06,Remote jobFull timePart timeApprenticeshipTrainingUnit
Native tutor wanted for online Arabic tutoring job,https://jooble.org/desc/6859826611071806645?ckey=NONE&rgn=55157&pos=151&elckey=828530011852031490&p=1&sid=-1110650161605457098&jobAge=13&relb=110&brelb=110&bscr=1362.8418214428068&scr=1362.8418214428068&searchTestGroup=1_944_1&iid=656863064748512108,Tutoring jobs in Online: Arabic. Specialties: General. Age range of target audience: Not Specified (1-100). I want understanding and reading Arabic because my kids needs for my help so that I looking for best teacher who can help me with it… Responsibilities:...,2023-05-06,Remote jobOnlineFlexible hours
Online Chinese private teacher priced up to $15 is wanted.,https://jooble.org/desc/-1218759857964108287?ckey=NONE&rgn=55157&pos=152&elckey=828530011852031490&p=1&sid=-1110650161605457098&jobAge=13&relb=110&brelb=110&bscr=1343.188952770086&scr=1343.188952770086&searchTestGroup=1_944_1&iid=7990969321189107184,Tutoring jobs in Online: Chinese. Specialties: General. Age range of target audience: Not Specified (1-100). How are you doing I need a Chinese tutor to translate some company books can you be able to do it? Responsibilities: Identify the main objectives...,2023-05-06,Remote jobOnlinePrivateFlexible hours
IT Security Expert (m/f/div),https://jooble.org/desc/2309477671929813103?ckey=NONE&rgn=55157&pos=153&elckey=828530011852031490&p=1&sid=-1110650161605457098&jobAge=16&relb=10&brelb=10&bscr=1332.8742560302628&scr=1332.8742560302628&searchTestGroup=1_944_1&iid=-6127248358395988646, IT Security Expert (m/f/div) Join us immediately part-time or full-time as a ,2023-05-06,Remote jobFull timePart timeImmediate start
Senior IT Administrator - Cloud &amp; Business Applications (m/w/d),https://jooble.org/desc/5818592281087775119?ckey=NONE&rgn=55157&pos=154&elckey=828530011852031490&p=1&sid=-1110650161605457098&jobAge=16&relb=10&brelb=10&bscr=1332.8742560302628&scr=1332.8742560302628&searchTestGroup=1_944_1&iid=8527640799374151738,"AeroLogic is a modern, fast-growing cargo airline based at Leipzig/Halle Airport. AeroLogic was founded in 2007 as a joint venture between DHL Express and Lufthansa Cargo. With a state-of-the-art fleet of 21 Boeing 777Fs, it flies primarily to destinations in Asia and ...",2023-05-06,Remote jobPermanent employmentContract workTrainingOnlineImmediate startFieldWithout location
IT System­administrator (m/w/d),https://jooble.org/desc/5759594127368153994?ckey=NONE&rgn=55157&pos=155&elckey=828530011852031490&p=1&sid=-1110650161605457098&jobAge=16&relb=10&brelb=10&bscr=1332.577736742242&scr=1332.577736742242&searchTestGroup=1_944_1&iid=6984858893877651745,"Get on board with us! As a leader in the growing international motorhome market, the Eura Mobil Group has established a strong position. With the Eura Mobil, Karmann-Mobil and Forster brands, we cover the entire spectrum of modern, high-quality motorhomes. As...",2023-05-06,Remote jobPermanent employmentFull timeTrainingOnlineLocal areaField
Slovakça dilinde uygun fiyatlı öğretmen $30 civarında Slovakça özel öğretmeni aranıyor.,https://jooble.org/desc/1982185945134048265?ckey=NONE&rgn=55157&pos=156&elckey=828530011852031490&p=1&sid=-1110650161605457098&jobAge=13&relb=110&brelb=110&bscr=1327.5800558258272&scr=1327.5800558258272&searchTestGroup=1_944_1&iid=-4863406181405639288,Tutoring jobs in Online: Slovak. Specialties: General. Age range of target audience: Not Specified (1-100). Merhaba Ben turkiyede Istanbul sehrinde yasiyorum. Slovak dilini ogretecek türkce ogretmen istiyorum. Bana nasil yardimci olabilirsiniz Responsibilities...,2023-05-06,Remote jobOnlineFlexible hours
Amazon Channel Operations Manager,https://jooble.org/desc/3685150850857993137?ckey=NONE&rgn=55157&pos=157&elckey=828530011852031490&p=1&sid=-1110650161605457098&jobAge=13&relb=100&brelb=100&bscr=1319.5200016193298&scr=1319.5200016193298&searchTestGroup=1_944_1&iid=593434668161903008,"Plus EV Holdings is a dynamic and successful e-commerce business that prides itself on delivering high-quality products and exceptional customer service. They operate on two primary sales channels: Amazon and Shopify, and they specialise in producing a diverse range of...",2023-05-06,Remote jobHourly payFull timeRemote jobPart timeFor contractorsFreelanceSecond jobWork at officeTrainingFlexible hours
Remote Technical Support Tier 2 (German Speaking) - EMEA,https://jooble.org/desc/-8195948915031170825?ckey=NONE&rgn=55157&pos=158&elckey=828530011852031490&p=1&sid=-1110650161605457098&jobAge=16&relb=100&brelb=100&bscr=1307.3325336890093&scr=1307.3325336890093&searchTestGroup=1_944_1&iid=920411403486563858,"Degreed is the upskilling platform that connects learning to opportunities. We integrate everything people use to learn and build their careers—skill insights, LMSs, courses, videos, articles, and projects—and match everyone to growth opportunities that fit their unique...",2023-05-06,Remote jobRemote jobWork at officeTrainingLocal areaHome officeShift workRotating shift
Software Developer Java / Fullstack (m/f/d),https://jooble.org/desc/2418177850743155108?ckey=NONE&rgn=55157&pos=159&elckey=828530011852031490&p=1&sid=-1110650161605457098&jobAge=16&relb=10&brelb=10&bscr=1295.5759847181807&scr=1295.5759847181807&searchTestGroup=1_944_1&iid=5981949371081420623,"DG Nexolution designs and develops innovative solutions for companies in the cooperative network and beyond. Whether payment, procurement or marketing solutions, online stores, digital platforms or when it comes to effectively implementing sustainability - we are pioneers...",2023-05-06,Remote jobInterim roleTrainingOnlinePrivateFieldFlexible hours
IT Specialist Central Logging and Logging (m/f/d),https://jooble.org/desc/7932952745739589719?ckey=NONE&rgn=55157&pos=160&elckey=828530011852031490&p=1&sid=-1110650161605457098&jobAge=16&relb=10&brelb=10&bscr=1295.5759847181807&scr=1295.5759847181807&searchTestGroup=1_944_1&iid=-2683623612218354126,Join us immediately part-time or full-time as. /*Your tasks The IT Operations department operates and monitors the entire IT infrastructure and all IT procedures of the Pension Insurance Data Office (DSRV) as well as central services for all pension insurance...,2023-05-06,Remote jobFull timePart timeWork at officeTrainingImmediate startField
I want to have learning sessions online with a positive Spanish tutor who will give me different activities,https://jooble.org/desc/3300293517909104240?ckey=NONE&rgn=55157&pos=161&elckey=828530011852031490&p=1&sid=-1110650161605457098&jobAge=13&relb=110&brelb=110&bscr=1272.4799256279225&scr=1272.4799256279225&searchTestGroup=1_944_1&iid=5968862901674620435,Tutoring jobs in Online: Spanish. Specialties: General. Age range of target audience: Not Specified (1-100). I love your video! I would like my daughter to learn Spanish as she has some new Spanish speaking classmates. She is 8 years old. Do you happen to...,2023-05-06,Remote jobOnlineFlexible hours
