title,link,description,pubdate,location
Senior Sales Engineer,https://jooble.org/desc/-5662297785306253561?ckey=NONE&rgn=55157&pos=41&elckey=828530011852031490&p=1&sid=-1110650161605457098&jobAge=136&relb=110&brelb=110&bscr=11791.788914091494&scr=11791.788914091494&searchTestGroup=1_944_1&iid=-5164669565806222558,"Senior Sales Engineer Overview of Role ZwitterCo is seeking an energetic, versatile senior sale engineer to drive sales of its cutting-edge membrane solutions into fast-growing, high-impact applications including sustainable protein production, water and wastewater...",2023-05-06,Remote jobContract workRemote jobWork experience placementWork at officeTrainingPrivateTravel
Product Designer - EdTech - SaaS,https://jooble.org/desc/61956891434880683?ckey=NONE&rgn=55157&pos=42&elckey=828530011852031490&p=1&sid=-1110650161605457098&jobAge=136&relb=110&brelb=110&bscr=11791.788914091494&scr=11791.788914091494&searchTestGroup=1_944_1&iid=-4032950834375967026,Transeo (we provide software solutions to schools and school districts nationwide) is growing and seeking a Product Designer for our software development team.&nbsp; Position Overview Lead and collaborate on User Centered Design sessions Produce clickable prototypes...,2023-05-06,Remote jobFull timeRemote jobOnlineField
Project Data Assistant,https://jooble.org/desc/-6548036301890033528?ckey=NONE&rgn=55157&pos=43&elckey=828530011852031490&p=1&sid=-1110650161605457098&jobAge=136&relb=110&brelb=110&bscr=11788.675276777192&scr=11788.675276777192&searchTestGroup=1_944_1&iid=9001913798777638075,"Everlight Solar is seeking a skilled, data-minded individual to be an assistant to our Solar Project Manager. Our project managers and assistants oversee and coordinate the entire process for company projects, assisting customers, team members, and contractors, ensuring...",2023-05-06,Remote jobFull timeRemote jobFor contractorsFor subcontractorWork at officeFieldWork from home
Nurse Virtual Command Center,https://jooble.org/desc/-8760919837741526143?ckey=NONE&rgn=55157&pos=44&elckey=828530011852031490&p=1&sid=-1110650161605457098&jobAge=6&relb=100&brelb=100&bscr=11742.853365054938&scr=11742.853365054938&searchTestGroup=1_944_1&iid=-7719581245835043216,"Overview MercyOne Des Moines Medical Center has a unique opportunity for an RN, BSN candidate who is interested in delivering patient care through remote bedside nursing from our new Virtual Command Center (VCC) located in the Medical Center. . The ideal nurse...",2023-05-06,Remote jobRemote jobUnit
Application Manager (m/w/d),https://jooble.org/desc/-1119618974512845939?ckey=NONE&rgn=55157&pos=45&elckey=828530011852031490&p=1&sid=-1110650161605457098&jobAge=22&relb=10&brelb=10&bscr=11728.341948031652&scr=11728.341948031652&searchTestGroup=1_944_1&iid=3005084386171529940,"Application Manager (m/f/d) APPLICATION MANAGER* WHO WE ARE Do IT yourself is our credo. To meet the constantly changing demands on our IT, we have NEW YORKER Information Services International (ISI), where we keep all core competencies in-house. More than...",2023-05-06,Remote jobWork experience placementTrainingFieldWorldwide
IT-Koordinator (m/w/d),https://jooble.org/desc/-6258401813870475111?ckey=NONE&rgn=55157&pos=46&elckey=828530011852031490&p=1&sid=-1110650161605457098&jobAge=16&relb=10&brelb=10&bscr=11728.341948031652&scr=11728.341948031652&searchTestGroup=1_944_1&iid=7280744815500513240,"IT Coordinator:in (m/f/d) The RhineMain University of Applied Sciences with its study locations in Wiesbaden and Rüsselsheim sees itself as a cosmopolitan, diverse university. It is recognized for its academically sound and professionally qualifying teaching as well...",2023-05-06,Remote jobFull timeTrainingOnlineFieldEapWithout locationFlexible hours
Module Administrator / Developer SAP EWM (m/f/d),https://jooble.org/desc/-3358204930928055320?ckey=NONE&rgn=55157&pos=47&elckey=828530011852031490&p=1&sid=-1110650161605457098&jobAge=16&relb=10&brelb=10&bscr=11728.341948031652&scr=11728.341948031652&searchTestGroup=1_944_1&iid=-5865548044316512421,"Position: Module support/developer SAP EWM (m/f/d) Type: Part-time Location: Hamberger Service GmbH, Stephanskirchen Founded in 1866, Hamberger is now a market-leading manufacturer of wooden floor coverings and toilet seats with 2,600 employees. ...",2023-05-06,Remote jobPart timeTrainingPrivateWorldwideFlexible hours
Enterprise Architecture Manager (m/w/d),https://jooble.org/desc/4855861046879283042?ckey=NONE&rgn=55157&pos=48&elckey=828530011852031490&p=1&sid=-1110650161605457098&jobAge=16&relb=10&brelb=10&bscr=11728.341948031652&scr=11728.341948031652&searchTestGroup=1_944_1&iid=-8252745675382401111,"As the central IT business partner of the MVV Group, we and our 190 employees are consistently tackling the challenges of digitalization and making a significant contribution to a stable and sustainable energy supply. You too can play an active role in shaping our...",2023-05-06,Remote jobFull timeOnlineImmediate startHome officeWithout locationFlexible hours
IT Test Expert (w/m/d),https://jooble.org/desc/2882267155402176210?ckey=NONE&rgn=55157&pos=49&elckey=828530011852031490&p=1&sid=-1110650161605457098&jobAge=22&relb=10&brelb=10&bscr=11728.341948031652&scr=11728.341948031652&searchTestGroup=1_944_1&iid=-2465150893407978343,"IT Test Expert (f/m/d) Bookmark Share At the Cologne or Wermelskirchen location Location: Wermelskirchen Contract type: Full-time - Unlimited As an IT Test Expert (m/f/d) at OBI, you advise our stakeholders from business and development departments...",2023-05-06,Remote jobFull timeContract workTrainingWorldwide
Generative AI Engineer (m/w/d),https://jooble.org/desc/-3739171121798743552?ckey=NONE&rgn=55157&pos=50&elckey=828530011852031490&p=1&sid=-1110650161605457098&jobAge=16&relb=10&brelb=10&bscr=11725.228310717348&scr=11725.228310717348&searchTestGroup=1_944_1&iid=5459430263334460323,"New Generative AI Engineer (m/w/d) Karlsruhe, Germany (hybrid) Employee Software Development 80.000 € to 140.000 € / year Paramax is an innovative startup revolutionizing the film industry through AI-powered movie creation tools. Our mission...",2023-05-06,Remote jobRemote jobWork at officeTrainingOnline
Site Identification Specialist I,https://jooble.org/desc/-4652377056279591679?ckey=NONE&rgn=55157&pos=51&elckey=828530011852031490&p=1&sid=-1110650161605457098&jobAge=4504&relb=100&brelb=100&bscr=11710.681859135919&scr=11710.681859135919&searchTestGroup=1_944_1&iid=8658400291772990192,"ICON plc is a world-leading healthcare intelligence and clinical research organization. From molecule to medicine, we advance clinical research providing outsourced services to pharmaceutical, biotechnology, medical device and government and public health organizations...",2023-05-06,Remote jobRemote jobLocal areaOutsourcing
"Early Childhood Educator, Montessori Specialist (Contractor)",https://jooble.org/desc/4669166402416801427?ckey=NONE&rgn=55157&pos=52&elckey=828530011852031490&p=1&sid=-1110650161605457098&jobAge=136&relb=110&brelb=110&bscr=11684.317990582982&scr=11684.317990582982&searchTestGroup=1_944_1&iid=-8982131128265381978,"About Lovevery&nbsp; Lovevery is a fast-growing digitally native brand co-founded by successful serial entrepreneurs and based in Boise, Idaho. Our customers are parents, and our mission is to help them feel confident they are giving their children meaningful development ...",2023-05-06,Remote jobContract workFor contractorsField
Remote Director of Partnerships,https://jooble.org/desc/-6365885273603311699?ckey=NONE&rgn=55157&pos=53&elckey=828530011852031490&p=1&sid=-1110650161605457098&jobAge=16&relb=100&brelb=100&bscr=11682.309873597726&scr=11682.309873597726&searchTestGroup=1_944_1&iid=-7774166184828895948,"Nacelle is a composable commerce platform provider that allows brands and retailers to easily syndicate commerce and content data to multiple heads, endpoints and channels by transforming, storing and reindexing data in real-time. With Nacelle, companies can future-proof...",2023-05-06,Remote jobHoliday workTemporary workRemote jobWork experience placementTrainingHome office
"Director, Brand Partnerships &amp; Sales",https://jooble.org/desc/-7122044244189379330?ckey=NONE&rgn=55157&pos=54&elckey=828530011852031490&p=1&sid=-1110650161605457098&jobAge=136&relb=110&brelb=110&bscr=11631.99297745209&scr=11631.99297745209&searchTestGroup=1_944_1&iid=4052975769208123741,"Director, Brand Partnerships &amp; Sales Create &amp; Cultivate is a market-leading brand that aims to educate and empower ambitious women to launch or scale their businesses and define success on their terms. We are an original player in our space and have helped mold the...",2023-05-06,Remote jobRemote jobWork at officeTravel
IT Systemadministrator (m/w/d),https://jooble.org/desc/6357316475503407822?ckey=NONE&rgn=55157&pos=55&elckey=828530011852031490&p=1&sid=-1110650161605457098&jobAge=16&relb=10&brelb=10&bscr=11623.716516112469&scr=11623.716516112469&searchTestGroup=1_944_1&iid=-2179438718458234835,vvrb.com Become a part of the successful concept of the Vereinigte Volksbank Raiffeisenbank eG. We are a successful and future-oriented Volks- und Raiffeisenbank. Our employees are the most important factor in our success. With total assets of around 4.2 billion...,2023-05-06,Remote jobFull timeRemote jobTrainingHome office
Application Developer Java (f/m/d),https://jooble.org/desc/-1009563710270433209?ckey=NONE&rgn=55157&pos=56&elckey=828530011852031490&p=1&sid=-1110650161605457098&jobAge=16&relb=10&brelb=10&bscr=11623.716516112469&scr=11623.716516112469&searchTestGroup=1_944_1&iid=7514305507481350498,"Application Developer Java (f/m/d) Are you looking for an attractive, versatile and innovative job in an IT task area with the highest standards of security and efficiency in a public service environment? You want to meet the challenges of a modern IT service provider...",2023-05-06,Remote jobPart timeTrainingFieldTravelFlexible hours
Research assistant in the field of medical informatics,https://jooble.org/desc/-111418355997311856?ckey=NONE&rgn=55157&pos=57&elckey=828530011852031490&p=1&sid=-1110650161605457098&jobAge=16&relb=10&brelb=10&bscr=11623.716516112469&scr=11623.716516112469&searchTestGroup=1_944_1&iid=-1283776868127021069,"Jobs with a view Modern - Competent - Innovative Jobs with a view Modern - Competent - Innovative Digitization in medicine offers enormous potential to improve medical research and patient care. To exploit this potential, Dresden University Medical Center...",2023-05-06,Remote jobFull timeTemporary workTrainingOnlineFieldHome officeFlexible hours
Administrator (m/f/d) Consulting Cybersecurity,https://jooble.org/desc/-615223498746786426?ckey=NONE&rgn=55157&pos=58&elckey=828530011852031490&p=1&sid=-1110650161605457098&jobAge=16&relb=10&brelb=10&bscr=11623.716516112469&scr=11623.716516112469&searchTestGroup=1_944_1&iid=1018865046596898901,"Hesse ministry of the Interior and for Sport In the Hessian Ministry of the Interior and for Sport in Department VII Cyber and IT Security, Administrative Digitization in Unit VII 12 Hessen Cyber Competence Center (Hessen3C) is available as soon as possible ...",2023-05-06,Remote jobHoliday workPermanent employmentPart timeWork at officeTrainingOnlineFieldUnitWithout locationTravelFlexible hours
Jaimerais trouver un tuteur diplômé pour maider à apprendre la Anglaise,https://jooble.org/desc/-6480271185785800553?ckey=NONE&rgn=55157&pos=59&elckey=828530011852031490&p=1&sid=-1110650161605457098&jobAge=13&relb=110&brelb=110&bscr=11583.340167511731&scr=11583.340167511731&searchTestGroup=1_944_1&iid=4808106584050269298,Tutoring jobs in Online: English. Specialties: General. Age range of target audience: Not Specified (1-100). Je souhaiterais passer une certificatrice C1 pour mes études supérieures. Jai 16ans et jai un niveau B1/B2. Jaimerais savoir sil serait possible...,2023-05-06,Remote jobOnlineFlexible hours
DevOps Engineer (m/w/d),https://jooble.org/desc/3503685327389662154?ckey=NONE&rgn=55157&pos=60&elckey=828530011852031490&p=1&sid=-1110650161605457098&jobAge=16&relb=10&brelb=10&bscr=11514.402424145253&scr=11514.402424145253&searchTestGroup=1_944_1&iid=4557798512212733025,"DevOps Engineer (m/f/d) DG Nexolution designs and develops innovative solutions for companies from the cooperative network and beyond. Whether payment, procurement or marketing solutions, online stores, digital platforms or when it comes to effectively implementing...",2023-05-06,Remote jobContract workWork at officeOnlineFieldHome officeFlexible hours
Systemadministrator (w/m/d),https://jooble.org/desc/-2796406428623770993?ckey=NONE&rgn=55157&pos=61&elckey=828530011852031490&p=1&sid=-1110650161605457098&jobAge=16&relb=10&brelb=10&bscr=11514.402424145253&scr=11514.402424145253&searchTestGroup=1_944_1&iid=-1805719895388128454,"System Administrator (f/m/d) At the Rottenburg University of Applied Forest Sciences, there is a permanent opening in the Computer Center for a System Administration position to begin as soon as possible. Possible areas of responsibility : Administration of ...",2023-05-06,Remote jobPermanent employmentFull timePart timeWork at officeTrainingImmediate startField
Employee for quality assurance (m/f/d),https://jooble.org/desc/6471675484947279956?ckey=NONE&rgn=55157&pos=62&elckey=828530011852031490&p=1&sid=-1110650161605457098&jobAge=20&relb=10&brelb=10&bscr=11514.402424145253&scr=11514.402424145253&searchTestGroup=1_944_1&iid=-3554818225074697089,"We are a company in the steel processing industry. We supply toolmakers and machine builders in the domestic and foreign countries with machined steel components, which we produce at our plant in Nettetal-Kaldenkirchen. Do you have a high demand on your quality ...",2023-05-06,Remote jobPermanent employmentContract workDomestic
(Business) Computer Scientist for Processes and Automation (m/f/d),https://jooble.org/desc/3745458034840103849?ckey=NONE&rgn=55157&pos=63&elckey=828530011852031490&p=1&sid=-1110650161605457098&jobAge=20&relb=10&brelb=10&bscr=11514.402424145253&scr=11514.402424145253&searchTestGroup=1_944_1&iid=1797394763410758248,"The Deutsche Bundesbank is a special bank. Together with the ECB and the other European central banks, we ensure a stable euro. For this and other central bank tasks, we need a wide variety of specialists in skilled trades to make the institution work. Become part of something...",2023-05-06,Remote jobPermanent employmentFull timePart timeBank staffOnlineFieldWork from homeHome office
Team Leader IT Server Infrastructure (m/f/d) Food Production,https://jooble.org/desc/-7949439053950699290?ckey=NONE&rgn=55157&pos=64&elckey=828530011852031490&p=1&sid=-1110650161605457098&jobAge=16&relb=10&brelb=10&bscr=11514.402424145253&scr=11514.402424145253&searchTestGroup=1_944_1&iid=2733340389750694645,"DMK Group, Germanys largest dairy cooperative, supplies retailers and industry with high-quality dairy products. Whether yogurt, cheese, ice cream or baby food - we produce according to state-of-the-art standards and get the best out of milk. With brands such as MILRAM...",2023-05-06,Remote jobChristmas workWork at officeTrainingOnline
Servicemanager (w/m/d),https://jooble.org/desc/-7116844228675560167?ckey=NONE&rgn=55157&pos=65&elckey=828530011852031490&p=1&sid=-1110650161605457098&jobAge=16&relb=10&brelb=10&bscr=11514.402424145253&scr=11514.402424145253&searchTestGroup=1_944_1&iid=-6178286196204130984,"Service Manager (f/m/d) Are you looking for an attractive, versatile and innovative job in an IT task area with the highest standards of security and efficiency in a public service environment? You want to meet the challenges of a modern IT service provider in the...",2023-05-06,Remote jobFull timeContract workUnitTravelFlexible hours
Fullstack Developer Web (m/f/d),https://jooble.org/desc/-5366908154001618743?ckey=NONE&rgn=55157&pos=66&elckey=828530011852031490&p=1&sid=-1110650161605457098&jobAge=16&relb=10&brelb=10&bscr=11514.402424145253&scr=11514.402424145253&searchTestGroup=1_944_1&iid=-4278325000997470648,"We are an established, expanding Aachen-based company and specialist in the WiFi sector. Future-oriented technology is our passion and to always think one step ahead, we need a team of forward thinkers. You want responsibility and are looking for challenges? Then...",2023-05-06,Remote jobPermanent employmentImmediate start
System administrator (m/f/d) for scientific programming,https://jooble.org/desc/-6090978546580932132?ckey=NONE&rgn=55157&pos=67&elckey=828530011852031490&p=1&sid=-1110650161605457098&jobAge=16&relb=10&brelb=10&bscr=11514.402424145253&scr=11514.402424145253&searchTestGroup=1_944_1&iid=-595747468514636137,"Heinrich-Heine-University Düsseldorf is looking for a*n for the Institute for Quantitative and Theoretical Biology and the Center for Advanced Imaging as soon as possible, permanent and full-time. System Administrator* (m/f/d) for scientific programming. EGr....",2023-05-06,Remote jobPermanent employmentFull timeTrainingField
Referent Portfolio Management (m/w/d),https://jooble.org/desc/-5260592349460821124?ckey=NONE&rgn=55157&pos=68&elckey=828530011852031490&p=1&sid=-1110650161605457098&jobAge=16&relb=10&brelb=10&bscr=11514.402424145253&scr=11514.402424145253&searchTestGroup=1_944_1&iid=-6561840786581364361, Portfolio Management Officer (m/f/d) Join us immediately part-time and full-time as a ,2023-05-06,Remote jobFull timePart timeImmediate start
Application Manager (m/f/d) SAP PP/PS,https://jooble.org/desc/8398384958014599421?ckey=NONE&rgn=55157&pos=69&elckey=828530011852031490&p=1&sid=-1110650161605457098&jobAge=16&relb=10&brelb=10&bscr=11514.402424145253&scr=11514.402424145253&searchTestGroup=1_944_1&iid=-8093535559293736892,"With over 5,900 colleagues, we as the WITRON Group are the strong partner for highly automated logistics systems. From planning to realization to maintenance. Our teams - responsible for far more than just mechanics, electronics, mechatronics - pay attention to the clock...",2023-05-06,Remote jobWork at officeOnlineImmediate start
Senior IT Project Manager (m/w/d),https://jooble.org/desc/6405487674429281202?ckey=NONE&rgn=55157&pos=70&elckey=828530011852031490&p=1&sid=-1110650161605457098&jobAge=16&relb=10&brelb=10&bscr=11514.402424145253&scr=11514.402424145253&searchTestGroup=1_944_1&iid=1142189337632931513,"As the central IT business partner of the MVV Group, we and our 190 employees are consistently tackling the challenges of digitalization and making a significant contribution to a stable and sustainable energy supply. You too can play an active role in shaping our...",2023-05-06,Remote jobFull timeOnlineImmediate startUnitWithout locationFlexible hours
Team Leader IT (m/f/d),https://jooble.org/desc/5785990854067897179?ckey=NONE&rgn=55157&pos=71&elckey=828530011852031490&p=1&sid=-1110650161605457098&jobAge=16&relb=10&brelb=10&bscr=11514.402424145253&scr=11514.402424145253&searchTestGroup=1_944_1&iid=6412305023648136702,"The Martin Group consists of four locations with a total of 750 employees. As a globally active specialist for metal forming and a long-standing partner of the automotive industry worldwide, we develop and produce components for e-mobility, welded and riveted assemblies...",2023-05-06,Remote jobPermanent employmentFull timeTrainingOnlineImmediate startWorldwideFlexible hours
Software Developer C/C++ (m/f/d),https://jooble.org/desc/-3802742587760734045?ckey=NONE&rgn=55157&pos=72&elckey=828530011852031490&p=1&sid=-1110650161605457098&jobAge=16&relb=10&brelb=10&bscr=11501.617431927934&scr=11501.617431927934&searchTestGroup=1_944_1&iid=7818130034458885942,We are growing. To strengthen our team at our location in Gilching (near Munich) we are looking for an immediate Software Developer C/C++ (m/f/d) Tasks: Further development of our C++/Qt-Windows application software. Software development in ...,2023-05-06,Remote jobImmediate startFieldWithout locationFlexible hours
IT Project Management (m/f/d),https://jooble.org/desc/-1004653489552066286?ckey=NONE&rgn=55157&pos=73&elckey=828530011852031490&p=1&sid=-1110650161605457098&jobAge=16&relb=10&brelb=10&bscr=11501.617431927934&scr=11501.617431927934&searchTestGroup=1_944_1&iid=-930256338196459303,"IT Project Management (m/f/d) Freiburg im Breisgau, unlimited, full time Who we are With around 850 employees, the Evangelische Stadtmission Freiburg e.V. is one of the largest employers in the region. As a social institution with over 400 volunteers, we ...",2023-05-06,Remote jobPermanent employmentFull timeWork experience placementReliefTrainingField
Team Leader Product Development Software,https://jooble.org/desc/5287935504507834714?ckey=NONE&rgn=55157&pos=74&elckey=828530011852031490&p=1&sid=-1110650161605457098&jobAge=16&relb=10&brelb=10&bscr=11501.617431927934&scr=11501.617431927934&searchTestGroup=1_944_1&iid=3877544240427051441,"About us ENERTRAG provides all services related to renewable energies. We efficiently bring together electricity, heat and mobility in all areas of life. With over two decades of experience in Europe, our more than 800 employees combine all the competencies required...",2023-05-06,Remote jobPermanent employmentFull timeContract workTrainingPrivateWork from homeWithout locationFlexible hoursNight shiftMonday friday
Team Lead (m/w/d) End User Services,https://jooble.org/desc/-835460769416233137?ckey=NONE&rgn=55157&pos=75&elckey=828530011852031490&p=1&sid=-1110650161605457098&jobAge=16&relb=10&brelb=10&bscr=11498.50379461363&scr=11498.50379461363&searchTestGroup=1_944_1&iid=-1797692148259247110,"Team Lead (m/f/d) End User Services Team Lead (m/f/d) - End User Services (Germany and Switzerland) Fendt - A Brand of AGCO Corporation Our long tradition and passion for agriculture make our Fendt brand strong. Since 1997, Fendt has been part of the American...",2023-05-06,Remote jobWork at officeTrainingOnlineFieldWorldwideTravelFlexible hours
IT Network Engineer - Network Administrator (m/f/d),https://jooble.org/desc/6089497933539308784?ckey=NONE&rgn=55157&pos=76&elckey=828530011852031490&p=1&sid=-1110650161605457098&jobAge=16&relb=10&brelb=10&bscr=11498.50379461363&scr=11498.50379461363&searchTestGroup=1_944_1&iid=-7729491928260556397,"thyssenkrupp is an international group of largely independent industrial and technology businesses with around 96,000 employees. In 48 countries the Group generated sales of €41 billion in fiscal year 2021/22. With extensive technology expertise, the businesses and all...",2023-05-06,Remote jobWork experience placementTrainingFieldWork from homeHome officeWithout locationFlexible hours
Clinical Research Associate -CVCC,https://jooble.org/desc/-8329602117732123512?ckey=NONE&rgn=55157&pos=77&elckey=828530011852031490&p=1&sid=-1110650161605457098&jobAge=16&relb=100&brelb=100&bscr=11469.1131596876&scr=11469.1131596876&searchTestGroup=1_944_1&iid=6742644479457644731,"About Childrens Minnesota Childrens Minnesota is one of the largest pediatric health systems in the United States and the only health system in Minnesota to provide care exclusively to children, from before birth through young adulthood. An independent and not...",2023-05-06,Remote jobLocal areaField
IT Service Manager (m/w/d),https://jooble.org/desc/-4411551229521015043?ckey=NONE&rgn=55157&pos=78&elckey=828530011852031490&p=1&sid=-1110650161605457098&jobAge=16&relb=10&brelb=10&bscr=11466.549775521053&scr=11466.549775521053&searchTestGroup=1_944_1&iid=3682437368287656516,"Oberlausitz-Kliniken gGmbH is an enterprise of the district of Bautzen. In the specialties of internal medicine, surgery, gynecology and obstetrics, pediatrics, anesthesiology and intensive care, urology, otolaryngology and ophthalmology and the institutes for diagnostic...",2023-05-06,Remote jobPermanent employmentFull timeWork experience placementTrainingImmediate startField
Application Developer (m/f/d),https://jooble.org/desc/4027817861624076847?ckey=NONE&rgn=55157&pos=79&elckey=828530011852031490&p=1&sid=-1110650161605457098&jobAge=16&relb=10&brelb=10&bscr=11466.549775521053&scr=11466.549775521053&searchTestGroup=1_944_1&iid=7318054365045393434,"Application Developer (m/f/d) Join us immediately part-time or full-time as a /*Your tasks Whether its innovative ideas, simple software solutions or complex IT projects - youll help us advance the digitization of our company and at the same time provide...",2023-05-06,Remote jobPermanent employmentFull timePart timeWork experience placementTrainingImmediate startField
"Lecturer (m/f/d) for advanced training in the area of Operative Professionals (IT System Manager, IT Business Manager)",https://jooble.org/desc/-5658471622537801565?ckey=NONE&rgn=55157&pos=80&elckey=828530011852031490&p=1&sid=-1110650161605457098&jobAge=16&relb=10&brelb=10&bscr=11466.549775521053&scr=11466.549775521053&searchTestGroup=1_944_1&iid=5666309126738149174,"Lecturer (m/f/d) for advanced training courses in the field of operational professionals (IT system manager, IT business manager) Our company The bfw - Unternehmen für Bildung is one of the leading educational service providers in Germany. As a recognized ...",2023-05-06,Remote jobTrainingField
Business Improvement Data Analyst (m/w/d),https://jooble.org/desc/4621420676916742981?ckey=NONE&rgn=55157&pos=81&elckey=828530011852031490&p=1&sid=-1110650161605457098&jobAge=16&relb=10&brelb=10&bscr=11466.549775521053&scr=11466.549775521053&searchTestGroup=1_944_1&iid=-3660136082374117636,"Visit our MEYER WERFT shipyard in Papenburg - and you will get an idea of what progress can look like. Our particular strength is the construction of luxurious cruise ships. In the process, individual components such as propulsion systems, living landscapes, customized...",2023-05-06,Remote jobTrainingOnlineWorldwideWithout locationFlexible hours
