id,title,link,description,pubdate,location,timestamp
43730,Mobile Product Designer,https://remotive.com/remote-jobs/design/mobile-product-designer-1675160,About Matter Matter160is a small but growing startup Our first product is an iOS app that pairs personal experience with universal neuroscience to help everyone understand what8217s happening in their160brain Our goal is to help people live healthier happier longer lives 8212 for themselves and the people around160them Learn more about the160science behind Matter We8217re a small fullyremote team committed to doing our best work For us this means balance We work Monday through Thursday In addition to every Friday we offer 20 vacation days per year plus the last week of December Compensation includes stock options The salary range for this fulltime role is 120000 to 160000 Learn more about160working at Matter 160 Responsibilities You8217ll be working with Chief Designer160Jon Tan160and a small team of designers We try to balance the freedom to explore ideas focused design time and creative support Our first product is in the early stages of design and development so you8217ll play a critical role in helping to shape it Here are some of the other things you8217ll be up to along the160way  Apply humancentered design principles to craft durable inclusive and engaging user experiences Produce prototypes low and hifidelity sketches comps and interfaces Support the creation of a design system and apply it across multiple platforms Collaborate effectively with other designers engineers and writers in a relaxed team structure  Qualifications Ideally you8217re an experienced mobile product designer 8212 used to taking a product from inception to launch 8212 who recognizes the value in having the autonomy and time to do great work College degrees certifications and prestigious accolades are not160required General life experience expertise in your area curiosity and generosity with skills and knowledge are more160important We8217d love to hear about your experience  Designing native mobile apps in particular for iOS from scratch Communicating the thinking behind interfaces and experiences you8217ve designed Using sound haptics and animation to further user experience goals Effectively applying iconography typography and color theory  Benefits Doing meaningful work shouldn8217t come at the expense of building a meaningful life At Matter this160means  Fourday work week Monday through Thursday 20 vacation days of your choice plus the last week in December off Remotefirst work environment work out of our Boulder CO office or wherever else Flexible hours so long as you can accommodate meetings during ET working hours 100 of premium healthcare coverage for you and your dependents  To apply Even though we8217re all pretty experienced we all learn something new almost every day It may be about neuroscience design or technology Or it may be about something else entirely We8217ll be excited to learn from you160too If you8217re interested in this role send the following to160jobsmatterxyz  A paragraph or two about your experience and why you8217re interested in this role Links to an app or two that you8217ve worked on with a couple sentences about your contributions A link to your portfolio or other representation of your work Anything else you8217d like us to know about you or your work  Looking forward to hearing from you Tagged as Seniorlevel ,2023-06-04,NaN,2023-06-04 11:11:38.028654
106381,Associate Recruiter,https://remotive.com/remote-jobs/hr/associate-recruiter-1699156,About the Associate Recruiter position Breeze Unlimited LLC is looking for a talented Associate Recruiter to join our team and participate in the hiring process from beginning to end You will be responsible for attracting candidates evaluating resumes scheduling and conducting interviews and managing the hiring paperwork from the assigned clients160 As a Associate160Recruiter you have thorough knowledge of HR best practices and have innovative ideas If you have strong communication skills and are confident as a headhunter we want to meet you We like working with people who think 8216outsidethebox and who finish projects in a timely manner Ultimately you should be able to manage our full recruitment cycle and ensure we always meet our staff requirements Associate Recruiter responsibilities are   Ability to preform fulldesk recruiting   Knowledge of boolean searches   Working closely with other HR personnels   Updating personnel information   Posting job ads   Recruiting and interviewing candidates   Creating interview questions   Preparing paperwork   Associate Recruiter requirements are   Experience as a Recruiter   Knowledge of HR proceduresregulations   Able to utilize the HR databasesATSs BreezyHR is a plus   Familiar with MS Office softwares   Strong internet connection at home you will be provided with a company computer   Great problemsolving skills   Effective communication skills and familiar with various social networks   ,2023-06-04,NaN,2023-06-04 11:11:38.028710
466238,Senior Game Designer  BitCraft Online,https://remotive.com/remote-jobs/design/senior-game-designer-bitcraft-online-1699108,Clockwork Labs is seeking a creative and experienced Game Designer to join our team and help us bring BitCraft Online to lifeBitCraft is a MMO Sandbox game which puts the focus on crafting building and collaborating with other players through economies instead of combatMoment to moment gameplay plays like a sandbox survival crafting game but there is deep character progression like a traditional MMO Its massively online nature also brings in similar large scale social gameplay with a level of player agency rarely seen every town and everything in it is player made and player run player can shape and develop the world to suit them player orchestrated trade and social politics will be key for organizationAs a Game Designer for BitCraft Online you will help shape a fun and immersive gaming experience that our player community will love Responsibilities  Work closely with the development team to design and implement game mechanics systems and content for long term player enjoyment Develop and balance player progression in skills and abilities ensuring a fun and engaging gameplay experience Collaborate with cross discipline team members to create a cohesive and immersive world for players to explore Actively encourage design feedback from internal and external sources Analyze investigate and validate new ideas and opportunities wherever they may come from  Analyze player feedback and data to improve existing systems and features and develop new content and features to keep players engaged Keep uptodate with industry trends and best practices and share learning experiences that bring new ideas and concepts to the team Requirements Minimum 5 years game design experience Demonstrable deep understanding of gameplay mechanics and player motivation in Survival Crafting Sim MMO andor Sandbox games Keen to work on a small agile team that allows for greater responsibility and ownership Ability to interpret player metrics and use them to prioritize design and development Proficient in efficiently manipulating spreadsheet data to establish and balance content Excellent communication and collaboration skills with the ability to work effectively in a remote global team environment  As a plus Worked on and ideally shipped an MMO sandbox title Technical background in programming or scripting Experience with Unity Photoshop or other image editing experienceportfolio  Knowledge of UX Design BenefitsClockwork Laboratories is a fully remote team We meet daily so successful applicants will ideally be located within a UTC 2 to UTC 7 timezone Our goal is to provide fair and equitable compensation based on market location as well as an individual candidate8217s specific qualifications for an open role Offers may be adjusted based on jobrelated knowledge skills experience and other objective business considerations  The base pay range offered at the start of employment for a midsenior level applicant residing in the United States is expected to be in between 70000 and 160000 USD per year depending on the factors above Offers for applicants from other countries will be based on their regional norms and the requirements of each location Subject to the same considerations the total compensation package for this position may also include equity awards in addition to a range of medical financial andor other benefits Details of participation in these benefit plans will be provided if a candidate receives an offer of employment ,2023-06-04,NaN,2023-06-04 11:11:38.028761
77899,Customer Success Manager,https://remotive.com/remote-jobs/customer-support/customer-success-manager-1697980,About Us Qualio is on a mission to empower life science teams to launch and scale lifesaving products We8217re doing that by building a connected and integrated quality management platform for the entire life science ecosystem Qualio is trusted by 100s of highly regulated international customers ranging from the bleeding edge of computational biology and machine learning to household names in mRNA vaccine development The Qualio team is allremote and currently distributed across North America Europe and Australia What8217s the opportunity You will work with our customers to uncover and understand their goals align on business objectives and be responsible for implementing account plans to grow and secure your portfolio You will wear numerous hats daily while prioritizing the retention and expansion of our customers to ensure mutual success Your daytoday is a mix of proactive and reactive work The proactive work includes running customer meetings handling renewals upsells and some project management The reactive will consist of support and general account management duties What will I be doing  Be the key contact and advocate for your assigned customer list Maintain a revenue base by managing account support retention and renewal Drive upgrade revenue from new product feature adoption and expanded usage Collaborate with the Product Marketing and Sales teams to advocate for your customers and proactively find ways to grow our customer base  What will I be measured on  Renewals  Maintain 90 or higher renewal rate  Expansion  Grow book of business with Account Manager 5 each quarter Identify potential growth during customer engagement calls resulting in the creation of 7 CSQL8217s per quarter  Adoption  Average purchased seat utilization 75 or higher Customer utilizing more than 3 features in the platform   What skills do I need  3160 years of Customer Success in a B2B SaaS company Proven expertise in driving account expansion Organizational framework Demonstrated experience as a trusted advisor to customers Great communication skills across multiple mediums video conference phone email Experience with Salesforcecom Gainsight GSuite or similar softwares Exceptional organizational and time management skills The ability to thrive in a fastpaced environment  Benefits In addition to playing an important role in building Qualio youll receive  Competitive salary Flexible holidays Unlimited vacation Professional development stipend Working space allowance  home office budget Opportunity to make a difference through helping lifesaving products to get to market  A note to candidates Studies have shown that women and people of color are less likely to apply for jobs unless they believe they meet every single one of the qualifications as described in a job description We are committed to building a diverse and inclusive company and we are most interested in finding the BEST candidate for the job That candidate may be one who comes from a less traditional background and that8217s okay We would strongly encourage you to apply even if you dont believe you meet every one of the qualifications described ,2023-06-04,NaN,2023-06-04 11:11:38.028821
346925,Senior Software Engineer,https://remotive.com/remote-jobs/software-dev/senior-software-engineer-1700667,Do you champion best practices in software development Do you have experience migrating codebases from complex legacy spaghetti code to modern maintainable applications Join our team and help our nationwide network of 1200 independent flooring retailers grow their businesses online We are scaling quickly  our platform processes over 1 million leads a year and we need your help to build innovative solutions with this data for our clients Were looking for someone with a passion for collaboratively building products and services who enjoys working solo as well as pair programming and maintains a beginners mindset in approaching problems We are a remote first Engineering team that values written communication and a collective effort toward maintaining a collaborative team culture Documentation and async communication are key to our success and allow us to solve problems with input from engineers across teams and timezones We strive to give every engineer the freedom and support to fix problems quickly and make improvements as they see fit through our deployment pipeline testing practices and strong code review culture We champion automation and our engineers regularly create slack hooks bash commit scripts email alerts and other tools that make our work lives easier This is a full time remote position 160 WHAT YOU8217LL DO  Contribute to all phases of the development lifecycle from ideation amp specification to implementation Build a deep understanding of the whole technology stack Evolve architecture to support clarity and maintainability  we want our codebase to be beginnerfriendly and easy to change Collaborate with other engineering teams on integrating between products on different tech stacks Advocate for best practices testdriven development continuous integration refactoring and code standards Adjust team processes according to best practices while listening for feedback and guiding the team through related changes Mentor other engineers to support their continued learning and career growth Drive continuous adoption and integration of relevant new technologies across the entire org building team cohesion  Requirements WHO YOU ARE  5 years of proven work experience as a software developer of interactive web applications Experience using technologies and frameworks like 8212 but not limited to 8212 our tech stack C NET Core React Typescript MS SQL Webpack Nice to have experience with Angular AWS Redis Docker Nodejs Desire to always learn and grow your professional skill set technically and otherwise Ability to communicate complex ideas clearly through concise written and verbal communication A philosophy that quality code and test coverage allows a team to move faster A firm grasp of design patterns and how to choose the right one for a given problem Passion for writing simple clear efficient code for humans to work with Proficiency in relational databases  Don8217t have experience with any of them No problem 8212 a broad range of engineering experience deep experience with any objectoriented language and willingness to learn our tech stack goes a long way Benefits  Health Care Plan Medical Dental amp Vision Retirement Plan 401k 4 match Life Insurance Unlimited Paid Time Off Family Leave Short Term amp Long Term Disability Work From Home  Remote Office Allowance Wellness Resources amp Lifestyle Perks Calm Premium App Subscription Stock Option Plan  160 Who We Are Our mission at Broadlume is pretty simple simplify the complicated world of digital marketing for the flooring industry The opportunity is massive and we have the team to execute the vision8230except well for you At Broadlume we are committed to working with and providing reasonable accommodations to individuals with disabilities If you need a reasonable accommodation because of a disability for any part of the employment process please email us at careersbroadlumecom and let us know the nature of your request and your contact information Broadlume is an equal opportunity employer Qualified applicants will receive consideration for employment without regard to sex gender identity sexual orientation race color religion national origin disability protected veteran status age or any other characteristic protected by law ,2023-06-04,NaN,2023-06-04 11:11:38.028878
445000,Senior Backend Engineer Nodejs  Compliance,https://remotive.com/remote-jobs/software-dev/senior-backend-engineer-node-js-compliance-1698933,Who we are 160 Were an ambitious team of researchers builders and entrepreneurs with many years of experience in crypto and we are passionate about digital assets With a new product roadmap we are adding several new products to our portfolio beyond onchain data  we are becoming a more comprehensive goto crypto platform for various needs 160 Glassnode is a leading market intelligence platform for onchain and derivatives data We offer the most comprehensive library of advanced onchain metrics and insights for Bitcoin Ethereum and hundreds of other digital assets bringing data intelligence to the blockchain and cryptocurrency space 160 With an emphasis on usercentric interfaces we aim to deliver intelligible actionable and unique insights from blockchain data and beyond helping investors make educated decisions in an overly emotional and irrational market and equipping blockchain teams with valuable insights on their projects and tokens 160 Senior Backend Engineer Nodejs  Compliance mfd Remote 160 We are developing a new AML product for enterprise users that will handle a massive amount of data and address the associated challenges The Senior Backend Engineer will be a pioneer in the team contributing to a greenfield project that will rapidly scale and solve real challenges in a dynamic industry 160 Being part of a crossfunctional team you will collaborate with sales design product and engineering to find a productmarket fit We will work heavily with crypto data 3rd party solutions and inhouse tools You will create scalability and performance solutions to the challenges faced with a particular focus on the end user and market validation 160 You can join our fully remote team from anywhere within the CET time zone as we operate 100 online This is a fulltime position  What you will be doing  Be part of a new fastpaced team working crossfunctionally with our Head of Special Ops VP of Product Head of Engineering and compliance specialists   You will design and implement solutions and own them following our 8221You build it you run it8221 principle   Contribute to the architecture evolution solving scalability and system error resilience problems   Work with highscale data so be ready to optimize your code for performance   Collaborate with other teams and different chapters to improve our codebase propose improvements and share new initiatives   Work aligned with our company objectives with complete freedom to propose how to achieve them   What you need  5 years of working experience as a Software Engineer involved in the development of backend solutions   Experience with NodeJS and Javascript frameworks for backend development   Experience with integrations of thirdparty APIs at scale   Deep practical knowledge of JavaScript and TypeScript   Understanding fullstack web concepts such as transport layers networking caching etc   Willingness to contribute to frontend development when needed   You are a selflearner highly motivated and not afraid to pick up new technologies  160 Nice to have  Experience in generating programmatic PDFs   Previous experience with React   What we offer  Flexibility to organise your work and hours the way you like our remotefirst setup enables this for everyone   Join an innovative selffunded company in a futureproof analytics and market intelligence segment of web3   Freedom to own your decisions and experiment We need driven experts who help us figure out what to do not for us to point at what needs to be done   Be one of the main contributors to building a company with its unique culture in the cuttingedge tech space   No approval loops or unnecessary processes quick decisionmaking and full ownership of your function   We are working on a kickass meaningful benefits package something truly useful and empowering  you will help us figure out what wed need to stand out as the workplace of the future we are open to any ideas   Frequent company offsites we love remote but love to have fun together too  last year we went to Lisbon for a week and had our New Year8217s party in Mallorca and more adventures are coming up  Glassnode is an equal opportunity employer We respect and empower each individual who joins us Glassnode commits to a transparent inclusive nondiscriminatory recruitment process and employment ,2023-06-04,NaN,2023-06-04 11:11:38.028931
101534,Engineering Manager,https://remotive.com/remote-jobs/software-dev/engineering-manager-1699292, Company Description Etsy is the global marketplace for unique and creative goods We build power and evolve the tools and technologies that connect millions of entrepreneurs with millions of buyers around the world As an Etsy Inc employee whether a team member of Etsy Reverb Depop or Elo7 you will tackle unique meaningful and largescale problems alongside passionate coworkers all the while making a rewarding impact and Keeping Commerce Human  Job Description What8217s the role We are looking for an Engineering Manager to lead a team of mobile app engineers focused on building platform capabilities for Etsy8217s Buy on Etsy app This is a fulltime role within the App Enablement initiative160 As the Engineering Manager you will be responsible for leading a team that builds capabilities to enable app engineers to confidently iterate consistently deliver and meaningfully measure impact through the use of modern engineering patterns and practices In this role you will collaborate closely across product and foundational apps teams to identify prioritize scope and deliver tooling and projects that modernize our native iOS and Android architecture Do you find joy in enabling engineers to build apps and iterate confidently If so this could be the perfect match This is a fulltime position reporting to the Senior Engineering Manager In addition to salary you will also be eligible for an equity package an annual performance bonus and our160competitive benefits160that support you and your family as part of your total rewards package at Etsy For this role we are considering candidates based in Mexico who are either remote flex or officebased Etsy offers different work modes to meet the variety of needs and preferences of our team Learn more about our flexible work options and workplace safety policies here What does the daytoday look like  Lead the team to build critical platform capabilities Prioritize scope plan develop and deliver projects that may be at various states of completion or definition when started Collaborate with other engineering teams across Etsy to advocate for and motivate change on behalf of their teams Participate in the endtoend recruiting process hiring and onboarding exceptional engineering talent Partner crossfunctionally with Product and Engineering to ensure that your team is delivering value for our individual contributors Participate in defining and achieving Objectives and Key Results for your team Of course this is just a sample of the kinds of work this role will require You should assume that your role will encompass other tasks too and that your job duties and responsibilities may change from time to time at Etsys discretion or otherwise applicable with local law   Qualifications Qualities that will help you thrive in this role are  4 years of work experience as an engineering manager supervising senior engineers Experience delivering projects from planning through delivery Experience in managing agile ceremonies and optimizing for efficiency Experience gathering feedback from customers to inform engineering prioritization160 Experienced in web development Understanding of native mobile development workflows and tools would be a plus Passionate about helping empower diverse groups Know how to apply processes efficiently to amplify your team8217s work and deliver products optimally Ability to make decisions in the face of ambiguous or changing priorities and goals Outstanding communicator and can easily explain complex decisions with ease to partners and other leaders   Additional Information Whats NextIf youre interested in joining the team at Etsy please share your resume with us and feel free to include a cover letter if youd like As we hope youve seen already Etsy is a place that values individuality and variety We dont want you to be like everyone else  we want you to be like you So tell us what youre all aboutOur PromiseAt Etsy we believe that a diverse equitable and inclusive workplace furthers relevance resilience and longevity We encourage people from all backgrounds ages abilities and experiences to apply Etsy is proud to be an equal opportunity workplace and is an affirmative action employer We are committed to equal employment opportunity regardless of race color ancestry religion sex national origin sexual orientation age citizenship marital status disability gender identity or Veteran status If due to a disability you need an accommodation during any part of the interview process please let your recruiter know While Etsy supports visa sponsorship sponsorship opportunities may be limited to certain roles and skills ,2023-06-04,NaN,2023-06-04 11:11:38.028984
