id,title,link,description,pubdate,location,timestamp
347542,LitCharts Freelance Writer  Literature Guides,https://weworkremotely.com/remote-jobs/litcharts-freelance-writer-literature-guides-1,  Headquarters New Jersey URL httpwwwlitchartscom  LitCharts is hiring writers to help us expand our collection of over 1500 literature guides Were looking for writers with a deep understanding of literature and the ability to analyze and explain it to others Here are two examples of our literature guides httpswwwlitchartscomlitbeforewewerefree httpswwwlitchartscomlitspeechsounds LitCharts writers can work from anywhere and compensation varies based on the length and difficulty of the work Pace and schedule are also flexible though our ideal candidates will have the time to write at least one guide per month 1015 hours per week As a company we value diversity and encourage people of all backgrounds including those from underrepresented groups to apply If youre interested please send a resume as well as two writing samples to writinglitchartscom Samples should be academic papers that demonstrate your ability to analyze literature with insight and clarity Samples should be at least 5 pages long and can be up to any length We will only consider applications that include academic papers focused on literature Please note All applicants must be legally authorized to work in the United States or Canada To apply httpsweworkremotelycomremotejobslitchartsfreelancewriterliteratureguides1,2023-06-04,NaN,2023-06-04 11:11:38.038454
427697,CampusPress Sales Support Specialist,https://jobs.wordpress.net/job/campuspress-sales-support-specialist-14/,We are looking for some epic talent to join our CampusPress family At CampusPress were experts in bringing innovative web solutions to schools school districts colleges and universities through WordPress and our wide range of plugins and products Our services in accessibility security hosting and support power millions of education websites blog networks and portfolios 8230,2023-06-04,NaN,2023-06-04 11:11:38.038559
238851,Web Developers for Auto Safety  Cause Marketing Partners,https://jobs.wordpress.net/job/web-developers-for-auto-safety-cause-marketing-partners/,There is an international distracted driving crisis that endangers everyone worldwide Thank you for your interest in this public safety work that will help make driving safer for you your children families and everyone The ASF site carsafeorg has international life saving information and so is likely the most important site on the internet and you 8230,2023-06-04,NaN,2023-06-04 11:11:38.038607
244319,CampusPress Sales Support Specialist,https://jobs.wordpress.net/job/campuspress-sales-support-specialist-13/,We are looking for some epic talent to join our CampusPress family At CampusPress were experts in bringing innovative web solutions to schools school districts colleges and universities through WordPress and our wide range of plugins and products Our services in accessibility security hosting and support power millions of education websites blog networks and portfolios 8230,2023-06-04,NaN,2023-06-04 11:11:38.038655
207658,Junior Frontend Developer,https://jobs.wordpress.net/job/junior-frontend-developer-2/,Overview Join the exciting world of frontend development with us at CodeWPaihttpCodeWPai WPAI Inc We8217re in search of a talented Junior Frontend Developer with React expertise to contribute to the evolution of our version 30 and assist with the creation of browser extensions Our team thrives on innovation and we work on cuttingedge projects that 8230,2023-06-04,NaN,2023-06-04 11:11:38.038704
215790,Want thought partner  experienced designer,https://jobs.wordpress.net/job/want-thought-partner-experienced-designer/,I8217m starting up a web development agency and just sold my first job I8217m looking for a partner in crime to help deliver an exceptional product Ideally I8217d want someone who 8211 Is familiar with the design thinking process 8211 Offers suggestions on how to improve the UX 8211 Can efficiently create modernsleek WP sites 8230,2023-06-04,NaN,2023-06-04 11:11:38.038751
334024,Full Stack WordPress EngineerDeveloper,https://jobs.wordpress.net/job/full-stack-wordpress-engineer-developer/,About Us Rehab Media Network RMN is a dynamic and rapidly growing company with a unique startup vibe Our team is comprised of selfstarters who are dedicated loyal and hardworking We are proud to have a fun culture where professionals work together to solve complex problems relying on each others talents and abilities We believe 8230,2023-06-04,NaN,2023-06-04 11:11:38.038799
258865,WordPress Sage Developer with Tailwind CSS experience needed,https://jobs.wordpress.net/job/wordpress-sage-developer-with-tailwind-css-experience-needed/,Parttime ongoing work for a variety of projects in the Roots ecosystem We build our sites using TrellisBedrockSage so were looking for someone comfortable with that or who has experience with the technologies behind it Ideally you have an eye for detail and youre happy to a check your own work thoroughly and b have 8230,2023-06-04,NaN,2023-06-04 11:11:38.038847
297060,Looking For Website Designer,https://jobs.wordpress.net/job/looking-for-website-designer-2/,Looking for very experienced deigner to help design and implement my website Thanks,2023-06-04,NaN,2023-06-04 11:11:38.038895
37661,CampusPress Sales Support Specialist,https://jobs.wordpress.net/job/campuspress-sales-support-specialist-12/,We are looking for some epic talent to join our CampusPress family At CampusPress were experts in bringing innovative web solutions to schools school districts colleges and universities through WordPress and our wide range of plugins and products Our services in accessibility security hosting and support power millions of education websites blog networks and portfolios 8230,2023-06-04,NaN,2023-06-04 11:11:38.038955
476587,WordLift Setup screen for plugin,https://jobs.wordpress.net/job/wordlift-setup-screen-for-plugin/,Please note if you want me to consider your proposal send me a reference to a WordPress project and a Angular project preferably a link to a GitHub project The objective of this task is to rework the WordLift plugin setup flow for whitelabel customers The new setup flow is simplified asks for very few 8230,2023-06-04,NaN,2023-06-04 11:11:38.039003
37738,Staff Software Engineer Marketing Technology,https://tryremotely.com/remote-jobs/thumbtack-staff-software-engineer-marketing-technology-11243,  A home is the biggest investment most people make and yet it doesnt come with a manual Thats why were building the only app homeowners need to effortlessly manage their homes  knowing what to do when to do it and who to hire With Thumbtack millions of people care for what matters most and pros earn billions of dollars through our platform And as one of the fastestgrowing companies in a 600B industry  we must be doing something right  We are driven by a common goal and the deep satisfaction that comes from knowing our work supports local economies helps small businesses grow and brings homeowners peace of mind Were seeking people who continually put our purpose first advocating for pros and customers embracing change and choosing teamwork every day At Thumbtack were creating a new era of home care If making an impact and the chance to do good inspires you join us Imagine what well build together  Thumbtack by the Numbers  Available nationwide in all 3143 US counties 75 million projects started on Thumbtack 4 million customers in the last 12 months Pros earn billions on our platform More than 9 million 5star reviews for our stellar pros  1000 employees and 32 billion valuation June 2021    About the MarTech Team  As Thumbtack continues to grow and scale we have to ensure that we continue to invest in our Marketing Infrastructure which touches millions of dollars of marketing spend and is directly responsible for driving our companys top line revenue growth About the Role In this role you will be working on the core infrastructure to power Thumbtack Marketing You will work on a wide breadth of technologies from data warehouseBQ offline data pipelines to online systems microservices Kafka and even some FE if you are up for it Good experience on architecture and design for data pipelines and distributed systems is essential You will be part of an amazing team of 6 engineers and an extended team of over 20 people from data scientists to analysts to XFN product and business stakeholders Challenge We have technical challenges ranging from ETL pipelines high scale backend systems to machine learning optimization algorithms We empower numerous high impact integrations requiring collaboration with many XFN partners build state of the art intelligence based systems for optimizing marketing spend and work on distributed systems architecture and endtoend systems from data warehousing to backend and frontend Our challenges are pretty openended and we move fast Responsibilities  Understand and improve integrations with various advertisers and third party vendors Lead architectural and design discussions on various platforms and distributed systems owned by the team Provide guidance and mentorship to other engineers on the team  What youll need If you dont think you meet all of the criteria below but still are interested in the job please apply Nobody checks every box and were looking for someone excited to join the team  8 years experience of distributed systems big data and software development Handson experience with SQL ETLs Python data pipelines distributed systems End to end ownership of product areas Expertise in evaluating tradeoffs to maximize impact Experience mentoring and coaching engineers Experience working in data engineering or a similar discipline at a twosided marketplace or similar B2C technology company  Bonus points if you have   Experience in Marketing domain is a plus Google Ads SEO CDP etc Experience using andor configuring Business Intelligence tools Looker Tableau Mode et al Experience working with semistructured or unstructured data in a data lake or similar Passion to learn and understand business economics  Thumbtack is a virtualfirst company meaning you can live and work from any one of our approved locations across the United States Canada or the Philippines Learn more about our virtualfirst working model here LIRemote  Benefits  Perks  Virtualfirst working model coupled with quarterly inperson events and Camp Thumbtack 20 companywide holidays including two weeklong shutdowns  Libraries collaborative workspaces in San Francisco Toronto and Manila  Stipends for remote work support home office setup and Thumbtack services Cell phone and WiFi reimbursements  Subscriptions and Employee Assistance Program for mental health and wellbeing   Learn More About Us    Life  Thumbtack Blog     How Thumbtack is embracing virtual work    Follow us on LinkedIn    Meet the pros who inspire us  Thumbtack embraces diversity We are proud to be an equal opportunity workplace and do not discriminate on the basis of sex race color age pregnancy sexual orientation gender identity or expression religion national origin ancestry citizenship marital status military or veteran status genetic information disability status or any other characteristic protected by federal provincial state or local law We also will consider for employment qualified applicants with arrest and conviction records consistent with applicable law  Thumbtack is committed to working with and providing reasonable accommodation to individuals with disabilities If you would like to request a reasonable accommodation for a medical condition or disability during any part of the application process please contact recruitingopsthumbtackcom  If you are a California resident please review information regarding your rights under California privacy laws contained in Thumbtacks Privacy policy available at httpswwwthumbtackcomprivacy    ,2023-06-04,Remote Ontario,2023-06-04 11:11:38.039257
273836,Events Director,https://tryremotely.com/remote-jobs/veeva-events-director-11242,Veeva Systems is a missiondriven organization and pioneer in industry cloud helping life sciences companies bring therapies to patients faster As one of the fastestgrowing SaaS companies in history we surpassed 2B in revenue in our last fiscal year with extensive growth potential aheadAt the heart of Veeva are our values Do the Right Thing Customer Success Employee Success and Speed Were not just any public company  we made history in 2021 by becoming a public benefit corporation PBC legally bound to balancing the interests of customers employees society and investorsAs a Work Anywhere company we support your flexibility to work from home or in the office so you can thrive in your ideal environmentJoin us in transforming the life sciences industry committed to making a positive impact on its customers employees and communitiesThe RoleWe are looking for an experienced organized highly driven Events Director to join our European marketing team The role will lead the planning and execution of largescale customer events in Europe 1000 as well as support the field marketing team with the logistics of smaller Veevaled events and industry tradeshowsThe successful candidate must be ableto demonstrate ownership of both the strategic and execution sides of events be an operational contributor for all daytoday processes manage budget details and support the execution of tactics activities and other detailsMust be a team player working collaboratively with marketing crossfunctional teams and event agencies  What Youll Do Working with a crossfunctional team the Events Director is responsible for the overarching strategy and delivery of the European Commercial Summit European RampD Summit and Other Veevaled events and industry tradeshowsThe Events Director will lead assigned tasks and be responsible for the successful execution of key deliverables including but not limited toProject manage the logistics of our key European Summits in collaboration with our events agency preevent onsite and posteventOrganize logistics from beginning to end for all Veevaled events and industry tradeshowsMaintaining budget procurement and invoiceexpense tracking and reconciliationOwnership of site and vendor selectionInternal communications ie staff registration confirmation final reminder know before you goEnsures flawless execution quality of service and timely delivery of all necessary components properties and materials for each eventOngoing monitoring and evaluation of industry best practices to bring innovative ideas for digital and inperson events Requirements 8 years of corporate events experience in Enterprise B2B Software or SaaSExperience leading largescale 1000 attendees worldclass conferences live and virtual with a focus on logistical planning and executionThrives in a fastpaced highpressure environmentProven excellence in participating in crossteam program management and high attention to detailProven ability to build relationships with other teams and across all levelsAbility to travel as required Nice to Have Experience in the life sciences industry Perks  Benefits Work anywhere policy  You can utilize our office spaces or work remotelyCharitable Giving  Support a nonprofit of your choosingHealth amp wellness allocationAllocations for continuous learning amp developmentHuge opportunity for progression  the sky is the limitIncredible support from the wider team and a bestinclass tech stack to help you be successful in your role Work Location United Kingdom  London,2023-06-04,United Kingdom,2023-06-04 11:11:38.039296
292481,Data Steward Supervisor  Hebrew Speaker,https://tryremotely.com/remote-jobs/veeva-data-steward-supervisor-hebrew-speaker-11241,Veeva Systems is a missiondriven organization and pioneer in industry cloud helping life sciences companies bring therapies to patients faster As one of the fastestgrowing SaaS companies in history we surpassed 2B in revenue in our last fiscal year with extensive growth potential aheadAt the heart of Veeva are our values Do the Right Thing Customer Success Employee Success and Speed Were not just any public company  we made history in 2021 by becoming a public benefit corporation PBC legally bound to balancing the interests of customers employees society and investorsAs a Work Anywhere company we support your flexibility to work from home or in the office so you can thrive in your ideal environmentJoin us in transforming the life sciences industry committed to making a positive impact on its customers employees and communitiesThe RoleAs a Veeva OpenData Stewardship Supervisor you will be responsible for the direct supervision of a remote team of 8 to 15 data stewardship team membersYour role is to promote a positive and rewarding team culture that is detailoriented and strives for excellence when it comes to data quality You should enjoy leading people growing individuals and scaling a teamThe ideal candidate for this role has a strong interest in people management a processoriented mindset and an excellent work ethic Whether you choose to work at home or in one of our offices you enjoy working with autonomy and in an international environment We have a great remote working culture where people work hard have fun and grow What Youll Do Lead a team of 8 to 15 Data StewardsDeliver on the team targets quality productivity efficiencyGrow and develop your teamWork with the Product Manager to understand the product roadmap requirements and allocate work and resources to meet project deadlinesDesign document innovate and optimize processes to ensure bestinclass delivery of data quality and efficiencySupport additional projects and adhoc tasks related to data stewardship Requirements 1 years of leading and managing highperformance teamsFluent in English and HebrewStrong interest in people managementProcess and resultoriented mindsetHighly conscientious organized analytical can do attitudeProficiency in Windows Google Apps MS Office and other office software Highly organized attention to detail and focus on quality Nice to Have Experience working with MDM master data management applicationsLocal Health Care market understandingPrevious experience or interest in data databases Work Location Israel  Tel Aviv,2023-06-04,Israel,2023-06-04 11:11:38.039335
467412,Senior Clinical Consultant  MedTech Services,https://tryremotely.com/remote-jobs/veeva-senior-clinical-consultant-medtech-services-11240,Veeva Systems is a missiondriven organization and pioneer in industry cloud helping life sciences companies bring therapies to patients faster As one of the fastestgrowing SaaS companies in history we surpassed 2B in revenue in our last fiscal year with extensive growth potential aheadAt the heart of Veeva are our values Do the Right Thing Customer Success Employee Success and Speed Were not just any public company  we made history in 2021 by becoming a public benefit corporation PBC legally bound to balancing the interests of customers employees society and investorsAs a Work Anywhere company we support your flexibility to work from home or in the office so you can thrive in your ideal environmentJoin us in transforming the life sciences industry committed to making a positive impact on its customers employees and communitiesThe RoleDo you love solving business problems with technology Are you passionate about enabling Clinical Operations to conduct studies faster and more efficiently Come help us transform Clinical Trials management in the MedTech industryVeeva Vault Clinical Suite is the only unified suite of applications eTMF CTMS Payments for the management of clinical trials from site selection to study archival completely adapted for Medical Device and Diagnostics companies of all sizesVeeva is looking for consultants with experience in the implementation support or administration of Clinical software applications As a key member of the Professional Services organization the Consultant will utilize their industry knowledge and clinical trial expertise to implement Veevas Vault Clinical solutions translating requirements into solution design and defining global strategies for deploying our cloudbased solution and transforming the way study critical data and documentation are collected and managed The Consultant will also work collaboratively across Veeva contributing ideas enhancing our delivery model and working closely with our product management team to meet the evolving needs of the MedTech industryThis is a remote fulltime permanent role with Veeva There is no work location requirement This is a customerfacing role with a requirement to travel up to 40 Qualified candidates must be legally authorized to be employed in the United States Veeva Systems does not anticipate providing sponsorship for employment visa status for this employment position What Youll Do Lead implementation projects of the Vault Clinical suite for MedTech companies including Vault eTMF Vault CTMS and Vault PaymentsConduct requirements workshops design and configuration review iterations with our customers Clinical Operations and IT stakeholders Ensure adherence to the industry best practicesLook after customers success from the beginning to the end of the engagementMentor project team members and junior consultantsProvide insight and recommendations to improve our technology and solutions for the MedTech industry by working closely with our Product team Requirements 8 years of relevant work experience in the Life Science MedTech Pharma Biotech or Healthcare industryDeep knowledge of Clinical Study management regulatory and operations processes data and documentation requirementsStrong experience in either the implementation the system support or administration of Clinical software applications either as a consultant business or IT representativeSelfstarter and motivated individual with the proven ability to work independently in a dynamic environmentProven ability to manage diverse customers andor stakeholders ability to communicate to all levels of an organization and to ensure project delivery to a high degree of satisfaction and quality4year degree or equivalent work experience requiredAbility to travel up to 40 NIce to Have Computer Science Life Science or related degree preferredWork experience in the Medical Device or Diagnostics spaceFamiliarity with MedTech Quality Systems Regulatory requirements and guidelines ISO 13485 2017745 2017746 21 CFR Part 11 GAMPDirect experience with regulated document or datacentric applications such as Veeva Vault solutions Oracle Siebel goBalto BioClinica CTMS Medidata Rave CTMSStrategic Monitoring Parexel IMPACT BioOptronics Clinical Conductor PhlexEView Trial Interactive DrugDev Site Selection and Payments WingSpan eTMF and SiteZONE Complion Florence eBinders Forte Oncore and eReg NextDocs Documentum SharePoint or other technologies used in the management of clinical studiesExperience in Services Delivery Management and PreSales presentations with SaaSCloudPMPAgile certification Perks  Benefits Allocations for continuous learning amp developmentHealth amp wellness programsFlexible PTO Work Location North Carolina  Raleigh,2023-06-04,United States,2023-06-04 11:11:38.039375
