id,title,link,description,pubdate,location,timestamp
294194,Concept Designs Inc is seeking a Senior POP  Product Designer,https://www.coroflot.com/design-jobs/Senior-POP-Product-Designer-Concept-Designs-Inc-Palo-Alto-CA-522609,Palo Alto CA,2023-06-04,NaN,2023-06-04 11:11:38.009917
322988,Riddell is seeking a Graphic Designer  Contract,https://www.coroflot.com/design-jobs/Graphic-Designer-Contract-Riddell-Des-Plaines-IL-522775,Des Plaines IL,2023-06-04,NaN,2023-06-04 11:11:38.009962
139870,Wentworth Institute of Technology is seeking a Coop  Career Advisor,https://www.coroflot.com/design-jobs/Co-op-n-Career-Advisor-Wentworth-Institute-of-Technology-Boston-MA-522770,Boston MA,2023-06-04,NaN,2023-06-04 11:11:38.010029
373609,Nuzine is seeking a Design Draftsperson,https://www.coroflot.com/design-jobs/Design-Draftsperson-Nuzine-New-York-NY-522669,New York NY,2023-06-04,NaN,2023-06-04 11:11:38.010070
179462,Noah Medical is seeking an Industrial Design Intern,https://www.coroflot.com/design-jobs/Industrial-Design-Intern-Noah-Medical-San-Carlos-CA-522682,San Carlos CA,2023-06-04,NaN,2023-06-04 11:11:38.010112
189285,Frankford Candy LLC is seeking a Temporary Senior Designer,https://www.coroflot.com/design-jobs/Temporary-Senior-Designer-Frankford-Candy-LLC-Philadelphia-PA-522661,Philadelphia PA,2023-06-04,NaN,2023-06-04 11:11:38.010153
39695,Garmin International is seeking a Senior CMF Designer,https://www.coroflot.com/design-jobs/Senior-CMF-Designer-Garmin-International-Olathe-KS-522639,Olathe KS,2023-06-04,NaN,2023-06-04 11:11:38.010193
211081,Texas State University School of Art and Design is seeking an AssistantAssociate Professor of Practice in Communication Design,https://www.coroflot.com/design-jobs/AssistantAssociate-Professor-of-Practice-in-Communication-Design-Texas-State-University-School-of-Art-and-Design-San-Marcos-TX-522636,San Marcos TX,2023-06-04,NaN,2023-06-04 11:11:38.010233
124713,Egg Collective is seeking a Lead Finisher in Brooklyn Woodshop,https://www.coroflot.com/design-jobs/Lead-Finisher-in-Brooklyn-Woodshop-Egg-Collective-Brooklyn-NY-522420,Brooklyn NY,2023-06-04,NaN,2023-06-04 11:11:38.010274
470630,Nokia is seeking an Interface UX Designer CoopIntern,https://www.coroflot.com/design-jobs/Interface-UX-Designer-Co-opIntern-Nokia-Ottawa-ON-522372,Ottawa Canada,2023-06-04,NaN,2023-06-04 11:11:38.010315
460259,Funko is seeking a Packaging Engineer,https://www.coroflot.com/design-jobs/Packaging-Engineer-Funko-Everett-WA-522371,Everett WA,2023-06-04,NaN,2023-06-04 11:11:38.010356
211004,Riddell is seeking a Product Engineer,https://www.coroflot.com/design-jobs/Product-Engineer-Riddell-Des-Plaines-IL-522360,Des Plaines IL,2023-06-04,NaN,2023-06-04 11:11:38.010395
459235,So Good So You is seeking a Content Designer,https://www.coroflot.com/design-jobs/Content-Designer-So-Good-So-You-Minneapolis-MN-522351,Minneapolis MN,2023-06-04,NaN,2023-06-04 11:11:38.010434
363643,ZAGG Inc is seeking a Senior Digital Designer,https://www.coroflot.com/design-jobs/Senior-Digital-Designer-ZAGG-Inc-Midvale-UT-522310,Midvale UT,2023-06-04,NaN,2023-06-04 11:11:38.010485
245068,Schneider Electric is seeking a DESIGN OPS,https://www.coroflot.com/design-jobs/DESIGN-OPS-Schneider-Electric-Boston-MA-522309,Boston MA,2023-06-04,NaN,2023-06-04 11:11:38.010524
478940,woom is seeking an Industrial Designer fmx,https://www.coroflot.com/design-jobs/Industrial-Designer-fmx-woom-Klosterneuburg-Austria-522308,Klosterneuburg Austria,2023-06-04,NaN,2023-06-04 11:11:38.010564
195419,Paper Source is seeking a Packaging Designer,https://www.coroflot.com/design-jobs/Packaging-Designer-Paper-Source-Chicago-IL-522259,Chicago IL,2023-06-04,NaN,2023-06-04 11:11:38.010619
236386,Pandiscio Green is seeking a Director of Business,https://www.coroflot.com/design-jobs/Director-of-Business-Pandiscio-Green-New-York-NY-522254,New York NY,2023-06-04,NaN,2023-06-04 11:11:38.010661
255853,Allsop Inc is seeking an Industrial Designer,https://www.coroflot.com/design-jobs/Industrial-Designer-Allsop-Inc-Bellingham-WA-522242,Bellingham WA,2023-06-04,NaN,2023-06-04 11:11:38.010707
276204,Canadian Tire is seeking an Industrial Design Student  Fall 2023 4 months,https://www.coroflot.com/design-jobs/Industrial-Design-Student-Fall-2023-4-months-Canadian-Tire-Toronto-ON-522249,Toronto Canada,2023-06-04,NaN,2023-06-04 11:11:38.010766
472966,Texas State University School of Art and Design is seeking an AssistantAssociate Professor of Practice in Communication Design,https://www.coroflot.com/design-jobs/AssistantAssociate-Professor-of-Practice-in-Communication-Design-Texas-State-University-School-of-Art-and-Design-San-Marcos-TX-522235,San Marcos TX,2023-06-04,NaN,2023-06-04 11:11:38.010805
445052,Human Rights Watch is seeking a Senior Graphic Desginer,https://www.coroflot.com/design-jobs/Senior-Graphic-Desginer-Human-Rights-Watch-New-York-NY-522199,New York NY,2023-06-04,NaN,2023-06-04 11:11:38.010846
53815,50000feet is seeking a Senior Designer,https://www.coroflot.com/design-jobs/Senior-Designer-50000feet-Chicago-IL-522160,Chicago IL,2023-06-04,NaN,2023-06-04 11:11:38.010886
151295,iOttie Inc is seeking a Chinese Speaking Graphic designer,https://www.coroflot.com/design-jobs/Chinese-Speaking-Graphic-designer-iOttie-Inc-New-York-NY-522090,New York NY,2023-06-04,NaN,2023-06-04 11:11:38.010927
424724,Engaging TalentConfidential is seeking an Art DirectorPackaging 90120,https://www.coroflot.com/design-jobs/Art-DirectorPackaging-90-120-Engaging-TalentConfidential-New-York-NY-522084,New York NY,2023-06-04,NaN,2023-06-04 11:11:38.010969
168775,Miami University is seeking a Dean College of Creative Arts,https://www.coroflot.com/design-jobs/Dean-College-of-Creative-Arts-Miami-University-Oxford-OH-522079,Oxford OH,2023-06-04,NaN,2023-06-04 11:11:38.011022
58302,JOEY Restaurant Group is seeking an Intermediate  Senior Interior Designer,https://www.coroflot.com/design-jobs/Intermediate-Senior-Interior-Designer-JOEY-Restaurant-Group-Vancouver-BC-522043,Vancouver Canada,2023-06-04,NaN,2023-06-04 11:11:38.011063
348714,SKOLNICK is seeking a Senior Exhibit Designer,https://www.coroflot.com/design-jobs/Senior-Exhibit-Designer-SKOLNICK-New-York-NY-522034,New York NY,2023-06-04,NaN,2023-06-04 11:11:38.011103
204420,CIBC is seeking a Simplii Financial Junior UX Designer Fall 2023 Coop 12months,https://www.coroflot.com/design-jobs/Simplii-Financial-Junior-UX-Designer-Fall-2023-Co-op-12-months-CIBC-Toronto-ON-521994,Toronto Canada,2023-06-04,NaN,2023-06-04 11:11:38.011157
231379,Lightship is seeking a CMF Designer,https://www.coroflot.com/design-jobs/CMF-Designer-Lightship-San-Francisco-CA-521993,San Francisco CA,2023-06-04,NaN,2023-06-04 11:11:38.011197
46493,Senior Manager of Business Operations at MD Ally Technologies Inc Anywhere,https://www.crunchboard.com/jobs/232210273-senior-manager-of-business-operations-at-md-ally-technologies-inc,ABOUT MD ALLY MD Ally is a 911 Telehealth solution that enables greater connectivity between public health amp safety and the broader healthcare,2023-06-04,NaN,2023-06-04 11:11:38.011358
405254,CIWRO Research Associate ACME Software Developer at University of Oklahoma Norman OK 73019 USA,https://www.crunchboard.com/jobs/230636938-ciwro-research-associate-acme-software-developer-at-university-of-oklahoma,CIWRO Research Associate ACME Software Developer This is a careertrack research associate position in the Applied Computing for the Meteorological,2023-06-04,NaN,2023-06-04 11:11:38.011427
463897,Security Manager at James Madison University Harrisonburg VA USA,https://www.crunchboard.com/jobs/230610527-security-manager-at-james-madison-university,Security Manager James Madison University Become a valuable part of the James Madison University community JMU39s IT Security Team is accepting,2023-06-04,NaN,2023-06-04 11:11:38.011484
21137,Sales Consultant at Pony Show Creative Anywhere,https://www.crunchboard.com/jobs/230415904-sales-consultant-at-pony-show-creative,We are Pony Show Creative httpswwwponyshowcreativecom an LA and NYC producer creator of branded entertainment Super Bowllevel commercials amp,2023-06-04,NaN,2023-06-04 11:11:38.011537
261142,Sr Systems Analyst  VMWareWindows at El Dorado County Placerville CA USA,https://www.crunchboard.com/jobs/229203800-sr-systems-analyst-vmware-windows-at-el-dorado-county,HIREON INCENTIVES AVAILABLE Enjoy working in a collaborative and supportive environment where fresh ideas and creative solutions to improve processes,2023-06-04,NaN,2023-06-04 11:11:38.011592
302892,Manager of Application Deployment at Orrick Herrington  Sutcliffe LLP Wheeling WV USA,https://www.crunchboard.com/jobs/229129929-manager-of-application-deployment-at-orrick-herrington-sutcliffe-llp,Orrick currently has an excellent opportunity for a Manager of Applications Deployment in the Global Operations amp Innovation Center quotGOICquot in our,2023-06-04,NaN,2023-06-04 11:11:38.011652
117270,Director of Engineering  Product at Everyday Speech USA,https://www.crunchboard.com/jobs/228828645-director-of-engineering-product-at-everyday-speech,Everyday Speech is a leader in SocialEmotional Learning Primarily a teaching solution for public schools our SocialEmotional Learning Platform,2023-06-04,NaN,2023-06-04 11:11:38.011716
95037,Executive Director of Technology Services IT at Walla Walla Community College Walla Walla WA USA,https://www.crunchboard.com/jobs/228150467-executive-director-of-technology-services-it-at-walla-walla-community-college,Executive Director of Technology Services IT Walla Walla Community College Salary 12500000  13000000 Annually Job Type ,2023-06-04,NaN,2023-06-04 11:11:38.011770
253206,Lead Data Engineer at Brivo Systems LLC Bethesda MD USA,https://www.crunchboard.com/jobs/227021069-lead-data-engineer-at-brivo-systems-llc,Brivo Systems LLC Brivo is an Equal OpportunityAffirmative Action Employer  MinoritiesFemalesProtected VeteransDisabled About the Role As the,2023-06-04,NaN,2023-06-04 11:11:38.011838
388894,Lead Information Security Engineer at Brivo Bethesda MD USA,https://www.crunchboard.com/jobs/226636834-lead-information-security-engineer-at-brivo,About the Role As the Lead Information Security Engineer you will use your skills to support Brivo39s recurring revenue and growth by providing,2023-06-04,NaN,2023-06-04 11:11:38.011888
408591,POLICY  RESEARCH ANALYST I POLITICAL VOICE at Catalyst California Los Angeles CA USA,https://www.crunchboard.com/jobs/226545896-policy-research-analyst-i-political-voice-at-catalyst-california,This is an initial hybrid position which may convert to a remote workfromhome position Applicant must be able to commute to the Los Angeles,2023-06-04,NaN,2023-06-04 11:11:38.011955
367233,Strategic Marketing Director at NXT1 Bel Air MD USA,https://www.crunchboard.com/jobs/225882627-strategic-marketing-director-at-nxt1,Will you be the NXT1 to make a difference The NXT1 Cloud Company dba NXT1 is a PaaSSaaS development startup based outside Baltimore Maryland Our,2023-06-04,NaN,2023-06-04 11:11:38.012009
402310,Senior Manager Information Systems  Technology at Viristar Anywhere,https://www.crunchboard.com/jobs/225622358-senior-manager-information-systems-technology-at-viristar,Senior Manager Information Systems amp Technology Description The Senior Manager Information Systems amp Technology oversees Viristars information,2023-06-04,NaN,2023-06-04 11:11:38.012079
472327,Information Security Officer at Human Rights Watch Berlin Germany,https://www.crunchboard.com/jobs/223893755-information-security-officer-at-human-rights-watch,FULLTIME JOB VACANCY INFORMATION SECURITY OFFICER Information Security Program Multiple Locations Considered Berlin Office Preferred Application,2023-06-04,NaN,2023-06-04 11:11:38.012129
361586,Inside Sales Agent  Public Safety at MD Ally Technologies Inc NYC NY USA,https://www.crunchboard.com/jobs/223893749-inside-sales-agent-public-safety-at-md-ally-technologies-inc,MD Ally is a leading provider of innovative public safety solutions dedicated to enhancing the efficiency and effectiveness of 911 dispatch centers and,2023-06-04,NaN,2023-06-04 11:11:38.012182
487210,Lab Technician Vulcan Steam Cooking at SmartRecruiters Troy OH USA,https://www.crunchboard.com/jobs/223711086-lab-technician-vulcan-steam-cooking-at-smartrecruiters,Company Description Founded in 1912 Illinois Tool Works Inc NYSE ITW is a diversified Fortune 200 manufacturing company that delivers,2023-06-04,NaN,2023-06-04 11:11:38.012253
220074,Senior Full Stack Developer at AAOS Rosemont IL USA,https://www.crunchboard.com/jobs/223562238-senior-full-stack-developer-at-aaos,You are eager to lead the design implementation and development of complex web applications You enjoy acting as a lead technical expert executing,2023-06-04,NaN,2023-06-04 11:11:38.012306
307710,Chief Scientist at Afiniti Washington DC USA,https://www.crunchboard.com/jobs/223553603-chief-scientist-at-afiniti,WHO ARE WE Afiniti is a leading provider of artificial intelligence that improves customer experience  making moments of human connection more,2023-06-04,NaN,2023-06-04 11:11:38.012359
478069,Senior Software Engineer Backend Services at Glympse Anywhere,https://www.crunchboard.com/jobs/222696497-senior-software-engineer-backend-services-at-glympse,Glympse is the pioneer in realtime temporary location sharing technology We incorporate location sharing into a wide variety of consumer and,2023-06-04,NaN,2023-06-04 11:11:38.012412
493241,Astralus is hiring for a position of Astralus is looking for new team members in Remote,https://dribbble.com/jobs/215135-Astralus-is-looking-for-new-team-members?source=feed,,2023-06-04,NaN,2023-06-04 11:11:38.012985
19332,Kiloma Advanced Solutions is hiring for a position of UI Designer  Asset management web app in Remote,https://dribbble.com/jobs/215102-UI-Designer-Asset-management-web-app?source=feed,,2023-06-04,NaN,2023-06-04 11:11:38.013036
371473,Aedee Design Studio is hiring for a position of Sr UXUI Designer in Hyderbd India,https://dribbble.com/jobs/214805-Sr-UX-UI-Designer?source=feed,,2023-06-04,NaN,2023-06-04 11:11:38.013088
251855,Aviagames Inc is hiring for a position of Brand Designer Mascot logo font in Remote,https://dribbble.com/jobs/214739-Brand-Designer-Mascot-logo-font?source=feed,,2023-06-04,NaN,2023-06-04 11:11:38.013141
184692,Phenom People is hiring for a position of Freelance Product Designer Remote Europe in Europe,https://dribbble.com/jobs/215036-Freelance-Product-Designer-Remote-Europe?source=feed,,2023-06-04,NaN,2023-06-04 11:11:38.013193
385828,1111 Music Group is hiring for a position of Senior Designer in Remote,https://dribbble.com/jobs/204443-Senior-Designer?source=feed,,2023-06-04,NaN,2023-06-04 11:11:38.013247
167572,Motion Recruitment is hiring for a position of UIUX Designer in New York City NY,https://dribbble.com/jobs/215003-UI-UX-Designer?source=feed,,2023-06-04,NaN,2023-06-04 11:11:38.013299
479888,Montra Interactive is hiring for a position of Product Designer in Remote,https://dribbble.com/jobs/214970-Product-Designer?source=feed,,2023-06-04,NaN,2023-06-04 11:11:38.013352
164265,Yornest is hiring for a position of Product Designer in Remote,https://dribbble.com/jobs/214937-Product-Designer?source=feed,,2023-06-04,NaN,2023-06-04 11:11:38.013405
147551,Shosho Design is hiring for a position of Senior Product Designer  Fully Remote in Amsterdam Netherlands,https://dribbble.com/jobs/213386-Senior-Product-Designer-Fully-Remote?source=feed,,2023-06-04,NaN,2023-06-04 11:11:38.013459
13229,Skydio is hiring for a position of Senior Product Designer in Redwood City CA,https://dribbble.com/jobs/150455-Senior-Product-Designer?source=feed,,2023-06-04,NaN,2023-06-04 11:11:38.013512
70331,Lifeforce Digital is hiring for a position of Product Designer in Los Angeles,https://dribbble.com/jobs/172169-Product-Designer?source=feed,,2023-06-04,NaN,2023-06-04 11:11:38.013564
271254,sixwasnine studio is hiring for a position of Freelance Designers in San Diego CA,https://dribbble.com/jobs/212033-Freelance-Designers?source=feed,,2023-06-04,NaN,2023-06-04 11:11:38.013623
456707,VAST Data is hiring for a position of WebUI Design PreIPO AI Data Platform in Remote,https://dribbble.com/jobs/214871-Web-UI-Design-Pre-IPO-AI-Data-Platform?source=feed,,2023-06-04,NaN,2023-06-04 11:11:38.013676
137529,Alto is hiring for a position of Senior Product Designer in Nashville TN,https://dribbble.com/jobs/212000-Senior-Product-Designer?source=feed,,2023-06-04,NaN,2023-06-04 11:11:38.013729
168685,Open Systems Technologies is hiring for a position of UX Designer  Remote Contract Role in Remote,https://dribbble.com/jobs/204476-UX-Designer-Remote-Contract-Role?source=feed,,2023-06-04,NaN,2023-06-04 11:11:38.013782
330158,Product Marketing Alliance is hiring for a position of Head of Digital Design  UX in Remote,https://dribbble.com/jobs/201638-Head-of-Digital-Design-UX?source=feed,,2023-06-04,NaN,2023-06-04 11:11:38.013833
489683,Kinn is hiring for a position of Founding Product Designer in New York City NY,https://dribbble.com/jobs/214838-Founding-Product-Designer?source=feed,,2023-06-04,NaN,2023-06-04 11:11:38.013883
398223,Hiro Systems is hiring for a position of Product Designer in United States,https://dribbble.com/jobs/183026-Product-Designer?source=feed,,2023-06-04,NaN,2023-06-04 11:11:38.013935
418021,The Remote Company is hiring for a position of Web Designer in Remote,https://dribbble.com/jobs/201605-Web-Designer?source=feed,,2023-06-04,NaN,2023-06-04 11:11:38.013985
233132,Nexus Auto Transport is hiring for a position of Groundbreaking UXUI needed in Remote,https://dribbble.com/jobs/206588-Groundbreaking-UX-UI-needed?source=feed,,2023-06-04,NaN,2023-06-04 11:11:38.014035
174682,Networx Systems Inc is hiring for a position of Product Designer in New York City NY,https://dribbble.com/jobs/204212-Product-Designer?source=feed,,2023-06-04,NaN,2023-06-04 11:11:38.014084
16857,Air is hiring for a position of A Designer Thats Work Shows They Care in San Francisco CA,https://dribbble.com/jobs/204113-A-Designer-Thats-Work-Shows-They-Care?source=feed,,2023-06-04,NaN,2023-06-04 11:11:38.014134
165656,Airhouse is hiring for a position of Brand Designer in United States,https://dribbble.com/jobs/140720-Brand-Designer?source=feed,,2023-06-04,NaN,2023-06-04 11:11:38.014186
226199,Expensify is hiring for a position of Product Designer in Remote,https://dribbble.com/jobs/195071-Product-Designer?source=feed,,2023-06-04,NaN,2023-06-04 11:11:38.014235
339620,Fay is hiring for a position of Contract UI Designer startup in Remote,https://dribbble.com/jobs/214772-Contract-UI-Designer-startup?source=feed,,2023-06-04,NaN,2023-06-04 11:11:38.014286
485330,Niftic is hiring for a position of Senior Digital Designer in Remote,https://dribbble.com/jobs/214706-Senior-Digital-Designer?source=feed,,2023-06-04,NaN,2023-06-04 11:11:38.014340
231093,Ness is hiring for a position of Product Designer anywhere,https://dribbble.com/jobs/171839-Product-Designer?source=feed,,2023-06-04,NaN,2023-06-04 11:11:38.014398
377108,Ubiquiti is hiring for a position of UX  UI designer in Stockholm Sweden,https://dribbble.com/jobs/214640-UX-UI-designer?source=feed,,2023-06-04,NaN,2023-06-04 11:11:38.014452
306355,Alchemy is hiring for a position of Visual Designer in US time zone PST time preferred,https://dribbble.com/jobs/101516-Visual-Designer?source=feed,,2023-06-04,NaN,2023-06-04 11:11:38.014506
114714,Amply is hiring for a position of Web Designer in Remote,https://dribbble.com/jobs/214607-Web-Designer?source=feed,,2023-06-04,NaN,2023-06-04 11:11:38.014558
95223,Pigui is hiring for a position of Senior Product Designer in Remote,https://dribbble.com/jobs/214508-Senior-Product-Designer?source=feed,,2023-06-04,NaN,2023-06-04 11:11:38.014608
328040,Silk  Sonder is hiring for a position of Product Designer in Remote,https://dribbble.com/jobs/214475-Product-Designer?source=feed,,2023-06-04,NaN,2023-06-04 11:11:38.014657
37245,Burrow Data is hiring for a position of Web Designer in Remote,https://dribbble.com/jobs/211704-Web-Designer?source=feed,,2023-06-04,NaN,2023-06-04 11:11:38.014708
51595,Anonyome Labs Inc is hiring for a position of User Experience Designer in Greater Salt Lake City Area,https://dribbble.com/jobs/114584-User-Experience-Designer?source=feed,,2023-06-04,NaN,2023-06-04 11:11:38.014767
392273,Black Flag Creative is hiring for a position of UXUI Product DesignerRemoteContractor in Los Angeles CA,https://dribbble.com/jobs/214541-UX-UI-Product-Designer-Remote-Contractor?source=feed,,2023-06-04,NaN,2023-06-04 11:11:38.014819
351382,Kisi is hiring for a position of Product Designer in Remote,https://dribbble.com/jobs/211505-Product-Designer?source=feed,,2023-06-04,NaN,2023-06-04 11:11:38.014870
171721,CryptoHub LTD is hiring for a position of Product Designer  UIUX in Remote,https://dribbble.com/jobs/206225-Product-Designer-UI-UX?source=feed,,2023-06-04,NaN,2023-06-04 11:11:38.014922
53623,NationBuilder is hiring for a position of UI Engineer in United States only,https://dribbble.com/jobs/80001-UI-Engineer?source=feed,,2023-06-04,NaN,2023-06-04 11:11:38.014972
23574,Grit Digital Health is hiring for a position of Experience Design Director in Denver CO,https://dribbble.com/jobs/214310-Experience-Design-Director?source=feed,,2023-06-04,NaN,2023-06-04 11:11:38.015024
397654,Third and Grove is hiring for a position of Creative Director in Remote,https://dribbble.com/jobs/214244-Creative-Director?source=feed,,2023-06-04,NaN,2023-06-04 11:11:38.015073
429550,Endeavor is hiring for a position of Senior Product Designer in Remote,https://dribbble.com/jobs/211241-Senior-Product-Designer?source=feed,,2023-06-04,NaN,2023-06-04 11:11:38.015124
207134,Evolve Creative is hiring for a position of Senior Graphic Designer in Bemidji MN,https://dribbble.com/jobs/214211-Senior-Graphic-Designer?source=feed,,2023-06-04,NaN,2023-06-04 11:11:38.015175
469518,Brix Labs is hiring for a position of UIUX NFT Platform Designer in North America,https://dribbble.com/jobs/163556-UI-UX-NFT-Platform-Designer?source=feed,,2023-06-04,NaN,2023-06-04 11:11:38.015227
496047,Client Accelerators is hiring for a position of UIUX Design Expert anywhere,https://dribbble.com/jobs/147683-UI-UX-Design-Expert?source=feed,,2023-06-04,NaN,2023-06-04 11:11:38.015277
473542,Lotum is hiring for a position of Junior Product Designer UXUI in Bad Nauheim,https://dribbble.com/jobs/42053-Junior-Product-Designer-UX-UI?source=feed,,2023-06-04,NaN,2023-06-04 11:11:38.015327
233541,Ethyca is hiring for a position of UX Designer in New York NY,https://dribbble.com/jobs/163094-UX-Designer?source=feed,,2023-06-04,NaN,2023-06-04 11:11:38.015376
238346,TheoremOne is hiring for a position of Senior Digital Product Designer in North Central and South America,https://dribbble.com/jobs/79539-Senior-Digital-Product-Designer?source=feed,,2023-06-04,NaN,2023-06-04 11:11:38.015439
90666,MUDWTR is hiring for a position of Sr Product Designer UIUX in Remote,https://dribbble.com/jobs/213683-Sr-Product-Designer-UI-UX?source=feed,,2023-06-04,NaN,2023-06-04 11:11:38.015490
381952,Mento is hiring for a position of Design Coach anywhere,https://dribbble.com/jobs/162533-Design-Coach?source=feed,,2023-06-04,NaN,2023-06-04 11:11:38.015558
325403,TixTrack is hiring for a position of Lead Product Designer in United States,https://dribbble.com/jobs/160289-Lead-Product-Designer?source=feed,,2023-06-04,NaN,2023-06-04 11:11:38.015627
429909,Free Agency is hiring for a position of Brand Design anywhere,https://dribbble.com/jobs/91055-Brand-Design?source=feed,,2023-06-04,NaN,2023-06-04 11:11:38.015684
367183,Whimsical is hiring for a position of Web Designer in Remote,https://dribbble.com/jobs/210449-Web-Designer?source=feed,,2023-06-04,NaN,2023-06-04 11:11:38.015734
123073,VOID is hiring for a position of UIUX Designer for Gaming Platform in Remote,https://dribbble.com/jobs/203222-UI-UX-Designer-for-Gaming-Platform?source=feed,,2023-06-04,NaN,2023-06-04 11:11:38.015783
367113,Harley  Co is hiring for a position of Senior Designer in New York City NY,https://dribbble.com/jobs/213254-Senior-Designer?source=feed,,2023-06-04,NaN,2023-06-04 11:11:38.015833
297351,Blingde is hiring for a position of Stunning  converting Ads  in Remote,https://dribbble.com/jobs/213617-Stunning-converting-Ads?source=feed,,2023-06-04,NaN,2023-06-04 11:11:38.015883
385657,Honest Days Work is hiring for a position of Illustrator for mobile apps in Remote,https://dribbble.com/jobs/213584-Illustrator-for-mobile-apps?source=feed,,2023-06-04,NaN,2023-06-04 11:11:38.015954
61756,Johns Hopkins University is hiring for a position of Web Designer in Remote,https://dribbble.com/jobs/203090-Web-Designer?source=feed,,2023-06-04,NaN,2023-06-04 11:11:38.016023
123968,Demodern Creative Technologies is hiring for a position of Digital Designer gn in Kln Germany,https://dribbble.com/jobs/213485-Digital-Designer-gn?source=feed,,2023-06-04,NaN,2023-06-04 11:11:38.016074
179215,Cake DeFi is hiring for a position of Senior Product Designer in Singapore,https://dribbble.com/jobs/213320-Senior-Product-Designer?source=feed,,2023-06-04,NaN,2023-06-04 11:11:38.016131
441103,Bukwild is hiring for a position of UI Designer anywhere,https://dribbble.com/jobs/104324-UI-Designer?source=feed,,2023-06-04,NaN,2023-06-04 11:11:38.016200
250398,Cience Technologies is hiring for a position of UI Designer in Guadalajara Mexico,https://dribbble.com/jobs/179891-UI-Designer?source=feed,,2023-06-04,NaN,2023-06-04 11:11:38.016249
73759,xrecruiter is hiring for a position of Design  Development Agency in Remote,https://dribbble.com/jobs/210317-Design-Development-Agency?source=feed,,2023-06-04,NaN,2023-06-04 11:11:38.016318
18058,Loom is hiring for a position of Product Designer Growth anywhere,https://dribbble.com/jobs/184115-Product-Designer-Growth?source=feed,,2023-06-04,NaN,2023-06-04 11:11:38.016368
