title,link,description,pubdate,location,timestamp
Engineering,https://echojobs.io/job/eventbrite-engineering-gfgly,Description THE CHALLENGEEventbrite is the leading global ticketing and event technology platform powering over five million live experiences and 300 million tickets every year. We empower creators of events of all shapes and sizes – from music festivals experiential yoga political rallies to gaming competitions –– by providing them the tools and resources they need to seamlessly plan promote and produce live experiences around the world.While being a member of the Security Team you’ll be building and managing world class security programs. This requires extensive knowledge in security program management frameworks project management sprint planning cloud security and product development. You will oversee the security team’s project planning tracking and OKRs; shifting us from tactical to more strategic level work. You will be strategically a part of the product and engineering sprint planning cycles representing security requirements priorities timelines and deliverables. You will also oversee and manage the cybersecurity arm of our compliance programs such as: PCI-DSS SOC2 and SOX and work closely with internal / external audit teams. THE TEAMThe Security Team provides governance operations engineering and technical support throughout the organization. The security team works closely with all departments to ensure security measures are operating effectively and that risk is being managed appropriately. We are responsible for data protection product security incident response compliance backoffice security and business enablement. Our goal is to ensure security is operating at the highest levels while unlocking the business to move faster. THE ROLEAs part of the Security Team you will be building and managing a wide variety of security programs and oversee project management capacity planning execution and deliverables. You will bring the vision and strategy on how to shift teams from tactical level work to more strategic level work with program management oversight. You will have experience in developing and aligning OKRs and KPIs with the broader organization and know what success looks like. You will oversee teams from the US Spain and India and have experience with product and engineering organizations that are cloud centric. You will have a strong cloud and technology background with experience in defining / gathering security requirements. In this position you will be working closely with our governance risk and compliance teams security engineering SRE product and other engineering teams to ensure the highest level of security is being met. As part of the broader security team you will help inspire mentor and lead by example as we strive to make a positive impact on our customers and the business.THE SKILL SETYou have 7+ years of security engineering software engineering systems engineering or technical product/program management experienceYou will be able to define build and lead cross-functional security programs to deliver end-to-end security solutions which solve various functional process or security risksYou will have experience leading various governance programs and audit committees that drive compliance through strategic partnershipsYou will lead the business continuity and disaster recovery efforts across various teams and own the framework testing and technical requirementsYou will be accountable for identifying and overcoming end-to-end cross-functional problems in both technical and security domains across cloud and back office infrastructureYou will provide security program management oversight to the Security Team building structure project tracking metrics and reportingYou will lead the execution and delivery of security solutions to resolve business problems via strategic thinking and hands-on leadershipDrive and influence technical and product security strategy proactively identify problems align on priorities and set direction for security roadmapsResponsible for defining and delivering on technical requirements that solve various security problemsDefine and own what success looks like: metrics and measurement OKRs / KPIs rollout scalable and sustainable operational plansBuild strong trusting partnerships to readily mobilize people and influence across a broad range of partners leaders and organizationsIdentify and improve inefficiencies in how we operate to move faster with higher quality outcomesYou will have experience delivering technology and security programs or products from inception to deliveryYou will have knowledge of user needs gathering requirements and defining scopeExperience operating autonomously across multiple teams demonstrated critical thinking and thought leadershipCommunication experience and experience working with technical management teams to develop secure solutions systems and productsYou will have organizational coordination and multi-tasking experienceYou will have analytical and problem-solving experience with large-scale cloud platformsExperience establishing work relationships across multi-disciplinary teams and multiple partners in different time zones.WHAT WE OFFERWe are committed to providing competitive valuable and meaningful benefits for our Britelings. We work hard to cultivate a diverse equitable and inclusive culture where Britelings feel like they belong. Employees can participate in resource groups and we offer programming throughout the year to support a diverse and inclusive workplace. Read more about our Diversity and Inclusion work for our team culture and community.We offer comprehensive benefits and a wellness package above and beyond standard medical benefits to support our Britelings’ lifestyle.Eventbrites global benefit programs are designed to meet you where you are by offering resources and support for your health well-being finances and family. This includes support in a remote/hybrid environment wellness allowance Carrot family planning benefit Origin Financial Planning service and other offerings to ease the mind and body like Modern Health and BriteBreaks (generally the first Friday of every month off). ABOUT EVENTBRITEEventbrite is a global self-service ticketing marketing and experience technology platform that serves a consumers and event creators in nearly 180 countries. Since inception Eventbrite has been at the center of the experience economy transforming the way people organize and attend events. With over 280 million tickets distributed for over 5 million total events in 2022 Eventbrite is where people all over the world discover new things to do or new ways to do more of what they love. Learn more at www.eventbrite.com.IS THIS ROLE NOT AN EXACT FIT?Sign up to keep in touch and we’ll let you know when we have new positions on our team. Eventbrite is committed to equality of opportunity for all staff and applications from all suitably qualified individuals are encouraged regardless of age disability sex gender reassignment sexual orientation pregnancy and maternity race religion or belief and marriage and civil partnerships. #LI-REMOTEApplicant Privacy NoticeApply for this job Apply for This Job or See all jobs from Eventbrite,2023-10-02,,2023-10-02 12:20:16.999227
Engineering Manager - Search,https://echojobs.io/job/eventbrite-engineering-manager-search-2l1uj,Description THE CHALLENGEEventbrites business continues to grow and scale rapidly powering millions of events. Event creators and attendees need new tools and technologies that empower them to have the most meaningful live experiences. As an Engineering Manager you will inspire mentor and develop the team that builds this global platform. THE ROLEAs an Engineering Manager in the Consumer world you are responsible for a team whose primary customers are event goers when searching at eventbrite.com and eventbrite attendee app. You will need to partner with Design and Product to empower users on:Find: something specific (i.e Ocktober Fest) Discover: discover what they would like to do (i.e yoga this weekend for free)Inspire them: I have an open weekend and I don’t know what to do You’ll refine our software development lifecycle process clarify design requirements and accelerate progress. Youll support the career growth of our engineers and provide opportunities to distinguish themselves as they drive impact throughout our organization.YOU WILLTech Lead Manager - has had a leadership role but can be as a technical IC.User-facing or Marketplace Search experience with ElasticSearch OpenSearch Lucene or Solr. Be familiar with basic retrieval relevancy ranking processes.Has direct experience leading Consumer Search team and working on the consumer side of the business.Has proficiency working with public clouds like AWS GCP OCI etc.Manage a team of six engineers (Backend Frontend and Mobile engineers)Measure velocity and improve efficiency for the teamDrive change effectively across our organizationMaintain regular communication with the leadership teamTake ownership of career development for engineers on the team.Drive innovation in processes and strategies throughout your business unit.Lead your team to success on important initiatives even during times of frequent distractions and occasionally conflicting priorities.Develop a sustainable healthy environment for your engineers that is engaging encouraging and challenging.Work alongside Search specific Product Managers and Personalization teamTHE SKILL SETExperience working with Search Personalization or any other type of indexing relevance and information retrievalAnalytical mindset for moving business metrics (CTR CVR Engagement etc.): How search can contribute to overall business goals (e.g. revenue)Demonstrated ability to grow and lead high-functioning and diverse engineering teams geographically distributed across the worldYou’re a polyglot with a solid technical background and the ability to contribute to software design and architectural discussions as a player coach.Experience building early-stage consumer products applying concepts like experimentation rapid prototyping and user research in engineeringExperience working with a highly collaborative remote-first environment driving a team that ships code to production often.Working knowledge of fundamental cloud technologies preferably within AWS.BONUS POINTS3 years experience in engineering leadership and people managementHave contributed to team hiring and building teams from scratch.Has experience working with user-centric personalization and recommendations.Has worked with ML models to implement: Learn to Rank/Ranking Models Embeddings Knowledge Graph Learning Query Classification Personalized Search / Two Tower modelsThe wage range for this role takes into account the wide range of factors that are considered in making compensation decisions including but not limited to skill sets; experience and training; licensure and certifications; and other business and organizational needs. The disclosed range estimate has not been adjusted for the applicable geographic differential associated with the location at which the position may be filled. At Eventbrite it is not typical for an individual to be hired at or near the top of the range for their role and compensation decisions are dependent on the facts and circumstances of each case. A reasonable estimate of the current range is $173 900 to $278 280. You may also be eligible to participate in Eventbrite’s incentive program(s) (such as equity annual incentive bonus and commission plans) subject to the applicable rules and restrictions.WHAT WE OFFERWe are committed to providing competitive valuable and meaningful benefits for our Britelings. We work hard to cultivate a diverse equitable and inclusive culture where Britelings feel like they belong. Employees can participate in resource groups and we offer programming throughout the year to support a diverse and inclusive workplace. Read more about our Diversity and Inclusion work for our team culture and community.We offer comprehensive benefits and a wellness package above and beyond standard medical benefits to support our Britelings’ lifestyle.Eventbrites global benefit programs are designed to meet you where you are by offering resources and support for your health well-being finances and family. This includes support in a remote/hybrid environment wellness allowance Carrot family planning benefit Origin Financial Planning service and other offerings to ease the mind and body like Modern Health and BriteBreaks (generally the first Friday of every month off). ABOUT EVENTBRITEEventbrite is a global self-service ticketing marketing and experience technology platform that serves a consumers and event creators in nearly 180 countries. Since inception Eventbrite has been at the center of the experience economy transforming the way people organize and attend events. With over 280 million tickets distributed for over 5 million total events in 2022 Eventbrite is where people all over the world discover new things to do or new ways to do more of what they love. Learn more at www.eventbrite.com.IS THIS ROLE NOT AN EXACT FIT?Sign up to keep in touch and we’ll let you know when we have new positions on our team. Eventbrite is committed to equality of opportunity for all staff and applications from all suitably qualified individuals are encouraged regardless of age disability sex gender reassignment sexual orientation pregnancy and maternity race religion or belief and marriage and civil partnerships. #LI-REMOTEApplicant Privacy NoticeApply for this job Apply for This Job or See all jobs from Eventbrite,2023-10-02,,2023-10-02 12:20:17.303387
Engineering Manager,https://echojobs.io/job/eventbrite-engineering-manager-q7zde,Description THE TEAMEventbrites business continues to grow and scale rapidly powering millions of events. Event creators and attendees need to be empowered with new tools and technologies to assist them in having the most meaningful live experiences. THE CHALLENGEAs an Engineering Manager you will be responsible for a cross-functional team that delivers features to our Eventbrite event creators and event consumers.THE ROLEYou will partner with your design and product counterparts to empower users to find and discover events. You’ll help refine our software development lifecycle process clarify design requirements and accelerate progress. Youll support the career growth of our engineers and provide them with opportunities to distinguish themselves as they drive impact throughout our organization.YOU WILLLead a remote-first cross-functional engineering team to deliver high-quality software in small regular iterations.Continuously aim to reduce cycle time and improve the efficiency of the team.Ensure team members have the knowledge of the wider organizational context for their work goals and outcomes.Hold team members accountable for achieving their goals while operating with high levels of autonomy.Collaborate with your Product and Design counterparts to align on the delivery of business outcomes clarify requirements validate assumptions and accelerate progress.Lead the engineering team to validate the feasibility of projects and ideas while in continuous collaboration with cross-functional partners and other engineering teams.Collaborate with other engineering managers to drive innovation in processes and strategies throughout the business pilar.Facilitate the hiring and onboarding of engineers.Maintain regular communication with the leadership team.Foster a culture of transparency accountability and openness.THE SKILL SETExperienced in leading managing and inspiring cross-functional agile engineering teams.A solid technical background with a passion for delivering high quality maintainable software following leaagile methodologies.Comfortable participating in architectural discussions asking informative questions and assisting the team in making strategic trade-offs.Experience applying concepts like experimentation rapid prototyping MVP definition user research and data driven customer first decision making to engineering.Experience working within a highly collaborative remote-first environment driving a team that ships code to production often.The ability to recruit onboard grow and develop a globally-distributed engineering teamAn understanding of build/deployment pipelines and toolingAn understanding of cloud technologies such as AWS.Excellent communication skills both written and verbal.Excellent facilitation skills involving the whole team in group based decision making.The ability to work proficiently in English. WHAT WE OFFERWe are committed to providing competitive valuable and meaningful benefits for our Britelings. We work hard to cultivate a diverse equitable and inclusive culture where Britelings feel like they belong. Employees can participate in resource groups and we offer programming throughout the year to support a diverse and inclusive workplace. Read more about our Diversity and Inclusion work for our team culture and community.We offer comprehensive benefits and a wellness package above and beyond standard medical benefits to support our Britelings’ lifestyle.Eventbrites global benefit programs are designed to meet you where you are by offering resources and support for your health well-being finances and family. This includes support in a remote/hybrid environment wellness allowance Carrot family planning benefit Origin Financial Planning service and other offerings to ease the mind and body like Modern Health and BriteBreaks (generally the first Friday of every month off). ABOUT EVENTBRITEEventbrite is a global self-service ticketing marketing and experience technology platform that serves a consumers and event creators in nearly 180 countries. Since inception Eventbrite has been at the center of the experience economy transforming the way people organize and attend events. With over 280 million tickets distributed for over 5 million total events in 2022 Eventbrite is where people all over the world discover new things to do or new ways to do more of what they love. Learn more at www.eventbrite.com.IS THIS ROLE NOT AN EXACT FIT?Sign up to keep in touch and we’ll let you know when we have new positions on our team. Eventbrite is committed to equality of opportunity for all staff and applications from all suitably qualified individuals are encouraged regardless of age disability sex gender reassignment sexual orientation pregnancy and maternity race religion or belief and marriage and civil partnerships. #LI-REMOTEApplicant Privacy NoticeApply for this job Apply for This Job or See all jobs from Eventbrite,2023-10-02,,2023-10-02 12:20:17.605546
Engineering – Technical Support - LATAM,https://echojobs.io/job/alation-engineering-technical-support-latam-47v6v,Description Due to its remote and hybrid culture Alation conducts all of its interviewing and onboarding virtually.Big Data isn’t a problem. It’s an opportunity.At Alation we help people find understand and trust data. So they not only excel in their work — they drive value for their enterprise team and role. In the words of one customer “Alation makes me look like a rockstar.”We help companies like Pfizer and Salesforce empower their people with the best data every day. As a platform for innovation Alation helps customers create game-changing solutions (like a program for early-stage disease detection with Pfizer) and connect people to great data in less time (like Salesforce whose analysts can now find data 35% faster). And we’re just getting started.With more than $340M in funding - valued at over $1.7 billion and 450+ customers with household names - Alation is poised to capitalize on data as an opportunity. Headquartered in Silicon Valley Alation was named to Inc. Magazine’s Best Workplaces list for the fourth time and our exceptional Glassdoor rating reflects a culture that makes coming to work each day a joy. Do you want to join a team that welcomes new ideas supports your growth and recognizes your unique value?Join us!We are looking for an experienced Technical Support Engineer to join our advanced support team. In this role you will provide advanced-level technical support helping our customers integrate with the Alation platform. You will be responsible for troubleshooting and debugging complex issues as well as acting as an escalation point with customers and internal teams.What youll be doing:Provide advanced-level technical support to Alation customers partners prospects and other support engineersSpecialize in at least one of the support specialization areas and serve as SME for internal and external customersContribute to the Alation Support Knowledge Base by regularly authoring editing and updating technical documentation such as KB articles runbooks community FAQs product documentation etc. Facilitate internal and external technical enablement sessionsBuild and utilize complex lab setups to replicate and resolve problemsYou should have:CS degree and at least 5 years of experience as a support engineer providing enterprise software application supportExperience troubleshooting Linux and running shell commandsExperience with Relational Databases such Oracle and Postgres. SQL is a must.Ability to diagnose and debug applications written Java and/or Python Experience with Web servers such as Apache and NginxExperience with REST APIsA big plus if you have experience in the following areas:Postgres (DB internals)JDBC driversElasticsearch NoSQL MongoDBHadoop Ecosystem (Hive HBase)Cloud technologies and frameworks such as Kubernetes and Docker#LI-RB1More About AlationOur founders have come together from different backgrounds: business engineering and design. This unique mix from our founding team is important to the Alation culture story. Today our team consists of creators and communicators with varied backgrounds - from Stanford to the Indian Institute of Technology big companies and one-person startups the United States and abroad. We continue to seek ever more diverse perspectives as we grow.We are an equal opportunity employer and value diversity at our company. We do not discriminate onthe basis of race name religion color national origin gender identity and expression sexual orientation age marital status veteran status or disability status.Why Alation?- Market-Leading Data Catalog Provider- High-growth collaborative environment with diverse and inclusive teams- Continuous learning enrichment and development opportunities- Competitive pay and health offerings including commuter benefits- Flexible time off to relax and rechargeand much much more!Apply for this job Apply for This Job or See all jobs from Alation,2023-10-02,,2023-10-02 12:20:17.895320
