title,link,description,pubdate,location,timestamp
Full-Time QA Tester - WFH/Remote (For Fresh Graduates),https://jobs.smartrecruiters.com/SeekaTechnology/743999934237294-full-time-qa-tester-wfh-remote-for-fresh-graduates-,Company DescriptionSEEKA Technologies (Not Seeka Limited) is a project under its parent organization called Fresh Futures Australia which is an education consultant based in both Australia and Malaysia. It will be a huge platform that utilises A.I. to help match students and job seekers to the right opportunities relevant to them from Primary/Grade school to University level as well as language schools and job opportunities. Our mission is to make it easier for anyone to find filter and apply to different schools or educational institutions that suit them best as well as make the transition from studies to work more seamless. We are seeking a detail-oriented QA Tester to join our team. In this role you will be responsible for ensuring that all of our software products meet the highest standards of quality and reliability. You will work closely with developers product managers and other team members to identify report and track bugs and issues. Your main goal will be to ensure that our software products are functional user-friendly and meet the needs of our clients.Salary range will depend on your overall academic qualifications and experience post graduation and will be discussed with you should you be shortlisted for the job.Job DescriptionTesting each and every button page feature and tool on our platform to verify the functionality and quality of our platformTo create and execute test plans test cases and test scriptsUsing MS Excel or Google sheets to document each and every step you took to arrive at any results you find and the important things ti note about the resultDocumenting any problems issues and bugs you find that would severely affect the user experience Using Adobe XD to open prototype designs and analyze the UI/UXCommunicate with team members and stakeholders to provide updates on testing progress and resultsQualificationsA Bachelors or Masters degree in Computer Science Software Engineering Information Technology and any related field.Proven experience as a QA Tester or similar roleKnowledge of software testing methodologies and best practicesFamiliarity with bug tracking softwareStrong analytical and problem-solving skillsExcellent communication and collaboration skillsAbility to work independently and as part of a teamDetail-oriented with a strong focus on qualityAdditional InformationCompletely remote or work from home (Very good if you also want to spend more time with family)Friendly and understanding colleaguesYou get to work in an agile work environmentYou get to show your leadership skillsInternational working exposureCompany shares can be offered based on how successful with our products launchCompany sponsored online classes or tech talksBonuses if you perform beyond expectationPromotions towards better job roles possible after a certain period of time,2023-10-02,Đ. Nguyễn Công Trứ Nguyễn Thái Bình Quận 1 Thành phố Hồ Chí Minh Vietnam,2023-10-02 12:20:17.864045
Microsoft Sentinel Engineering Intern,https://echojobs.io/job/bluevoyant-microsoft-sentinel-engineering-intern-r1kx1,Description Microsoft Sentinel Engineering InternLocation: Remote in the United KingdomBlueVoyant is currently seeking a Microsoft Sentinel Engineering Intern. Candidate will work alongside our Azure/SIEM engineers to deploy solutions for BlueVoyant customers identify process improvements and increase knowledge on the latest Azure Cloud security technologies and SIEM platforms ResponsibilitiesWork alongside Azure/SIEM engineers to develop and implement solutions for BlueVoyant customersHelp with delivery tasks including implementation rollout and documentation of Azure Solutions Attend customer meetings as needed and assist with communication and coordination of technical matters and issuesWrite scripts and code to automate tasks and improve efficiency Assist in the creation of operational and executive security reports and dashboardsWork with Global Project Management team to update project tasks timelines and deliverables Attend Microsoft meetings and webinars to stay up to date on the latest Azure technologies and trendsQualificationsPursuing a degree in Computer Science or Computer Engineering or a related field of study Hands-on experience with Azure Cloud Technologies Proficient experience in Python or PowerShellSelf-motivated learner who can work autonomously and in a team settingExcellent customer facing and communication skills Some practical knowledge of Internet protocols firewalls and intrusion detectioprevention systemsPreferred CompetenciesKnowledge of M365 security toolsets Proficient in Python PowerShell or C#/.NETUnderstanding of Azure Logic Apps Microsoft FlowAbout BlueVoyantAt BlueVoyant we recognize that effective cyber security requires active prevention and defense across both your organization and supply chain. Our proprietary data analytics and technology coupled with deep expertise works as a force multiplier to secure your full ecosystem. Accuracy! Actionability! Timeliness! Scalability!Led by CEO Jim Rosenthal BlueVoyant’s highly skilled team includes former government cyber officials with extensive frontline experience in responding to advanced cyber threats on behalf of the National Security Agency Federal Bureau of Investigation Unit 8200 and GCHQ together with private sector experts. BlueVoyant services utilize large real-time datasets with industry leading analytics and technologies.Founded in 2017 by Fortune 500 executives including Executive Chairman Tom Glocer and former Government cyber officials BlueVoyant is headquartered in New York City and has offices in Maryland Tel Aviv San Francisco London Budapest and Latin America.All employees must be authorized to work in the United Kingdom. BlueVoyant provides equal employment opportunities to all employees and applicants for employment without regard to race color religion sex national origin age disability or genetics. In addition to federal law requirements BlueVoyant complies with applicable state and local laws governing non-discrimination in employment in every location in which the company has facilities.BlueVoyant Candidate Privacy Notice To understand how we secure and manage your personal data upon submitting a job application please see our Candidate Privacy Notice which can be found here - Candidate Privacy Notice Apply for This Job or See all jobs from BlueVoyant,2023-10-02,,2023-10-02 12:20:13.798836
"Software Engineering Manager, macOS Agent",https://echojobs.io/job/huntress-software-engineering-manager-macos-agent-cyhru,Description Reports to: Senior Director of Engineering Location: Remote US and Canada Only Compensation Range: $140 000 to $190 000 base plus bonus and equityWhat We Do: Founded in 2015 as a fully remote company by former NSA cyber operators Huntress was built on a simple premise: to force hackers to earn every inch of their access. Today’s cyber-attacks aren’t limited to large organizations with the security tools that can ward off threats. Hackers dont discriminate and will find a way to penetrate any vulnerability in any size business which is why Huntress focuses on protecting those small to midsize businesses that make up the backbone of our economy.Huntress stops hidden threats that sneak past preventive security tools by utilizing our award-winning security platform and expert human threat hunters through dynamic products including Managed EDR MDR for Microsoft 365 and Managed Security Awareness Training.Join the hunt and help us stop hackers in their tracks!What You’ll Do: You’ll lead an engineering team that builds and supports our macOS Agent. You’ll work closely with the team’s product manager designer and cybersecurity expert to design build validate and support both agent and web-based applications. You’ll grow and develop a team of smart and diverse problem solvers who are innovative skilled and passionate about delivering for our customers. As part of the engineering leadership team you’ll help develop better ways for us to work. At Huntress we work with low walls between disciplines because we believe good ideas are everywhere and the best products come from teams who work together to deeply understand our customers experiment and validate our products.Who You Are:You’ve been a software engineer and understand modern cloud-based architectures. You still have the ability to jump in and punch and review code but you also exhibit an ability to think tactically and strategically about a solution and the right way to build it. You enjoy thinking about products as well as engineering and have a track record of developing and iterating on SaaS products. You have managed technical teams and know how to coach and develop both individuals and a team.Responsibilities: Deliver awesome products with speed and agility for our customers that are maintainable reliable and resilient Recruit hire coach and mentor a diverse team of engineers who are technically skilled collaborative and creativeIdentify and remove impediments for your teamContinuously improve your team’s performance and healthContribute to improving the Engineering department’s best practices processes and standardsLead with transparency candidly challenge assumptions and exhibit integrity above all elseWhat You Bring To The Team: 3+ years experience in engineering leadership building SaaS products in a modern SaaS environmentExperience with macOS internals and development preferredSkilled at building teams and performance managementExperience with different software development methodologies such as plan-build-ship shape-up scrum and kanbanExcellent technical diagnostic and troubleshooting skillsAbility to grasp new software architecture and technology quicklyAbility to build strong interpersonal relationships with product development teams leadership senior management and internal and external stakeholders to help minimize silos and drive teamwork across teamsWhat We Offer:100% remote work environment - since our founding in 2015Generous paid time off policy including vacation sick time and paid holidays12 weeks paid parental leaveHighly competitive and comprehensive medical dental and vision benefits plans 401(k) with 5% contribution regardless of employee contributionLife and Disability insurance plansStock options for all full-time employees One-time $500 stipend to build/upgrade home officeAnnual allowance for education and professional development assistance $75 USD/month digital reimbursementAccess to both Udemy and BetterUp platforms for coaching personal and professional growthHuntress is committed to creating a culture of inclusivity where every single member of our team is valued has a voice and is empowered to come to work every day just as they are.We do not discriminate based on race ethnicity color ancestry national origin religion sex sexual orientation gender identity disability veteran status genetic information marital status or any other legally protected status. We do discriminate against hackers who try to exploit small businesses.Accommodations:If you require reasonable accommodation in completing this application interviewing completing any pre-employment testing or otherwise participating in the employee selection process please direct your inquiries to accommodations@huntresslabs.com. Please note non-accommodation requests to this inbox will not receive a response. If you have any questions about your personal data privacy at Huntress please visit our privacy page.#BI-Remote Apply for This Job or See all jobs from Huntress,2023-10-02,,2023-10-02 12:20:14.123160
Product & Engineering,https://echojobs.io/job/intro-product-engineering-l3koy,Description Welcome to Intro the best way to book world class experts and get advice over a video call.We’re a mission driven companyWe believe that access to people and knowledge can unlock human potential. Whether it’s learning how to perform an exercise from a top fitness trainer or getting business advice from a successful entrepreneur access and information can improve your life and the lives of others. That is why our mission is to give everyone access to anyone.The founding teamOur founder and CEO previously built an operating system that was acquired by Intuit and became the new QuickBooks Online. Our CTO previously built a marketplace that was used by millions of people and generated over $100m in GMV. We love working on BIG problems for a LOT of people and believe that Intro will be the most impactful yet.Come build Intro with us and help us accelerate our mission to give everyone access to anyone.Our InvestorsWe’re backed by Andreessen Horowitz (A16Z) Alexis Ohanian (founder of Reddit) Tiffany Haddish Kevin Durant and a group of world class investors.Based in California but work from anywhereWe’re a fully distributed team that deeply cares about producing high quality results. The founders live in LA but you can live anywhere. We care about hiring people that are talented believe in the mission and are good human beings.Why work with us?On your first day we’ll do a few exercises to help you identify your life goals. We’ll ask questions like “what do you imagine your life looking like if you achieved all of your goals” and “why are those goals important to you?” Once we identify those goals they become our goals and we will work together to help make them a reality.Next we’ll ask you about things that matter to you in the short term. These could be things like a gym membership meditation classes or an allowance to attend concerts (when they come back). It’s an open ended exercise and we’ll come up with a perks package that makes you feel valued. Please note we cannot yet buy you a ticket on a SpaceX rocket. It’s been asked!Finally here are the things you’ll definitely get: competitive salary equity health insurance apple equipment company trips and events allowances unlimited vacation days unlimited sick days recharge days and more.Company Values- Impress the customer- Be successful as a company- Be creative inventive and scrappy- Keep it simple and execute- Take a moment to understand others- Feedback should make us stronger not weaker- Stay gratefulThe RoleWe are looking for a Senior Designer to help us build world class products. You will work with the product team to build experiences that resonate with our users on our website mobile apps and beyond (emails landing pages etc.). We think this is a dream job for an extremely talented goal-oriented senior designer that deeply cares about the little details.The person in the roleHelp define and design user experiences on web iOS Android and Mac.Talk to users and look at data to understand our users.Help us find and develop our design teamBe a leader across the org and evangelize authenticity simplicity and purpose across everything we do as a company. Work with our brand marketing team to keep our designs consistent and on brandWork with product management to define a successful repeatable design and discovery playbookWork closely with engineering on executional design work providing on-the-fly input and direction.Help us build out scalable design practices including the development of component libraries and design patternsRequirements4+ years of full-time professional experience designing and shipping digital products ideally for consumer-facing companiesAn online portfolio of product case studies that speak to both your UX and visual design skillsYou’re a generalist and excel at anything from UX work and wireframing to fine-grained visual design.Ability to pitch educate and define your design rationale to key stakeholders—you can articulate the ‘why’ and lead discussions around your process explorations and conclusionsAbility to translate stakeholder goals user research and complex task-based flows into clean usable UIUp-to-date knowledge of best practices developments and trends in web and native mobile designExtensive knowledge working and collaborating with design software like Figma or Sketch and interaction prototyping tools like Principle Origami or FramerHumility and objectivity: you welcome design feedback and are eager to incorporate new ideas into design iterationsYou deeply care about the users and their needsIntro is an Equal Opportunity Employer. We are committed to bringing together humans from different backgrounds and perspectives to do impactful work together. Apply for this job Apply for This Job or See all jobs from Intro,2023-10-02,,2023-10-02 12:20:14.478528
"Manager, Site Reliability Engineering (Remote OK)",https://echojobs.io/job/arkose-labs-manager-site-reliability-engineering-remote-ok-60jxv,Description The mission of Arkose Labs is to create an online environment where all consumers are protected from online spam and abuse. Recognized by G2 as the 2023 Leader in Bot Detection and Mitigation with the highest score in customer satisfaction and largest market presence four quarters running Arkose Labs offers the worlds first $1M warranties for credential stuffing and SMS toll fraud. With 20% of our customers being Fortune 500 companies our AI-powered platform combines powerful risk assessments with dynamic threat response to undermine the strategy of attack all while improving good user throughput. Headquartered in San Mateo CA with employees in London Costa Rica Australia India and Argentina. Arkose Labs protects enterprises from cybercrime and abuse. ResponsibilitiesLead a team of tight-knit smart engineers passionate about reliability availability & observability of large-scale distributed systemsBe responsible for a team that operates large scale SaaS setup Observability platform etc.Seek out every path to support and improve your teams happiness engagement and effectivenessChampion a culture of learning continuous improvement and blameless retrospection within your team and across the companyMentor and grow your junior engineers and empower and unblock your senior onesPartner with our Talent Acquisition team as we recruit interview and hire the best engineering talent to join Arkose’s growing SRE team!Must Haves2+ years of professional software engineering experience including large scale SaaS Infrastructure deployed in AWS Azure or GCP.4+ years of experience managing teams handling production for SaaS applications.2+ years of experience in an Observability platform like Splunk or Datadog. An experienced manager familiar with the challenges of herding both sheep and cats in large-scale production environments.Experienced with owning reliability for web scale platforms.Conversant with a wide range of relevant tools and technologies! We dont expect managers to be writing code in their day-to-day job but your interests should include some or all of: AWS GCP Go Kubernetes distributed systems (kafka cassandra zookeeper elastic) Terraform.Some familiarity with compliance environments like SOC2 and FedRAMP would be ideal.Nice to HavesStartup ExperienceCybersecurity and/or Fraud Prevention ExperienceAt Arkose Labs our technology-driven approach enables us to make a substantial impact in the industry supported by a robust customer base consisting of global enterprise giants such as Microsoft Roblox OpenAI and more. We’re not just a company; we’re a collaborative ecosystem where you will actively partner with these influential brands tackling the most demanding technical challenges to safeguard hundreds of millions of users across the globe.Why do top tech professionals choose Arkose Labs?Cutting-Edge Technology: Our high-efficacy solutions backed by solid warranties attract leading global enterprise clients.Innovation and Excellence: We foster a culture that emphasizes technological innovation and the pursuit of excellence ensuring a balanced and thriving work environment.Experienced Leadership: Guided by seasoned executives with deep tech expertise and a history of successful growth and equity events.Ideal Size: We’re structured to be agile and adaptable large enough to provide stability yet small enough to value your voice and ideas.Join us in shaping the future of technology. At Arkose Labs you’re not just an employee; you’re part of a visionary team driving global change”Work with some of the biggest names in the market such as Microsoft Paypal EA Github Twitch Roblox Twilio and Minecraft! The most recognizable brands in the world select Arkose Labs including OpenAI Roblox Microsoft Adobe Expedia Snapchat Zilch and ZipAir.We value your unique contributions perspectives and experiences. Be part of a diverse and high-performing environment that prioritizes collaboration excellence and inclusion. We hire the best focus on their professional development and offer support for continuing education.We value:People - independent thinkers making data-driven decisions and taking project ownershipTeamwork - building trust respect and integrity to openly communicate and constructively challenge one anotherCustomer Focus - customer empathy and problem-solving obsessionExecution - actions with precision professionalism and urgencySecurity - our lens for implementing processes procedures and programsArkose Labs is an Equal Opportunity Employer that makes employment decisions without regard to race color religious creed national origin ancestry sex pregnancy sexual orientation gender gender identity gender expression age mental or physical disability medical condition military or veteran status citizenship marital status genetic information or any other characteristic protected by applicable law. In addition Arkose Labs will provide reasonable accommodations for qualified individuals with disabilities.Benefits:Competitive salaryEquity401k plan with company matchFlexible PTO Robust benefits package (90% of medical dental vision and life insurance paid by the company and 75% paid for dependent care)We provide home office setup assistance to optimize your remote working experienceThe anticipated salary range for this position is $200 000 - $230 000. Equity and benefits may be provided as part of the compensation package depending on the position offered. Not all candidates will be eligible for the upper end of the salary range. The exact salary will ultimately depend on multiple factors which may include the successful candidate’s skills experience and other qualifications as well as the candidate’s location of residence. In addition to base salary some roles may be eligible for a variable bonus based on a combination of company performance employee performance and management discretion. Apply for This Job or See all jobs from Arkose Labs,2023-10-02,,2023-10-02 12:20:15.358341
