title,link,description,pubdate,location,timestamp
Product Marketing Lead,https://tryremotely.com/remote-jobs/mozilla-product-marketing-lead-14449,   Hiring Ranges     US Tier 1 Locations 13700000 USD  20000000 USD US Tier 2 Locations 12600000 USD  18500000 USD US Tier 3 Locations 11600000 USD  17000000 USD To learn more about our Hiring Range System please click this link     Product Marketing Lead A lot of companies say theyre missiondriven Our unique corporate structure guarantees that every decision we make upholds our mission to make sure the internet stays available safe and welcoming to everyone Beholden to neither shareholders nor investors Mozilla Corporation is wholly owned by the notforprofit Mozilla Foundation Along with 20000 volunteer contributors and collaborators all over the world Mozilla Corporations staff designs builds and distributes software that allows people to enjoy the internet on their own terms Our flagship product  the Firefox browser  has expanded into a family of products that protects users and alerts them of risks The Role Mozilla is looking for an outstandingly wellrounded consumerfocused product marketing leader to join a passionate team that is changing the way the world experiences todays web This is a critical marketing role that will be responsible for driving highlevel strategy and product adoption for Mozillas Security  Privacy business This person will lead a team to drive market landscape and consumer analyses inform longterm business and product strategy and bring products to market with compelling effective marketing activations To do this youll build deep partnerships with product design and engineering leadership as well as crosschannel marketing partners to build a connection between product strategy and marketing strategy You are A customercentric analytical and creative marketing leader who thrives in ambiguity and challenges the status quo A strong partner with the ability to translate across technical data and creative teams and empower action with crossfunctional partners You can communicate strategies results and insights to all levels of the organization A consistent track record leading through influence is critical You have successfully led and mentored teams of marketers You will  Develop and drive highlevel marketing strategy for Mozillas Security  Privacy products Ensure the voice of the user is consistently heard and incorporated into the thinking of products brand and creative concepts at the highest levels Lead the development of marketing plans that bring our products to life for consumers with innovative creative and effective plans Work in partnership and cross functionally across product design engineering and research leadership to influence our product direction and lead how we bring new products and features to market Analyze market and audience insights to deliver concrete recommendations to grow educate and retain customers Youll craft positioning and messaging that resonates with these audiences at every stage of the customer lifecycle Engage and activate marketing channel partners to bring these marketing strategies to life Work closely with senior leadership to align on the strategy and resourcing needs to deliver on Privacy  Security growth plans Operate as a leader on the product marketing team lifting the capabilities of the team as a whole  Your Professional Profile  8 years of professional experience in consumer product marketing preferably with consumer SaaS andor subscription products Experience leading and strengthening a team to deliver excellence Expert in marketing with demonstrated ability to drive product adoption and engagement Track record of delivering multiple innovative projects in a dynamic environment strong project management experience Problemsolving strategic and analytical capabilities Excellent written and oral communication skills with peers leadership and crossfunctional teams  About Mozilla  Mozilla exists to build the Internet as a public resource accessible to all because we believe that open and free is better than closed and controlled When you work at Mozilla you give yourself a chance to make a difference in the lives of Web users everywhere And you give us a chance to make a difference in your life every single day Join us to work on the Web as the platform and help create more opportunity and innovation for everyone online Commitment to diversity equity inclusion and belonging Mozilla understands that valuing diverse creative practices and forms of knowledge are crucial to and enrich the companys core mission We encourage applications from everyone including members of all equityseeking communities such as but certainly not limited to women racialized and Indigenous persons persons with disabilities persons of all sexual orientations gender identities and expressions We will ensure that qualified individuals with disabilities are provided reasonable accommodations to participate in the job application or interview process to perform essential job functions and to receive other benefits and privileges of employment as appropriate Please contact us at hiringaccommodationmozillacom to request accommodation We are an equal opportunity employer We do not discriminate on the basis of race including hairstyle and texture religion including religious grooming and dress practices gender gender identity gender expression color national origin pregnancy ancestry domestic partner status disability sexual orientation age genetic predisposition medical condition marital status citizenship status military or veteran status or any other basis covered by applicable laws Mozilla will not tolerate discrimination or harassment based on any of these characteristics or any other unlawful behavior conduct or purpose Group C LIREMOTE Req ID R2150   ,2023-06-05,United States,2023-06-05 21:20:10.316123
Senior Lead Risk Strategy  Operations,https://tryremotely.com/remote-jobs/faire-senior-lead-risk-strategy-operations-14448,  About Faire Faire is an online wholesale marketplace built on the belief that the future is local  independent retailers around the globe are doing more revenue than Walmart and Amazon combined At Faire were using the power of tech data and machine learning to connect this thriving community of entrepreneurs across the globe Picture your favorite boutique in town  we help them discover the best products from around the world to sell in their stores With the right tools and insights we believe that we can level the playing field so that small businesses everywhere can compete with these big box and ecommerce giants By supporting the growth of independent businesses Faire is driving positive economic impact in local communities globally Were looking for smart resourceful and passionate people to join us as we power the shop local movement If you believe in community come join ours   About this role Were looking for a Senior Lead Risk Strategy  Operations to drive critical initiatives across Risk functions  including Verifications Underwriting Fraud and Recovery  As a member of the Risk Ops leadership team you will drive strategic analytical and operational projects and implement processes and programs with the goal of protecting our community of brands and retailers You will work closely with Risk team leads and other crossfunctional leaders to ensure we employ worldclass risk management allowing our business to innovate and offer products that deliver an exceptional customer experience for our brands and retailers alike This is an ideal role for someone who wants to work as a highimpact individual contributor within a functional area and have the opportunity to lead projects from strategy to execution to ongoing implementation and iteration  What youll do   Lead development of Risk strategy and planning which will increase operational efficiency and reduce exposure to fraud and defaults Drive strategic analytical and operational projects and be responsible for the execution monitoring  ongoing implementation of scalable operational programs and processes Develop and refine policy for programs with significant customer and business impact Lead crossfunctional initiatives and strategy to ensure success of team and joint company goals Own performance management processes including building dashboards monitoring diagnosing and reporting out on key trends across Risk Drive resolution actions for highly sensitive Risk cases ensure we learn from these and operationalize changes as needed  Qualifications  A Bachelors degree and 710 years of experience in strategy and operations roles at highgrowth companies some background in management consulting investment banking or private equity preferred but not required Experience in fastpaced ambiguous environments driving projects from strategy through implementation happy to roll up your sleeves to get any job done Highly analytical and data driven  can drive complex analyses and translate into key actionable insights can manage projects to KPIs and metrics Ability to work crossfunctionally with Data Science Product Engineering Sales and other Operations teams to achieve business objectives Experience developing processes and policy  managing programsprojects A passion for Risk teams programs and policy past experience preferred not but required Excellent written and verbal communicator  Ability to flex between analytical strategic and operational aspects of the job Knowledge of SQL preferred     Faires flexible work model aims to meet the needs of our diverse employee community by making work more flexible connected and inclusive Depending on the role and needs of the team Faire employees have the flexibility to choose how they workwhether thats mainly in the office remotely or a mix of both  Roles that list only a country in the location are eligible for fully remote work in that country or in office work at a Faire office in that country provided employees are located in the registered countryprovincestate Roles with only a city location are eligible for inoffice or hybrid office work in that city Our talent team will work with candidates to determine what locations and roles are eligible for each option  Why youll love working at Faire   We are entrepreneurs Faire is being built for entrepreneurs by entrepreneurs We believe entrepreneurship is a calling and our mission is to empower entrepreneurs to chase their dreams Every member of our team is an owner of the business and taking part in the founding process   We are using technology and data to level the playing field We are leveraging the power of product innovation and machine learning to connect brands and boutiques from all over the world building a growing community of more than 350000 small business owners   We build products our customers love Everything we do is ultimately in the service of helping our customers grow their business because our goal is to grow the pie  not steal a piece from it Running a small business is hard work but using Faire makes it easy   We are curious and resourceful Inquisitive by default we explore every possibility test every assumption and develop creative solutions to the challenges at hand We lead with curiosity and data in our decision making and reason from a first principles mentality   Faire was founded in 2017 by a team of early product and engineering leads from Square Were backed by some of the top investors in retail and tech including Y Combinator Lightspeed Venture Partners Forerunner Ventures Khosla Ventures Sequoia Capital Founders Fund and DST Global We have headquarters in San Francisco and KitchenerWaterloo and a global employee presence across offices in Salt Lake City Atlanta Toronto London New York LA and Sao Paulo To learn more about Faire and our customers you can read more on our blog Faire provides equal employment opportunities EEO to all employees and applicants for employment without regard to race color religion sex national origin age disability genetics sexual orientation gender identity or gender expression Faire is committed to providing access equal opportunity and reasonable accommodation for individuals with disabilities in employment its services programs and activities To request reasonable accommodation please fill out our Accommodation Request Form httpsbitlyfaireform  ,2023-06-05,Canada,2023-06-05 21:20:10.316167
Senior Software Engineer Backend Merchant Insights,https://tryremotely.com/remote-jobs/affirm-senior-software-engineer-backend-merchant-insights-14447, Affirm is reinventing credit to make it more honest and friendly giving consumers the flexibility to buy now and pay later without any hidden fees or compounding interest Join our Merchant Insights Engineering team in Poland and help shape the future of merchant optimization with Affirm We are on a mission to empower our merchant partners enabling them to achieve their unique business goals and maximize the value they receive from our platform By collaborating closely with product managers we develop innovative systems that provide unparalleled value to our merchant partners As a Senior Engineer you will play a crucial role in automating the optimization of merchant configurations such as pricing to deliver optimal value for both our merchants and Affirm We believe in fostering mutually beneficial relationships where both parties succeed together Join us today and be part of a team that is revolutionizing the way merchants optimize their businesses with Affirm Together well unlock new opportunities and drive mutual success What Youll Do  Design develop and deliver wellscoped milestones for a project Deploy cuttingedge solutions that identify optimize and validate optimized configurations for our merchant partners Create robust tools that empower merchants to analyze their portfolios automate simulation processes and monitor optimization experiments Collaborate with Analysts Data Scientists and Product Engineers to build scalable products that optimize value for Affirm and our merchant partners helping them achieve their business goals Work closely with tech leads managers and crossfunctional teams within Affirm including engineering credit marketing and analytics to understand performance modeling strategies business drivers and drive requirements for new products Take an active role in mentoring junior engineers and improving processes that support team growth and efficiency  What We Look For  4 years of experience as a software engineer  A strong understanding of distributed systems and how architectural decisions affect performance and maintainability Excellent written and verbal communication skills with a focus on asynchronous communication methods like tech specs wikis and project plans Excellent project management skillshigh degree of organization and ability to surface critical information effectively Passion for collaborating with crossfunctional teams including Product Design Analytics and Business teams Experience in building datadriven solutions is highly desirable PythonKotlin development experience is a plus Familiarity with AWS or other cloud providers is a plus   Compensation  Benefits We offer a competitive package with some highlights listed below However the given figures are not guaranteed compensation ranges rather they are unbinding approximate indications of what the salary may be for your awareness The actual salary may be less than the lower range or greater than the upper range depending on skills and experience No employee is guaranteed salary at the amount of the lower range  Targeted Gross Monthly Salary 22042  27550 PLN Type of employment Contract of Employment Flexible Spending Wallets for tech food and lifestyle Generous time off policies Away Days  wellness days to take off work and recharge Learning  Development programs Parental leave Robust health benefits Employee Resource  Community Groups This role is eligible for creative tax benefits subject to applicable law and company policy   Location  Remote Poland The majority of our roles can be located anywhere in Poland This job description is not a contractual document and is not intended to have binding force LIRemote    Affirm is proud to be a remotefirst company The majority of our roles are remote and you can work almost anywhere within the country of hire  We have a simple and transparent remotefirst gradebased compensation structure Offer amounts within the range are based on a number of factors including but not limited to jobrelated skills experience and relevant education or training Across the broader organization certain roles are eligible for equity awards upon hire promotion tenure milestones and for performance Were extremely proud to offer competitive benefits that are anchored to our core value of people come first Some key highlights of our benefits package include   Health care coverage  Affirm covers all premiums for all levels of coverage for you and your dependents  Flexible Spending Wallets  generous stipends for spending on Technology Food various Lifestyle needs and family forming expenses Time off  competitive vacation and holiday schedules allowing you to take time off to rest and recharge ESPP  An employee stock purchase plan enabling you to buy shares of Affirm at a discount  We believe Its On Us to provide an inclusive interview experience for all including people with disabilities We are happy to provide reasonable accommodations to candidates in need of individualized support during the hiring process   By clicking Submit Application you acknowledge that you have read the Affirm Employment Privacy Policy for applicants within the United States the EU Employee Notice Regarding Use of Personal Data Poland for applicants applying from Poland the EU Employee Notice Regarding Use of Personal Data Spain for applicants applying from Spain or the Affirm UK Limited Employee Notice Regarding Use of Personal Data for applicants applying from the United Kingdom and hereby freely and unambiguously give informed consent to the collection processing use and storage of your personal information as described therein   ,2023-06-05,Poland,2023-06-05 21:20:10.316208
Learning Consultant,https://tryremotely.com/remote-jobs/360-learning-learning-consultant-14446,Our Learning Consultant team plays a crucial role in training our clients on how to create a Collaborative Learning organization and how to use our platform to reshape the way corporate learning is being distributed They are a team of learning and development subjectmatter experts who excel in consultative roles As a Learning Consultant you will be part of the Client success team whose mission is to support customers during their contract life cycle starting by the launch of their new collaborative learning softwareYou will be assigned to a portfolio of projects that can go from Onboarding a new customer using a blended training approach combining elearning and live workshops to help them understand and make the most of our exciting learning platform Implementation projects of the solution on existing customers and ensure adoption and successful launch Specific and dedicated workshops to boost client usage Consulting projects of 612 weeks duration for best practices sharing and drive customer towards successSuccess in this role is measured by meeting customer satisfaction key project timelines and customer retention Within 1 month you will Become a Trello and Convexity expert through our onboarding processUnderstand how our Customer Success Team works together to make customers successfulMaster our product and services offeringMeet the global team through virtual coffee meets and happy hoursShadow ongoing projects Within 3 months you will Host your first workshops with customers and get feedback from your peersStart your first projectsDefine your quarterly priorities in relation to the Customer Success Team with your coachBecome an active participant in updating our internal knowledge base on Trello to help the LEC team succeed and scale as we grow Within 6 months you will Take the lead on more complex workshops and projectsMaster all advanced solutionsParticipate in regular Discovery Meetings with Product Managers to identify the features that will impact your teams activityParticipate in presales activities when large prospects need to experience first hand the type of support an LC will provide Within 12 months you will Create the scripts and associated educational resources for new services delivered by the LCOnboard and mentor at least 1 new LC The Skillset First experience with creating or managing learning and development curriculumYou are recognized for your listening and teaching skillsAbility to express your ideas in a clear and concise manner both written and oralYou are proactive and prefer working in a strong resultsoriented cultureKeen interest for the digital industry education and elearning in particularFluent proficiency in French German and EnglishEnthusiasm about the idea of working in our Culture of ConvexityhttpsbitlyConvexity360L  What we offer   CompensationPackage includes base salary a variable component and equity BenefitsPerksWork From Home stipend RTT lunch vouchers medical insurance gym subscription 1 month parental leave for the second parent View our CSR charterhttps360learningcomblogcorporatesocialresponsibilitycharter  BalanceFlexible hours full remote work possible anywhere in France International teamOffices in London New York and Paris CultureA framework that will make you successful  envision whats it like to join 360Learning from onboarding to rampup and beyondhttps360learningcomblog360learnerjourney  Interview Process Phone screen with our recruiterDiscovery meeting with the LEC coachCase study presentationClarification meeting with our Head of PSCulture fit interview with our VP CSOffer  Additional Information Who We Are360Learning enables companies to upskill from within by turning their experts into champions for employee customer and partner growth With our LMS for collaborative learning Learning amp Development teams can accelerate upskilling with the help of internal experts instead of slow topdown training 360Learning is the easiest way to onboard and upskill employees train customerfacing teams and enable customers and partnersall from one place 360Learning powers the future of work at 1700 organizations Founded in 2013 360Learning has raised 240 million with 400 team members across the US and EMEALearning Includes EveryoneIn concert with our culture 360Learning believes learning includes everyone and that means embracing the strengths of diversity connectedness and inclusion Through conscientious efforts our global footprint celebrates cultures perspectives and experiences from all over the world to support our platform that is built for all regardless of race ethnicity gender identity or expression sexual orientation religion age neurodiversity disability status citizenship veteran status or any other aspect which makes an individual unique or protected by laws and regulations in the locations where we operate Thus 360Learning is proud to be an equal opportunity workplace and we commit to continue this throughout our processes for recruitment compensation benefits performance promotion and all other conditions and terms of employment We want to learn from and with you,2023-06-05,France,2023-06-05 21:20:10.316248
