title,link,description,pubdate,location,timestamp
SimpleTexting Sales Specialist,https://weworkremotely.com/remote-jobs/simpletexting-sales-specialist,  Headquarters Miami Florida URL httpssimpletextingcom  Were seeking a hardworking Sales Specialist to help introduce potential customers to all that SimpleTexting has to offer This is an entrylevel position but prior experience working with customers is a must The ideal candidate is comfortable handling a high volume of conversations primarily via chat switching gears quickly and passionate about helping people We pride ourselves on amazing customer service In this role youd be the first point of contact for people new to SimpleTexting  About Us SimpleTexting is a SaaS company that makes it easy for businesses of all sizes to text their audience Our customers use us to send marketing campaigns important alerts and have twoway sales and customer support conversations Over the last decade weve helped countless organizations better communicate with the people most important to them We continue to set ambitious goals and are looking for someone who can help us meet them  SimpleTexting is proudly part of Sinch a leading global Communication Platform as a Service CPaaS provider offering messaging voice and video communication solutions to a large global customer base Sinchs APIs and platform deal with over 145 billion engagements annually Enterprise customers include 8 out of 10 of the largest US tech companies by market capitalization major airlines banks retail etail internet ridehailing parcel delivery companies and more   This Role Is For You If  You love to talk actively listen and get people excited about a new service Multiple chats and calls happening at once doesnt make you sweat You thrive in fastpaced environments Youre as comfortable hopping on the phone as you are writing super clear emails You dont just stop after answering the initial question asked but go above and beyond in discovering how best to help a customer You have no shame geeking out about business and technology  Salary Range 65k OTE Salary will be evaluated based upon experience   Key Responsibilities  Respond to email tickets online chats or phone calls to help potential SimpleTexting customers get signed up and started with the platform Explore the needs of potential customers and help them take the first step toward succeeding with SimpleTexting Qualify customers and get them connected with an account executive where appropriate Answer customer questions about how SimpleTexting can work for their business Become a SimpleTexting power user provide accurate valid and complete information by using the right methodstools Build sustainable relationships of trust through open and interactive communication Work with customer service manager to ensure proper customer service is being delivered Helping to write excellent help documentation  both for internal use and for our customers Go the extra mile to engage customers  The preferred candidate will be able to demonstrate the following skills and experience   Minimum Qualifications  English is your primary language Secondary languages are a plus At least 1 year of experience working with customers preferably in a sales role Demonstrable critical thinking communication and creative problemsolving skills Experience qualifying and evaluating customer needs Ability to learn new software platforms quickly Selfstarter positive attitude ability to continuously develop and adapt to a growing team Highly organized You can manage and prioritize several different projects Familiarity with chat and CRM platforms  Bonus Points  Bachelors degree preferably in a related field of study 2 years in customerfacing role preferably in a sales role Experience working in the SaaS industry  Our values of Dream big Win together Keep it simple and Make it happen are what make us successful on our journey to be the global leader in customer engagement for SMBs so people who feel a connection to these values and like the pace of a fastgrowing global company will easily fit into our team We are committed to building a company that empowers individuals from a diverse set of backgrounds to be their authentic self and bring their values into their work We know that the more diverse and inclusive we are the better our success will be In addition we offer the following benefits   Flexible working arrangements  Generous timeoff policy  take the time you need to operate at peak performance  Excellent medical benefits including multiple medical dental amp vision plans to meet your personal needs  Employee Assistance Program  Coaching and ongoing career development  If youre looking for your next opportunity in your career and want to work for a growing tech company then apply now   To apply httpsweworkremotelycomremotejobssimpletextingsalesspecialist,2023-06-05,NaN,2023-06-05 21:20:10.308309
saasgroup Sales Manager,https://weworkremotely.com/remote-jobs/saas-group-sales-manager,  Headquarters Europe  Remote URL httpssaasgroupcareers  Sales Manager Enterprise Clients Position Overview We are currently seeking an enthusiastic and motivated Sales Manager to join our tightknit growth team as we continue to innovate and develop cuttingedge web scraping solutions As a Sales Manager at ScraperAPI youll drive revenue growth by identifying and converting potential clients showcasing the value of our API and building lasting relationships Collaborating with our growth engineering team youll develop effective sales strategies in line with our mission This role is ideal for a proactive resultsdriven individual eager to make a significant impact in the web scraping industry within a rapidly growing company About the role Were excited to welcome a passionate Sales Manager to join our friendly and dynamic team at ScraperAPI In this pivotal role youll be at the forefront of our sales efforts kickstarting our sales department and working closely with the Head of Customer Success and our Marketing team to support our growing Enterpriselevel user base As a sales representative your key responsibilities will include Shaping and leading our outbound and inbound sales strategy through strategic outreach and research Acquiring leads and scouting for new customers to build and maintain a healthy pipeline of opportunities Collaborating with our Marketing team to align strategies and initiatives Fostering an environment of competitive and healthy dealmaking while sharing valuable insights to empower our Customer Success department Together well explore prioritize and qualify promising sales opportunities using our CRM system Join us at ScraperAPI where we believe in the power of collaboration and innovation and make a lasting impact on our journey towards successWhat you bring to the table Basic understanding of the product and the value proposition it generates for our clients A minimum of 3 years of professional experience in SaaS sales Ideally within the scraping industry but not required Proven history of outstanding sales performance Capability to work autonomously and take initiative Excellent command of the English language both in written and spoken communication Previous experience in conducting lead gen sales demos providing competitive quotes and deal closing What we offer  Ultimate flexibility Were 100 remote You can work from wherever you like whenever you like European timezone is strongly preferred  Freedom and autonomy Were a hightrust team and youll be given lots of independence to solve problems in your own way  with plenty of help from the team when you need it  Minimum bureaucracy We dont like to get bogged down with meetings and red tape We like to be efficient and keep momentum steady amp sustainable  Small amp friendly team We help each other out have fun and joke around  Unlimited paid time off We want you to recharge your batteries when needed  International Travel Meet with the team twice a year at off sites this year is in Barcelona  A team where people learn from each other fostering a supportive and collaborative work environment  A largescale product that customers rely on allowing you to make a real impact Revenuebased Bonus  To apply httpsweworkremotelycomremotejobssaasgroupsalesmanager,2023-06-05,NaN,2023-06-05 21:20:10.308383
OnTheGoSystems Junior Developer with a Passion for Technical Documentation,https://weworkremotely.com/remote-jobs/onthegosystems-junior-developer-with-a-passion-for-technical-documentation,  Headquarters 100 remote URL httpsonthegosystemscom  Looking to join a team of experienced developers work on an exciting project and grow your skills   OnTheGoSystems is searching for a junior developer who will be a jack of all trades Join us in building our Private Translation Cloud PTC a new tool for developers We are seeking a talented passionate and dedicated individual to join our team and contribute to software development architecture and technical documentationRole and ResponsibilitiesAs a junior developer at OnTheGoSystems you will have the opportunity to work on various aspects of our project Roughly 50 of your time will be dedicated to writing technical documentation ensuring that our product is welldocumented and easily understandable for users and developers alike The remaining 50 will involve handson work on the frontend and backend of the product contributing to its development and architectureOur Tech StackOur backend runs mostly on Ruby on Rails For the frontend we typically use React For internal tools we use Python And we encourage our developers to introduce the languages and tools that are best for each project we work onWork HoursOur development team gets together in the European morning 9AM Central European Time and collaborates during the day We work Mondays to Fridays Requirements Proficiency in RubyRails React or Python or a strong willingness to learn these languages and frameworks Experience in writing automated tests we prioritize thorough test coverage before merging any code changes Excellent English communication skills both written and spoken Previous professional experience is not a strict requirement however we value seeing your past projects or impressive personalacademic development initiatives At OnTheGoSystems we prioritize efficiency and encourage the use of AI tools to expedite writing and coding tasks Our lean team utilizes these technologies to accomplish a remarkable amount of work  If you are driven adaptable and eager to contribute to an innovative project while honing your skills this role is designed for youWhat we Offer 100 remote position Fulltime position with paid public holidays vacation and sick leave Being part of a team of highly talented and selfdriven individuals Ample opportunities to progress and advance Collaboration with team members from all around the world with different cultures and languages Join our team and embark on an exciting journey where you can make a difference while working alongside seasoned professionals  To apply httpsweworkremotelycomremotejobsonthegosystemsjuniordeveloperwithapassionfortechnicaldocumentation,2023-06-05,NaN,2023-06-05 21:20:10.308453
Studio North TV Freelance Writer,https://weworkremotely.com/remote-jobs/studio-north-tv-freelance-writer,  Headquarters Toronto Canada URL httpsthestudionorthtv   Studio North TV is currently seeking a Remote Freelance Writer to join our dynamic team This is an exciting opportunity for a creative motivated individual to produce engaging and informative content related to dance our platform and the global dance community  Key Responsibilities  Creating compelling and informative articles and blog posts related to dance and our platform Collaborating with our team to brainstorm and develop new content ideas Assisting in the creation of marketing materials and social media content Ensuring all content aligns with our brand voice and style guidelines  Qualifications  Proven experience as a content writer or similar role Excellent writing and editing skills in English An understanding of SEO principles and content marketing Familiarity with dance or a strong interest in learning about the dance industry Ability to work independently and meet deadlines Strong research skills and attention to detail  How to Apply  If youre passionate about dance and digital education and have a knack for storytelling wed love to hear from you Please submit your resume a cover letter and writing samples or a link to your portfolio to httpsformsglew6kKsNxCi2r3dyYB8  Studio North is an equal opportunity employer We celebrate diversity and are committed to creating an inclusive environment for all employees  To apply httpsweworkremotelycomremotejobsstudionorthtvfreelancewriter,2023-06-05,NaN,2023-06-05 21:20:10.308524
PR Volt Sales  Growth Lead 100 Remote,https://weworkremotely.com/remote-jobs/pr-volt-sales-growth-lead-100-remote,  Headquarters Santa Monica CA URL httpsprvoltcom  PR Volt is seeking a Growth and Sales Lead with strong operating ability to drive key growth and sales initiatives This Leader will be an early member of PR Volts marketing leadership Growth marketing contains 4 core functional areas that you will need to understand and champion to help us achieve aggressive revenue targets across our business demand generation lifecycle marketing performance marketing and inbound sales Were looking for a leader who is passionate about improving how brands achieve press coverage and enabling them to be successful at every stage of the customer journey The ideal candidate understands the fundamentals of business and marketing and can drive complex projects forward with crossfunctional teams You are highly organized with a bias for productivity and highly analytical with an ability to make decisions using both quantitative and qualitative data If you are an experienced growth marketer who is solutionoriented highly motivated and a proactive selfstarter wed love to talk to you    What Youll Do in this Role  Formulate the companys user acquisition strategy set and manage aggressive customer acquisition goals and implement initiatives to hit those goals Oversee sales strategy and execution including lead generation outbound sales and managing ales quotas Develop strategic acquisition and retention marketing plans to drive growth and maximize immediate and longterm ROI Continually optimize sales and marketing processes contribute to the development of the sales technology stack and manage all aspects of revenue planning Monitor analyze and report on KPIs to ensure marketing initiatives are driving profitable acquisition and use analytics tools to better understand customers Lead overall site conversion rate optimization develop and optimize landing page strategy and manage agency partners across SEO SEM content and ad creative Maintain and improve sales materials and collateral build and maintain a strong professional network and manage Sales Team quotas and commission plan payments  Requirements  38 years of direct growthfocused experience in digital marketing startup experience preferred Bachelors degree in Marketing Communications Business or a related field Experience building a comprehensive digital marketing strategy from the ground up and managing both paid FBIG Google etc and organic SEO content acquisition Proven experience in a salesfocused role with direct outbound sales lead generation and sales quota management experience Experience in a growthfocused role within the PR marketing digital media SaaS agency or ecommerce industry and experience working with or selling to consumerfocused SMBs  MidMarket Strong analytical skills datadriven mindset and ability to tell stories using data Proficiency in various marketing and analytics tools such as Google Analytics CRM systems Salesforce Hubspot Pipedrive and marketing automation platforms Strong project management and organizational skills with an understanding of the OKR framework Excellent interpersonal communication and presentation skills Ability to work effectively in a fastpaced startup environment being scrappy resourceful persistent and positive Generate positive energy with infectious enthusiasm passion and a drive for excellence    Benefits Were an ambitious smart and openminded team that is passionate about our mission Each day is unlike the last as were constantly moving forward challenging each other and working together to create the future of PR We want people to succeed at PR Volt so we give our people plenty of time off to relax and recharge Following are the primary benefits we offer  Health insurance taxfree reimbursement monthly stipend 15 days PTO  6 paid US holidays which do not count against PTO days Flexible work hours and location we are a remote 1st company and this is a remote role Working as part of a global business with a diverse team Opportunity to grow from the ground up with an earlystage startup Yearly 1500 allowance for technical equipmentwork accessories Annual holiday party and company retreat  To apply httpsweworkremotelycomremotejobsprvoltsalesgrowthlead100remote,2023-06-05,NaN,2023-06-05 21:20:10.308595
Scaffold Digital MidSenior Software Developer,https://weworkremotely.com/remote-jobs/scaffold-digital-mid-senior-software-developer,  Headquarters Belfast United Kingdom URL httpsscaffolddigital  At Scaffold Digital we are passionate about creating innovative digital experiences We are a team of creative thinkers and problem solvers dedicated to expanding the limits of what is possible by helping customers achieve their goalsWhat does the job involve In short We are seeking a talented and experienced midsenior level software developer to join our team In this role you will be responsible for designing developing and maintaining highquality software solutions that meet client requirements You will work closely with crossfunctional teams collaborating with designers product managers and fellow developers to deliver exceptional results Key responsibilities Develop test and deploy software solutions that meet project requirements and quality standards Collaborate with team members to design and implement efficient and scalable software architectures Participate in code reviews providing constructive feedback and ensuring code quality Mentor junior developers sharing knowledge and best practices to foster their growth Take ownership of assigned tasks and projects ensuring timely delivery and meeting project deadlines Stay updated with the latest industry trends and technologies continuously enhancing your skills  What type of person are we looking forFit our brand personality Good sense of humour Friendly positive and easygoing You will care about delivering quality solutions that produce meaningful value You approach problem solving methodically and pragmatically  Trustworthy  If you make a mistake youre the first to admit it  Progressive  Youre always learning and curious about different ways to approach a problem  Collaborative  You will be keen to work with and help others as part of a closeknit team  Experience Solid experience in software development with expertise in PHP Preferable with Laravel amp Angular experience Proven track record of successfully delivering software projects on time and to specifications Strong problemsolving and analytical skills with the ability to troubleshoot complex issues Excellent collaboration and communication skills with the ability to work effectively in a team environment Leadership potential and a desire to grow into a team lead role in the future  The benefits of joining our team We are a remotefirst team with a base in Belfast Northern Ireland Hybrid working and with local team meetups at Ormeau Baths Belfast  Northern Ireland Annual international company retreat Salary negotiable depending on experience Flexible working hours based on a 375 hour week Opportunities to learn and advance your skills with a team of likeminded people  To apply httpsweworkremotelycomremotejobsscaffolddigitalmidseniorsoftwaredeveloper,2023-06-05,NaN,2023-06-05 21:20:10.308666
