title,link,description,pubdate,location,timestamp
"Imagine Consulting, LLC: Executive Director",https://weworkremotely.com/remote-jobs/imagine-consulting-llc-executive-director,Time zones EST UTC 5 CST UTC 6 MST UTC 7 PST UTC 8 AKST UTC 9 HST UTC 10Location Remote Start Date October 2023Salary Range 8500095000  benefits Travel 36 trips per year Reports To Chair of BoardApplication Deadline July 28 2023  Click here to applyPlease note the application deadline is July 28th at 1159 PM PT We will not actively screen those who apply after the deadline However if you apply after the deadline and the position is not filled we will review your applicationThe OpportunityCatholic Volunteer Network CVN is actively seeking a leader to serve as its Executive Director driving the enhancement of membership services and exploration of innovative structures that promote diversity equity and inclusion With a rich 60year history the Executive Director will play a critical role within the leadership team dedicated to achieving CVNs mission objectives This position involves executing a comprehensive development strategy to ensure a robust annual operating budget The Executive Director will provide guidance to staff in delivering exceptional membership services and fostering collaborative relationships with partner organizations that strengthen the field of faithbased volunteer service Key Responsibilities 25  Strategic Vision  DEI Advancement Develop and execute a strategic vision and annual work plan that aligns with the organizations strategic goals and priorities catering to the needs of member programs in 2023 and driving increased participationLead CVNs commitment to becoming an antiracist organization in reviewing and renewing operations policies and practices that upholds CVNs commitment to racial justice diversity equity and inclusion DEI grounded in Catholic Social TeachingDevelop strategic partnerships that grow membership and organizational sustainability in an evolving Church and cultural landscape 50  Development Strategy  Fiscal ResponsibilityCreate and execute a comprehensive development strategy that ensures the current operations are adequately funded and supports the longterm sustainability of the organizationOversee and coordinate all fundraising efforts including membership initiatives service fees grant writing direct mail campaigns and outreach to major donorsManage CVNs operating budget oversee daytoday financial matters coordinate the annual audit facilitate the proper filing of tax documents and ensure compliance with all applicable laws and regulations governing nonprofits25  Organizational Leadership Supervise hire and evaluate the performance of staff members fostering a supportive and growthoriented work environment that provides opportunities for professional developmentCultivate a collaborative culture among the staff promoting teamwork and acknowledging the unique talents and contributions of team membersEnsure operational and programmatic excellence upholding all aspects of the organizations work meet high standards of quality and effectivenessFoster alignment and synergy among the Board staff and member programs to advance CVNs missionThis job description is not intended to be allinclusive Employees may perform other related duties to meet the ongoing needs of the organizationThe Skills Youll NeedSuccess in the Executive Director role will require a deep commitment to CVNs mission core values and commitments to diversity and racial justice In addition the Executive Director will provide thoughtful leadership that is inclusive transparent and empowering in a manner that supports and guides the organizations mission while developing new and innovative models of faithbased serviceThe ideal candidate will also bring the following skills attributes and experiences10 years professional experience in nonprofit or faithbased organizational leadership Demonstrated success in managing and raising an annual budget fundraising efforts and grant writing Excellent communication skills both written and oral Collaborative and team orientedExperience with volunteer andor membership organizations ecumenical approaches to service and understanding of Catholic Social TeachingDemonstrated history of successfully leading staff with orientation to action and resultsCommitment to diversity equity inclusion and justiceAwareness of institutional injustices impacting communities served by volunteer programs Creative businessminded thinkerFormer postgrad volunteer experience a plusThe PeopleLeading a dedicated and passionate team the Executive Director guides a closeknit staff known for their unwavering dedication to faithbased service commitment to racial justice and exceptional member program engagement This involves working closely with the Board of Directors staff leadership and its committees in strategic vision and DEI commitment The Executive Director will collaborate with the Development Committee to craft a development strategy while overseeing the organizations operating budget in partnership with the Accountant The OrganizationSince 1963 Catholic Volunteer Network has sought to bring together people who have a heart for service Today our community consists of volunteer program staff volunteers missioners and fellows prospective current and former colleges and universities dioceses and parishes religious communities lay groups partner organizations individuals who are champions for service and a dedicated staff and Board of DirectorsOur foundation is built on the gospel and rooted in the principles of Catholic Social Teaching We strive to increase awareness of the opportunity to live out ones faith in service to the poor and actively work to remove any barriers that may prevent people from engaging in faithbased service Learn more about our impact here The Next StepsThis search is being led by Candice Durham of Imagine Consulting We are a talent and recruitment firm specializing in placing highimpact people in highimpact roles Interested candidates should click this link to apply If you have questions or need support completing the application please reach out to our team at careersimagineimpactllccomAs part of Catholic Volunteer Networks commitment to recruiting and retaining a just and representative work and volunteer force we encourage people of color and individuals with disabilities to apply Catholic Volunteer Network is an equal opportunity employer It is our policy that employees and volunteers should be able to enjoy an environment free from all forms of unlawful discrimination All decisions regarding recruiting hiring promotion assignment training termination and other terms and conditions of employment or volunteer work will be made without unlawful discrimination on the basis of race color national origin sex sexual orientation gender identity or expression disability or any other factor that the law protects from employment discriminationHistorically people of color women transgender GNCNB gender nonconforming and nonbinary and disabled individuals face insurmountable oppression when engaging with employers and recruiters At Imagine we understand that talent is not bound to a single story and that our intersectional identities are value adds in every space we enter CVN and Imagine are committed to building and supporting a diverse staff and investing in fostering leadership from marginalized communities,2023-07-21,USA,2023-07-21 06:27:22.054843
Bottomless: Senior Full Stack Developer,https://weworkremotely.com/remote-jobs/bottomless-senior-full-stack-developer-11,We are looking for a jackofalltrades senior javascriptfull stack developerThe ideal candidate for this position would be able to dive into any kind of project from frontend UIUX tasks in Reactjs to backend tasks running on NodejsIf youre interested in variety and working hard to build something big this might be a good fitWe need to achieve 80 of the results with 20 of the effortResponsibilitiesDesign and build infrastructure and products for a sensorenabled ecommerce marketplaceBuild robust infrastructure to support existing product lines and the ability to roll out new onesResponsibility over the userfacing productQuick iteration on different fronts from fronted UX changes to database design to quick and dirty implementationsResponsible for full deployment and testing of applicationsSkill Qualifications and ExperienceExpert proficiency requiredNodejsNoSQL databasesReactjsEnglish written and verbalIntermediate proficiency at a minimumUIUX designSoftware architectureNot required but a plusPython background tasksEmbedded systems C DetailsRemote OK Must be flexible with hours as we have a remote international teamCompetitive equity and cash compensation,2023-07-21,Anywhere,2023-07-21 06:27:22.248027
Power Home Remodeling: User Experience Designer,https://weworkremotely.com/remote-jobs/power-home-remodeling-user-experience-designer,Time zones EST UTC 5 CST UTC 6 MST UTC 7MidLevel User Experience DesignerLooking to make a real impact in a dynamic and collaborative workplace Power the largest home remodeling company in the nation is looking for a passionate and motivated User Experience Designer to join our us Youll have the chance to define how users will interact with our custom innovative technology products and collaborate with a team that is constantly pushing ourselves to improve and build tools that people genuinely want to useTo see our design teams work visit httpsdribbblecompowerhrgWhat we do hereFancy a unique work environment that is constantly pushing you to try something new or perhaps stretch your skills by designing for an industry youve always wanted to improveAt Power we build our own application suite of products to run our entire business We build complete solutions for finance recruiting sales contact center and even meeting software These are just some of the areas youll get an opportunity to tackleWe also design solutions for augmented reality in the home satellite photo measurements and artificial intelligence suggestion enginesWe get to dip our toes in many different fascinating areas and solve unique challenging problems that would on their own be standalone apps or companies Were a tech powerhouse built inside a remodeling companyOur teams are distributed so we live and die by our ability to successfully collaborate We communicate using our own slacklike chat client We use our own handoff tools to support our User Experience team to create and collaborate with the development and business groupsLike design systems We also believe that a design system unites product teams around a common visual language so weve built 2 open source projects to support this effort called PlaybookThe user experience team is a small and diverse team made up of UX Designers and UX Engineers We value diversity of all types at Power and our team is made up of a kind thoughtful group of people with a wide range of backgrounds We actively try to find people with different perspectives and experiences to the ones we already haveWith a distributed group its important to connect in person so we fly the whole team to Philadelphia 3 times a year for our weeklong event called Create which focuses on connecting and learning from each other and the businessAt Power we have all the upsides of a startup move fast ship rapidly and iterate quickly but with the benefit of an established organization that is well funded and profitableThe biggest perk of working at Power is that we have a small talented team with a very large audience This means you have the ability to make a huge impact on the product and the company while having really interesting and challenging problems to work on We believe deeply in what we do and were all in this to build something lasting sustainable and positivePower has been awarded Computerworlds Best Places to Work in IT Fortune Magazines 1 Workplace for Millennials one of Glassdoors Best Places to Work one of Inc 5000s Fastest Growing Private Companies and Philadelphia Magazine Coolest CompaniesQualificationsMUST PROVIDE A LINK TO YOUR PORTFOLIOA minimum of 3 years of industry experience in product designAbility to design projects across the entire product lifecycleStrong written and verbal communication and presentation skillsStrong collaboration skills across disciplines to drive change into productsAbility to manage and work on multiple projects concurrentlyExperience working with and building design systemsAbility to define problems and goals map user flows prototype interactionsAbility to support the building process across with developmentA deep understanding of user problems to create elegant but practical solutionsThorough knowledge of many design approaches methodologies and lofi and highfi prototyping skillsAbility to identify problems and act on opportunities to improve the productNice to have Experience with frontend developmentNice to have Ruby on Rails and or Reactjs experienceSalary and BenefitsFull medical dental life and disability insurance plans that can be tailored to your specific needs and the needs of your familyA competitive 401k retirement savings program matched by PowerCompetitive salary  We pay very well at market rates reflecting both location and experienceAll the tech you need  Well pay for whatever hardware and software you need to work and make sure youre regularly upgraded to the latest versionsPersonal development  Personal development books courses  conferencesPaid parental leave  When the time comes to welcome a new member of the family we offer paid parental leaveNitro Create Powers own tech conference 3 times per yearPower Home Remodeling Group is an equal opportunity employer and we are committed to hiring a diverse and talented workforce If you have a disability or special need that requires accommodation please submit the accommodation request to recruitingpowerhrgcom,2023-07-21,USA,2023-07-21 06:27:22.418651
Vizcom: Senior Fullstack Software Engineer,https://weworkremotely.com/remote-jobs/vizcom-senior-fullstack-software-engineer,Time zones EST UTC 5 CST UTC 6 MST UTC 7 PST UTC 8 AKST UTC 9 HST UTC 10 AST UTC 4 NST UTC 330VizcomTLDR Were Vizcom a startup creating innovative tools for industrial design with AI and were hiring Were looking for a FullStack Web Engineer to join our growing downtoearth remote team If youre a problemsolver interested in design and technology and focused on getting things done were looking for youAbout VizcomVizcom is changing the game for industrial design with our Generative AI technology Our tools utilized by leading companies like Ford Toyota and Nike are transforming traditional design workflowsWere a small team focused on collaboration and valuing each others contributions As we grow were committed to maintaining our grounded teamfirst cultureThe RoleWere hiring a FullStack Web Engineer to help us advance our product We need a problemsolver with the technical skills to integrate diverse technologies into a unified effective productResponsibilitiesIncorporate opensource Generative AI into our productWork with our tech stack React TypeScript PostgreSQL GraphQL Docker Kubernetes Pulumi AWS HTML Canvas and WebGLImplement solutions using Docker Kubernetes and PulumiContribute to our company culture processes and future team growthAbout YouWere looking for someone withKnowledge and experience in Generative AI frameworks like stable diffusion Strong engineering skills and a love for solving problems A passion for contributing to the future of design and technologyPerks and BenefitsCompetitive salary and equity package Flexible work hours and location We also offer relocation assistance if needed The chance to make a significant impact in a growing startup Were more interested in what you can do rather than your qualifications or years of experienceApplication ProcessReady to join us Send your resume and GitHub profile to kaelanvizcomai with Full Stack Web Engineer as the subjectAt Vizcom we value what youve accomplished more than whats on your resume so were especially interested in seeing the projects youve worked on Join us and lets build the future of design together,2023-07-21,North America,2023-07-21 06:27:22.631553
Medford Property Company: Personal Assistant,https://weworkremotely.com/remote-jobs/medford-property-company-personal-assistant,Time zones EST UTC 5 CST UTC 6 MST UTC 7 PST UTC 8 AKST UTC 9 HST UTC 10Job SummaryAs a Remote Personal Assistant at Medford Property Company you will play a pivotal role in supporting the daily operations of our executive team You will work closely with our senior management to provide efficient and effective administrative assistance streamline communication manage schedules and contribute to the overall success of our organization This is an excellent opportunity to work with a forwardthinking company from the comfort of your own homeResponsibilitiesAdministrative Support Manage and organize calendars schedule appointments and arrange meetings for senior executives Handle email correspondence prioritize incoming messages and respond to routine inquiries as neededTravel Coordination Plan and coordinate travel arrangements including flights accommodations and ground transportation for executive team membersData Management Maintain accurate and uptodate records files and documents related to company projects contracts and other essential informationCommunication Liaison Act as a liaison between executives and internalexternal stakeholders Ensure clear and timely communication flow handle incoming calls and relay messages accuratelyResearch and Reporting Conduct research on various topics and compile data for reports presentations and special projects as requestedDocument Preparation Assist in drafting formatting and proofreading documents memos and presentationsExpense Management Monitor and reconcile expense reports for executives ensuring adherence to company policiesTask Coordination Coordinate and follow up on tasks assigned by executives to various teams or individuals to ensure timely completionConfidentiality Maintain strict confidentiality regarding sensitive company and personal informationAd hoc Support Provide additional support and take on various ad hoc tasks as neededQualificationsProven Experience Previous experience as a personal assistant or administrative assistant is preferredTechsavvy Proficiency in using remote communication tools eg email video conferencing project management software and MS Office Suite Word Excel PowerPoint etcOrganizational Skills Strong organizational and time management skills with the ability to prioritize tasks effectivelyCommunication Excellent written and verbal communication skills including professional phone etiquetteProblemsolving Resourceful and able to anticipate needs identify issues and propose solutionsDiscretion Demonstrated ability to handle sensitive and confidential information with discretionInitiative Selfmotivated and proactive able to work independently with minimal supervisionAdaptability Ability to adapt to changing priorities and handle multiple tasks simultaneouslyTeam Player Willingness to collaborate with various team members and assist where neededFlexibility Available to work occasional extended hours to accommodate executive schedules and time zonesLocation This is a remote position and candidates from any location within specify any location restrictions will be consideredHow to ApplyTo apply for the Remote Personal Assistant position at Medford Property Company please submit your updated resume and a cover letter detailing your relevant experience and why you believe you are the ideal candidate for this role Send your application to taylorpanteloutlookcom to APPLY,2023-07-21,USA,2023-07-21 06:27:22.802587
