title,link,description,pubdate,location,timestamp
LeadSimple Inc Staff Engineer,https://weworkremotely.com/remote-jobs/leadsimple-inc-staff-engineer, Headquarters Washington State USA URL httpswwwleadsimplecomcareers   Want to join a team of Aplayers in an exciting highgrowth entrepreneurial environmentLeadSimple is a small team solving big problems in the property management industry Bootstrapped since 2013 were passionate about helping small businesses grow sustainablyOur software provides a powerful foundation for any property management company to take their business to the next level Thousands of property managers rely on us for their daytoday operations and were only getting started Were looking for seasoned Senior and Staff Ruby on Rails Engineers to join our fullyremote team to help us scale to meet market demand This is an opportunity to join on the ground floor of a bootstrapped growing company with a lot of upside Expectations for your first 6 months  Within 90 Days Become familiar with the Engineering Teams internal processes LeadSimples architecture and production environment and the overall product using our customer facing documentation Conduct technical interviews with potential engineering candidates and make recommendations to hiring managers Participate in an oncall rotation at least three times Own the Engineering Teams maintenance pitches for betting table cycles  Replace the Head of Engineering as the teams goto advisor on technical decisions including PR reviews Identify pitch and successfully complete at least two highimpact highcomplexity projects   A day in the life of  Unblock critical or complex requests from the team by providing expert review and advice Actively share your knowledge and expertise to help the team level up Review work samples from candidates and attend interviews Provide Engineering Managers with feedback on performance and promotion decisions for individual team members Advise the leadership team of ongoing engineering projects Ensure consistent software quality by advocating for and leading adoption of industry best practices Manage the technical design tasks delivery and deadlines for assigned projects following the Shape Up process Write Shape Up pitches for potential projects to improve the scalability performance or team productivity Advocate for these projects at the Betting Table using data and analysis  Help us scale the team product and company by proposing improvements that will make us more effective  Perks  Monthly Friday Free Day Company Holidays Paid Time Off in addition to the above Monthly Healthcare Allowance Yearly Vacation Allowance Fun and outcome driven work environment with a smart hard working team Location independence Mission driven company and valuesbased culture  Qualifications Must have 7 years in senior engineering roles involving Ruby 3 years involving React Fluent spoken and written English at a professional level Working hours must overlap with PST for at least 3 hours Familiarity with PostgreSQL query optimization and scaling strategies Strong analytical and debugging skills Strong communication skills able to recommend decisions using data and experience Nice to have 10 years in senior or staff software engineering roles involving Ruby 5 years involving React  React Typescript or GraphQL experience Elixir experience we have 1 service using Elixir  Our Stack Frontend Typescript  React  MaterialUI  Relay   Backend   Ruby on Rails monolith with 95 test coverage GraphQL via graphqlruby gem Sidekiq PostgreSQL Redis Heroku   What its like to work here  Youll have opportunities to work on the entire stack from databases to user interfaces and everything in between in a wide variety of product areas Youll own the delivery of highimpact projects that affect real customers from start to finish with no bureaucracy following the Shape Up method  Youll collaborate within a small highly productive team reviewing code and helping other engineers with their roadblocks Youll have time to focus We dont micromanage and we do our best to keep distractions and meetings to a minimum  When assigned to oncall duty youll investigate and fix bugs and respond to incidents  Youll deploy early and often We ship to production multiple times per day   Benefits  Remoteonly team location independent 3rd Friday of every month off 6 US Holidays 3 Weeks Paid Time Off in addition to the above Quarterly TwoWeek Hackathons Monthly Healthcare Allowance Yearly Vacation Allowance 2000 equipment stipend upon hire Focused and dedicated environment with smart caring people Consistent but flexible working schedule with minimum 3hr Pacific Time Zone overlap Mission driven nonpolitical company and valuesbased culture   Our Interview Process  Fill out our application located here  Intro call with People Operations 30 minutes Offline work sample test up to 60 minutes Interview with Hiring Manager up to 6090 minutes Possible panel interview up to 60 minutes Offer call 15 minutes followed by a written offer If you accept the offer you enter a 90day trial period fully paid If all goes well in your first 90 days you convert to a fulltime team member  NOTE We are not accepting applications in California Colorado or New York at this time To apply httpsweworkremotelycomremotejobsleadsimpleincstaffengineer,2023-06-05,NaN,2023-06-05 21:20:10.313461
LeadSimple Inc Business Development Representative,https://weworkremotely.com/remote-jobs/leadsimple-inc-business-development-representative, Headquarters Washington State USA URL httpswwwleadsimplecomcareers   Want to join a team of Aplayers in an exciting highgrowth entrepreneurial environmentWere a small team solving big problems in the property management industry Bootstrapped since 2013 were passionate about helping small businesses simplify growth and streamline operations providing the leading CRM in our space The long version of our story Back when web 20 was a thing get off my lawn LeadSimples founders started a lead generation business connecting landlords with property management companies Witnessing the challenges lead buyers had closing deals led into a natural segue to build out an industryspecific CRM which became the defacto industry standard Fast forward to 2020 when we released a processworkflow suite to move from the sales side of our clients business into the heart of daytoday operations The market was hungry and responded aggressively to the new direction which led us to double down with growth and additional product expansion  Expectations for your first 90 days  Confidently owns the prospecting cycle from start to finish Understands the LeadSimple features and can communicate them to prospects in a relatable and engaging way Hits the monthly quota at 100 20 SQLsmo  A day in the life of  Makes 40 outbound calls emails and texts to generate and qualify leads Organizes demo schedules for the team Creates relationships and build trust with clients Partner with Account Executives to qualify leads Aggressively purposes pipeline quotas Fervently updates and maintains CRM databases Reports on qualitative and quantitative weekly results Develops creative sales strategies Perks Monthly Friday Free Day Company Holidays Paid Time Off in addition to the above Monthly Healthcare Allowance Yearly Vacation Allowance Fun and outcome driven work environment with a smart hard working team Location independence Mission driven company and valuesbased culture  Please only apply if you  At least one year successful experience in a similar role Have an exceptional level of drive and passion for results Desire to learn new skills and build a career in sales Embrace learning new technology  Learn fast Communicate crisply Own the outcome Embody emotional maturity Bring an optimistic can do attitude Supply your own internet and smartphone Have prior business development experience preferred but not required  We have an amazing team of APlayers and were ready to add more Selected candidates might have written assessments and multiple interviews with different people Well do whatever it takes to get the right person in the right seatIf you think you would thrive in the above environment and make an impact for our customers wed love to talk to youNOTE We are not accepting applications in California Colorado or New York at this time In summary You can do it in an officeYou can do it from homeWe really dont careAs long as its known What matters is thisWhen the chips are downAnd your back is against the wallCan we count on you to make the right callJudgement intuition or care by another nameWe call it Owning The Outcome  because it really is the whole gameHave the customers back and they will treat you the sameIf you can do thatThen were birds of the same featherSo come join our team and well make music together To apply httpsweworkremotelycomremotejobsleadsimpleincbusinessdevelopmentrepresentative,2023-06-05,NaN,2023-06-05 21:20:10.313515
Proxify AB Senior Flutter Developer LongTerm Job  100 Remote,https://weworkremotely.com/remote-jobs/proxify-ab-senior-flutter-developer-long-term-job-100-remote, Headquarters Sweden URL httpcareerproxifyio  The Role We are searching for a Senior Flutter Developer You can be a perfect candidate if you are growthoriented you take pleasure in your work and you enjoy working on new ideas to develop exciting products By joining Proxify you will get considerable opportunities to work with leading brands and amazing startups to build their next product and growth features   What we are looking for You have 3 years of experience using Flutter for AndroidiOS applications and deployment on Google PlayApp Store You possess an indepth understanding of frontend languages like HTML CSS3 and JavaScript You have an extensive understanding of Object Oriented programming languages like Java and C You are familiar with the usage of version control tools like Git Subversion etc and IDEs like Android Studio VS Code etc You follow best practices and conventions Responsible and able to work with minimal supervision Upperintermediate English level You can communicate well with both technical and nontechnical clients  Nicetohave  Timezone CET  3 hours Responsibilities  You will be building and shipping robust apps to Android iOS devices using a single codebase You will be running and designing product application features across various crossplatform devices You will be writing readable and clear code that will be extensively documented for future use and upgrades You will be sharing feedback and brainstorming ideas with teams to improve the development process Stay up to date with the latest technologies  What we offer  100 remote work Work from anywhere  Flexibility The ability to change one project to another one  Financial growth Competitive compensation and performancebased increases  Freedom Very flexible working schedule  360degree growth Opportunities for professional development and personal growth  Your benefits with Proxify  Be part of Proxify community Network with likeminded and enthusiastic individuals to make a difference  Make an impact You get the opportunity to work on projects that inspire you and add value to your career  Transparency Contracts with transparency in earnings and working hours  Save your time Fast and efficient hiring process to match you with the project of your preference  Ownership Take ownership of your work and enjoy more freedom in your career  To apply httpsweworkremotelycomremotejobsproxifyabseniorflutterdeveloperlongtermjob100remote,2023-06-05,NaN,2023-06-05 21:20:10.313569
Proxify AB Senior Laravel Developer LongTerm Job  100 Remote,https://weworkremotely.com/remote-jobs/proxify-ab-senior-laravel-developer-long-term-job-100-remote, Headquarters Sweden URL httpcareerproxifyio  The RoleWe are searching for a Senior Laravel Developer You can be a perfect candidate if you are growthoriented you take pleasure in your work and you enjoy working on new ideas to develop exciting products By joining Proxify you will get considerable opportunities to work with leading brands and amazing startups to build their next product and growth features What we are looking for You have 3 years of experience with Laravel Understanding of the MVC pattern Understanding of SQL databases You follow best practices and conventions Responsible and able to work with minimal supervision Upperintermediate English level You can communicate well with both technical and nontechnical clients  Nicetohave Timezone CET  3 hours Responsibilities  Liaise with fellow backend and frontend developers Design and implement web applications that use the Laravel framework Implement serverside logic to process front inputs Identify and fix bugs that are found within code Interact with SQL databases Ensure all inputs going to a database have been parameterized Ensure the appropriate security standards have been implemented Ensure youve written unit test cases to verify code is performing as expected and to prevent possible security breaches Create written documentation for the different components    What we offer 100 remote work Work from anywhere Flexibility The ability to change one project to another one Financial growth Competitive compensation and performancebased increases Freedom Very flexible working schedule 360degree growth Opportunities for professional development and personal growth  Your benefits with Proxify  Be part of the Proxify community Network with likeminded and enthusiastic individuals to make a difference   Make an impact You get the opportunity to work on projects that inspire you and add value to your career  Transparency Contracts with transparency in earnings and working hours  Save your time Fast and efficient hiring process to match you with the project of your preference  Ownership Take ownership of your work and enjoy more freedom in your career    To apply httpsweworkremotelycomremotejobsproxifyabseniorlaraveldeveloperlongtermjob100remote,2023-06-05,NaN,2023-06-05 21:20:10.313620
AmpiFire Writers Looking For A Steady Reliable Income,https://weworkremotely.com/remote-jobs/ampifire-writers-looking-for-a-steady-reliable-income,  Headquarters London UK URL httpsampifirecom   You Only Need To Be Good At One Thing To Secure This WellPaid Flexible And Stable Side Income Opportunity You need to be good at writing But there are a lot of reasons for you to jump at this opportunity Let me explain We help small businesses compete with large corporations for exposure online Normally the giants have a huge advantage but we level the playing field We do this by publishing content about our clients on some of the biggest sites online  Weve been incredibly successful at this More and more companies want to work with us so we need to publish more and more content And thats why we need your help Youll be writing our clients company announcements and describing their products But whats in it for you Why would you want to write for us  4 Main Reasons To Start Writing For Us  1 Awesome Side Income I dont have to tell you that great side income opportunities dont come around that often But this is one of them Most of our writers earn between 8002000month working parttime Working at a moderate pace thats over 18h And some of our writers are able to make as much as 30h  2 Flexibility Youve Been Looking For We dont have any expectations for the amount of work youll do Its 100 up to you This is perfect if you need extra income but have other things going on besides this job And you can do the job at any time thats convenient for you Set your own hours and work at your own pace  3 Stability You Can Count On One of the worst things about writing jobs is that you always have to hustle to get new clients This wont be the case with us There will always be more work available if you want it Our writers love that No wonder they stay with us for years  4 Get The Training You Need We do expect your English to be bulletproof And youll need some writing chops to get this job But outside of that well provide all the training that you need Not only will you earn an excellent income but youll also get marketable skills that youll use throughout your life  Heres What We Expect From You  You are able to write in an easytounderstand smoothflowing style Your writing doesnt have spelling or grammatical errors You always meet the deadlines you commit to You are willing to work with editors and receive constructive feedback on your work especially in the early stages You are able to adjust your writing style between casual and more formal You are ready to be part of a welcoming supportive team of fellow writers Experience writing press releases or online content is helpful but its not essential   How To Apply Fill out the application form on this page It is critical that you use the word banana in the Why are you applying for this job section If you dont your application will be automatically rejected  To apply httpsweworkremotelycomremotejobsampifirewriterslookingforasteadyreliableincome,2023-06-05,NaN,2023-06-05 21:20:10.313685
Proxify AB Senior DevOps Engineer,https://weworkremotely.com/remote-jobs/proxify-ab-senior-devops-engineer, Headquarters Sweden URL httpcareerproxifyio  The RoleWe are searching for a Senior DevOps Engineer You can be a perfect candidate if you are growthoriented you take pleasure in your work and you enjoy working on new ideas to develop exciting products By joining Proxify you will get considerable opportunities to work with leading brands and amazing startups to build their next product and growth features What we are looking for You have 4 years of solid development experience as a DevOps Engineer You have 3 years of experience in Azure Cloud and Kubernetes You have good understanding of operating monitoring and documenting cloud solutions Responsible and able to work with minimal supervision Upperintermediate English level You can communicate well with both technical and nontechnical clients  Nicetohave   Timezone CET  3 hours Azure certifications in Cloud development and architecture would be a plus  Responsibilities  Set up and maintain local development and test environments based on containers and similar technologies Set up CICD pipelines including build processes for container images and delivery to container registries Planning and setting up automated updates to AKS Azure Kubernetes Service and surrounding infrastructure components Continued setup and improvement of Cloud infrastructure to support new cloudnative solutions Collaborate with the stakeholders  What we offer 100 remote work Work from anywhere Flexibility The ability to change the project to another one Financial growth Competitive compensation and performancebased increases Freedom Very flexible working schedule 360degree growth Opportunities for professional development and personal growth  Your benefits with Proxify  Be part of the Proxify community Network with likeminded and enthusiastic individuals to make a difference   Make an impact You get the opportunity to work on projects that inspire you and add value to your career  Transparency Contracts with transparency in earnings and working hours  Save your time Fast and efficient hiring process to match you with the project of your preference  Ownership Take ownership of your work and enjoy more freedom in your career    To apply httpsweworkremotelycomremotejobsproxifyabseniordevopsengineer,2023-06-05,NaN,2023-06-05 21:20:10.313740
Proxify AB Senior Full Stack Developer LongTerm Job  100 Remote,https://weworkremotely.com/remote-jobs/proxify-ab-senior-full-stack-developer-long-term-job-100-remote, Headquarters Sweden URL httpcareerproxifyio  The RoleWe are searching for a Senior Full Stack Developer skilled in Reactjs and Nodejs You can be a perfect candidate if you are growthoriented you take pleasure in your work and you enjoy working on new ideas to develop exciting products By joining Proxify you will get considerable opportunities to work with leading brands and amazing startups to build their next product and growth features   What we are looking for 4 years of working experience as a FullStack Frontend React JS Design System Backend Microservices architecture NodeJS  Database SQL MongoDB Upperintermediate or higher English level Nicetohave  Timezone CET  3 hours Database Architecture knowledge    What we offer 100 remote work Work from anywhere Flexibility The ability to change the project to another one Financial growth Competitive compensation and performancebased increases Freedom Very flexible working schedule 360 degree growth Opportunities for professional development and personal growth  Your benefits with Proxify  Be part of Proxify community Network with likeminded and enthusiastic individuals to make a difference   Make an impact You get the opportunity to work on the projects that inspire you and add value to your career  Transparency Contracts with transparency in earnings and working hours  Save your time Fast and efficient hiring process to match you with the project of your preference  Ownership Take ownership of your work and enjoy more freedom in your career  To apply httpsweworkremotelycomremotejobsproxifyabseniorfullstackdeveloperlongtermjob100remote,2023-06-05,NaN,2023-06-05 21:20:10.313798
Nagarro Digital Ventures Senior Digital Project Manager,https://weworkremotely.com/remote-jobs/nagarro-digital-ventures-senior-digital-project-manager, Headquarters URL httpswwwnagarrocom    Were Nagarro Digital Ventures   We are a Digital Product Engineering consultancy who build products services and experiences across all devices and digital mediums that inspire excite and delight Our staff are located all around the world 9600 experts across 26 countries to be exact Were looking for fulltime experienced Project Managers to help us organize and execute our clients projects What do we mean by Project Manager Anyone who spent time in the industry knows the definitions of this kind of role can be pretty fluid from company to company Our definition of the role is relatively expansive and successful Project Manager at Nagarro Digital Ventures would have the following characteristics and qualities   Good with clients youll have supporting roles to help you manage the broader client relationship but you are the day to day point person that maintains client confidence  Selfdirected remote work requires selfdirection of course but you are also the CEO of the project you work with the client and your team to find and define the best way to execute the project  Collaborative while you may be the CEO of the project that doesnt mean you are a dictator We hire competent people value their areas of focus and expertise and work together to accomplish the task at hand  Competent with Technology you dont need to be a software engineerdesigner but you need to be able to talk with software engineersdesigners and understand the broad strokes of what they are doing on a given project  Desire to learn we often help clients develop new products in a wide variety of spaces with varying levels of expertise No one person can be expected to be an expert in every field so you need to be flexible and willing to learn to meet clients needs  Ability to ask for help even the most competent people occasionally find themselves over their head either lacking the expertise or enough time to juggle the work Transparency with both the client and internal executive stakeholders is valued elevate problems you cant solve yourself early to the right people  What does the daytoday work look like Much of you daytoday is defined by the clients and the projects you have Often you are empowered to use the tools you prefer because no one tool is right for every job though sometimes clients require specific tools that better integrate with their systems This means skill requirements and responsibilities are a little fuzzy but would include at least the following  Organize projects with tools like Jira Trello and Slack Organize and run client and internal project meetings Estimate new potential projects and define Scopes of Work with help from biz dev engineering and design Drive ontime onbudget delivery of Scope of Work Resolve issues and conflicts and assess dependencies and risks of the SOW Manage forecasting time sheets and billing efforts with our accounting team on your projects Provide internal and external project updates for clients and internal executive management Occasional travel for inperson client meetings 010 of your time once we are comfortably past the pandemic  What are the requirements to be considered for this position Our requirements are as flexible as our projects can be there is no bullet proof plan or perfect list of credentials or skills but the following would put you in strong contention for the position  Experience in the technology industry Experience with Agile Software Development processes running scrums and creating sprint plans Project Management credentials are a bonus but not required Experience interacting with clients and finding ways to meet their needs Experience leading teams and launching products Experience assessing risk conflicts and dependencies on a project Availability during normal North American business hours   What are the benefits Nagarro Digital Ventures Provides  Our benefits include  Competitive salary commensurate with experience Open Paid Time Off Parental Leave familyfriendly flexibility and good work life balance Competitive healthcare benefits including health dental and vision Work from home  Equal Opportunity Nagarro Digital Ventures is an equal opportunity employer We are an international team that celebrates diversity and are committed to creating an inclusive environment for all employees  To apply httpsweworkremotelycomremotejobsnagarrodigitalventuresseniordigitalprojectmanager,2023-06-05,NaN,2023-06-05 21:20:10.313858
