title,link,description,pubdate,location,timestamp
Senior Infrastructure Engineer,https://tryremotely.com/remote-jobs/angi-senior-infrastructure-engineer-33878,Angi is transforming the home services industry creating an environment for homeowners service professionals and employees to feel right at home For most home maintenance needs our platform makes it easier than ever to find a qualified service professional for indoor and outdoor jobs home renovations or anything in between We are on a mission to become the home for everything home by helping small businesses thrive and providing solutions to financing and booking home jobs with just a few clicks Over the last 25 years we have opened our doors to a network of over 200K service professionals and helped over 150 million homeowners love where they live We believe home is the most important place on earth and are embarking on a journey to redefine how people care for their homes Angi is an amazing place to build your dream career join uswe cannot wait to welcome you home About the team We are seeking a highly motivated and skilled Modern Platform Engineer with expertise in Cloud Computing on AWS running workloads in Kubernetes and a focus on ML Ops or other Data Engineering workloads The ideal candidate will have a deep understanding of cloud infrastructure containerization and automation as well as experience in designing deploying and maintaining complex systems The candidate should also have experience in data engineering machine learning and data pipelines If you are passionate about Infrastructure Engineering and the opportunity to work on challenging problems with cuttingedge technologies we encourage you to apply What youll do Design deploy and maintain cloud infrastructure on AWS Develop and maintain Kubernetes clusters for running workloads Build and maintain CICD pipelines for deploying applications Develop and maintain data pipelines for ML Ops or other data engineering workloads Collaborate with data scientists and engineers to design and deploy ML models Monitor and troubleshoot system performance and availability Automate infrastructure and application deployments Stay uptodate with emerging technologies and industry trends Who you are Bachelors degree in Computer Science or related field required Masters degree in Computer Science or related field preferred 5 years of experience in cloud computing on AWS 3 years of experience in Kubernetes and container orchestration Experience working with building out controlloop style operators Experience in automation and infrastructure as code Experience in ML Ops or other data engineering workloads Experience in data engineering machine learning and data pipelines Strong programming skills in Python Java or Go Strong problemsolving skills and attention to detail Excellent communication and collaboration skills Preferred Qualifications Strong understanding of complex distributed systems Experience with monitoring and alerting systems AWS  Kubernetes certifications highly preferred Experience in Terraform Helm or other infrastructure as code tools Experience in Docker or other containerization technologies and big data technologies Hadoop Spark Experience in data visualization and dashboarding tools We value diversity We know that the best ideas come from teams where diverse points of view uncover new solutions to hard problems We welcome and value individuals who bring diverse life experiences educational backgrounds cultures and work experiences Compensation  Benefits The salary band for this position ranges from 170000  200000 and commensurates with experience and performance Compensation may vary based on factors such as cost of living This position will be eligible for a competitive year end performance bonus  equity package Full medical dental vision package to fit your needs Flexible vacation policy work hard and take time when you need it Pet discount plans  retirement plan with company match 401K The rare opportunity to work with sharp motivated teammates solving some of the most unique challenges and changing the world LIRemoteBIRemote,2023-07-21,Remote,2023-07-21 06:27:43.726207
Freelance Editor,https://tryremotely.com/remote-jobs/angi-freelance-editor-33877,Angi is transforming the home services industry creating an environment for homeowners service professionals and employees to feel right at home For most home maintenance needs our platform makes it easier than ever to find a qualified service professional for indoor and outdoor jobs home renovations or anything in between We are on a mission to become the home for everything home by helping small businesses thrive and providing solutions to financing and booking home jobs with just a few clicks Over the last 25 years we have opened our doors to a network of over 200K service professionals and helped over 150 million homeowners love where they live We believe home is the most important place on earth and are embarking on a journey to redefine how people care for their homes Angi is an amazing place to build your dream career join uswe cannot wait to welcome you home The Content  Editorial team at Angi is looking for an experienced Freelance Content Editor to join our growing team Were building bestinclass digital content to help our users learn how to improve and take care of their homes This is a freelance independent contractor position We are looking for availability between 2035 hours per week which can take place at your own schedule In this role you will ensure quality and consistency across large volumes of content from our network of freelance writers In addition to proofreading and editing the Freelance Content Editor will provide feedback to external writers and internal Content Researchers to improve process and output What youll do Edit between 1530 pieces of content per week ranging in word count but averaging around 1000 words per article with a mix of new and updated articles Editing content to uphold Angis brand voicetone grammatical and factual accuracy readability and expertise authority and trust Follow content brief and template guidelines to ensure consistency across articles and that all relevant points are made Ensuring content satisfies user intent by being insightful useful relevant engaging and ultimately more helpful than any other content online Performing relevant SEO checks as it relates to content including on page optimization H1 title tag meta description etc keyword usage and internal linking Review provide feedback and approve stock photography submissions from our Photo Editor team based on brand guidelines Package final article for smooth upload and publishing for our Production team Skills and experience needed for success 1 years experience editing content for English publications andor websites checking for grammar syntax brand voice and tone and more Demonstrable track record of improving content for the web with experience writing or editing SEO driven content Experience writing or editing home improvement home decor or real estate content preferred A degree in English Communications Journalism or a related degree preferred but equivalent experience will be seriously considered Experience with Grammarly plagiarism detectors Google Docs or other editing tools preferred SEO knowledge and experience a plus Familiarity with project management tools such as Mondaycom Compensation The hourly rate for this position ranges 30  40 per hour commensurate with experience and performance Compensation may vary based on factors such as cost of living LIRemote,2023-07-21,Colombia,2023-07-21 06:27:44.388241
Senior Data Mining Specialist,https://tryremotely.com/remote-jobs/angi-senior-data-mining-specialist-33876,Angi is transforming the home services industry creating an environment for homeowners service professionals and employees to feel right at home For most home maintenance needs our platform makes it easier than ever to find a qualified service professional for indoor and outdoor jobs home renovations or anything in between We are on a mission to become the home for everything home by helping small businesses thrive and providing solutions to financing and booking home jobs with just a few clicks Over the last 25 years we have opened our doors to a network of over 200K service professionals and helped over 150 million homeowners love where they live We believe home is the most important place on earth and are embarking on a journey to redefine how people care for their homes Angi is an amazing place to build your dream career join uswe cannot wait to welcome you home About the Team The Data Mining Team provides data ingestion and integration for a 1000 person sales force From generating new leads to analyzing source performance to protecting database integrity we are a critical department to help drive sales performance beginning at lead origination In this role you will be responsible for building and maintaining infrastructure for the department such as data warehousing automated data ingestion tools and integratabtle filtering systems to be used by junior members during data ingestion Also may work occasionally with related outside departments for appending or lead distribution What Youll Do Build web scrapers to extract data from targeted sources Maintain active scrapers and troubleshoot any breaks to maximize crawl uptime Provides advice to junior members for resolving mostcomplex technical roadblocks Builds and maintains infrastructure for data warehousing Collaborates with Database Health and Lead Distribution Performs highlevel competitive analysis to identify deficiencies in targeting strategy May perform other duties assigned Who You Are You have 5 years of relevant experience in building largescale web scrapers Bachelors or Masters degree in Computer Science is strongly preferred but not required Proficient in Excel Python and SQL Familiarity with Looker Snowflake PHP Apache and phpMyAdmin is preferred but not required We know that the best ideas come from teams where diverse points of view uncover new solutions to hard problems We welcome and value individuals who bring diverse life experiences educational backgrounds cultures and work experiences We Value Diversity We know that the best ideas come from teams where diverse points of view uncover new solutions to hard problems We welcome and value individuals who bring diverse life experiences educational backgrounds cultures and work experiences Compensation  Benefits The salary band for this position ranges from 115000145000 commensurate with experience and performance Compensation may vary based on factors such as cost of living This position will be eligible for a competitive year end performance bonus  equity package Full medical dental vision package to fit your needs Flexible vacation policy work hard and take time when you need it Pet discount plans  retirement plan with company match 401K The rare opportunity to work with sharp motivated teammates solving some of the most unique challenges and changing the world LIHybridBIHybrid,2023-07-21,,2023-07-21 06:27:44.754156
Data Analyst,https://tryremotely.com/remote-jobs/angi-data-analyst-33875,Angi is transforming the home services industry creating an environment for homeowners service professionals and employees to feel right at home For most home maintenance needs our platform makes it easier than ever to find a qualified service professional for indoor and outdoor jobs home renovations or anything in between We are on a mission to become the home for everything home by helping small businesses thrive and providing solutions to financing and booking home jobs with just a few clicks Over the last 25 years we have opened our doors to a network of over 200K service professionals and helped over 150 million homeowners love where they live We believe home is the most important place on earth and are embarking on a journey to redefine how people care for their homes Angi is an amazing place to build your dream career join uswe cannot wait to welcome you home About the team The Leads Marketplace Analytics team provides insights and helps optimize strategy by working closely with leadership across our sales customer care product development and finance organizations Our business is a twosided marketplace of homeowners and service professionals which makes our jobs complex and data rich We work in a crossfunctional capacity to develop execute monitor and refine initiatives that drive business value Due to the multifaceted nature of our business our team provides an excellent environment to stretch your business acumen technical knowhow and quantitative skills while providing insight to the company What youll do Be a valuable partner to the leadership teams across different business units providing datadriven insights and analyses Learn the complex Angi ecosystem and be the subject matter expert on all data and objectives relating to the operations team you support Gauge the performance of AB tests to better understand the impact of offer strategy on sales conversion and customer lifetime value Understand sales rep compensation outcomes relative to value production and identify areas for improvement Analyze the effectiveness of our dialing cadence and the leads we dial Build new models and improve on existing models used for forecasting rep headcount attrition productivity and compensation expenses Who you are Bachelors degree in a technical field such as Business Analytics Engineering Finance Economics etc 14 years of professional experience in an analytical role Advanced Excel and SQL experience knowledge of relational databases Strong grasp of statistics with experience in statistical languages R Python etc Superior analytical problemstructuring and problemsolving skills experience synthesizing data into information and presenting concise analyses Ability to manage multiple projects simultaneously and willingness to quickly pivot into new tasks as needed Ability to validate results of analyses by reconciling with data from other sources We value diversity We know that the best ideas come from teams where diverse points of view uncover new solutions to hard problems We welcome and value individuals who bring diverse life experiences educational backgrounds cultures and work experiences Compensation  Benefits The salary band for this position ranges 75000  100000 commensurate with experience and performance Compensation may vary based on factors such as cost of living This position will be eligible for a competitive year end performance bonus  equity package Full medical dental vision package to fit your needs Flexible vacation policy work hard and take time when you need it Pet discount plans  retirement plan with company match 401K The rare opportunity to work with sharp motivated teammates solving some of the most unique challenges and changing the world LIHybridBIHybrid,2023-07-21,Colombia,2023-07-21 06:27:45.174560
"Senior Accountant, Financial Reporting",https://tryremotely.com/remote-jobs/angi-senior-accountant-financial-reporting-33874,Angi is transforming the home services industry creating an environment for homeowners service professionals and employees to feel right at home For most home maintenance needs our platform makes it easier than ever to find a qualified service professional for indoor and outdoor jobs home renovations or anything in between We are on a mission to become the home for everything home by helping small businesses thrive and providing solutions to financing and booking home jobs with just a few clicks Over the last 25 years we have opened our doors to a network of over 200K service professionals and helped over 150 million homeowners love where they live We believe home is the most important place on earth and are embarking on a journey to redefine how people care for their homes Angi is an amazing place to build your dream career join uswe cannot wait to welcome you home About the role We are seeking a highly skilled Senior Accountant to join our team and help us achieve our financial goals As a Senior Accountant you will be a key player in providing crucial financial support that enables our business leaders to make informed decisions You will be responsible for ensuring the accuracy of our financial statements owning monthend close processes and contributing to the development and maintenance of financial reporting across the company This is an exciting opportunity to work with a talented team and build a strong foundation in corporate general ledger accounting and Angis business operations What youll do Participate in drafting company filings including 10Qs and 10K Prepare monthend journal entries and account reconciliations for GL accounts Research and resolve accounting discrepancies and irregularities Lead monthend consolidation processes Maintain internal controls and work with both internal and external auditors to ensure audit requests are addressed Provide support on special requests projects and adhoc analysis as necessary Who you are 24 years of accounting experience Bachelors or Graduate degree in Accounting or related field CPA or CPA candidate a plus Working knowledge of US GAAP and ability to assist in technical accounting research Proficiency with Microsoft Office specifically Excel Experience with NetSuite and Hyperion a plus Organized and detailoriented with an ability to communicate effectively with both accounting and business partners We value diversity We know that the best ideas come from teams where diverse points of view uncover new solutions to hard problems We welcome and value individuals who bring diverse life experiences educational backgrounds cultures and work experiences Compensation  Benefits The salary band for this position ranges from 80000  90000 commensurate with experience and performance Compensation may vary based on factors such as cost of living This position will be eligible for a competitive year end performance bonus  equity package Full medical dental vision package to fit your needs Flexible vacation policy work hard and take time when you need it Pet discount plans  retirement plan with company match 401K The rare opportunity to work with sharp motivated teammates solving some of the most unique challenges and changing the world LIHybridBIHybrid,2023-07-21,Colombia,2023-07-21 06:27:45.803652
Freelance Producer,https://tryremotely.com/remote-jobs/angi-freelance-producer-33873,Angi is transforming the home services industry creating an environment for homeowners service professionals and employees to feel right at home For most home maintenance needs our platform makes it easier than ever to find a qualified service professional for indoor and outdoor jobs home renovations or anything in between We are on a mission to become the home for everything home by helping small businesses thrive and providing solutions to financing and booking home jobs with just a few clicks Over the last 25 years we have opened our doors to a network of over 200K service professionals and helped over 150 million homeowners love where they live We believe home is the most important place on earth and are embarking on a journey to redefine how people care for their homes Angi is an amazing place to build your dream career join uswe cannot wait to welcome you home The Content  Editorial team at Angi is looking for an experienced Freelance Content Producer to join our growing team Were building bestinclass digital content to help our users learn how to improve and take care of their homes This is a freelance independent contractor position We are looking for availability between 2035 hours per week which can take place at your own schedule In this role youll be responsible for producing building and updating content on Angicom using Contentful CMS ensuring all content is formatted correctly reviewing and adding internalexternal links and reviewing URLs after publication What youll do Uploading updating and publishing between 2050 articles per week in our CMS Coordinating with Project Managers Content Editors and Content Producers to ensure edits were published correctly Updating stock photography and uploading infographics as needed Fixing broken links checking images and tables for formatting errors and ensuring backend CMS requirements are met Checking internal links between pages and creating additional internal links as needed Qualifications 1 years of experience working with content management systems or equivalent experience CMS experience is required Experience with Google Docs or other editing tools preferred SEO knowledge and experience is a plus Familiarity with project management tools such as Mondaycom Compensation The hourly rate for this position ranges 15  20 per hour commensurate with experience and performance Compensation may vary based on factors such as cost of living LI  Remote,2023-07-21,Israel,2023-07-21 06:27:46.431523
Freelance Producer,https://tryremotely.com/remote-jobs/angi-freelance-producer-33872,Angi is transforming the home services industry creating an environment for homeowners service professionals and employees to feel right at home For most home maintenance needs our platform makes it easier than ever to find a qualified service professional for indoor and outdoor jobs home renovations or anything in between We are on a mission to become the home for everything home by helping small businesses thrive and providing solutions to financing and booking home jobs with just a few clicks Over the last 25 years we have opened our doors to a network of over 200K service professionals and helped over 150 million homeowners love where they live We believe home is the most important place on earth and are embarking on a journey to redefine how people care for their homes Angi is an amazing place to build your dream career join uswe cannot wait to welcome you home The Content  Editorial team at Angi is looking for an experienced Freelance Content Producer to join our growing team Were building bestinclass digital content to help our users learn how to improve and take care of their homes This is a freelance independent contractor position We are looking for availability between 2035 hours per week which can take place at your own schedule In this role youll be responsible for producing building and updating content on Angicom using Contentful CMS ensuring all content is formatted correctly reviewing and adding internalexternal links and reviewing URLs after publication What youll do Uploading updating and publishing between 2050 articles per week in our CMS Coordinating with Project Managers Content Editors and Content Producers to ensure edits were published correctly Updating stock photography and uploading infographics as needed Fixing broken links checking images and tables for formatting errors and ensuring backend CMS requirements are met Checking internal links between pages and creating additional internal links as needed Qualifications 1 years of experience working with content management systems or equivalent experience CMS experience is required Experience with Google Docs or other editing tools preferred SEO knowledge and experience is a plus Familiarity with project management tools such as Mondaycom Compensation The hourly rate for this position ranges 15  20 per hour commensurate with experience and performance Compensation may vary based on factors such as cost of living LI  Remote,2023-07-21,Remote,2023-07-21 06:27:46.784334
