title,link,description,pubdate,location,timestamp
zero44 GmbH Senior Backend Ruby Engineer,https://weworkremotely.com/remote-jobs/zero44-gmbh-senior-backend-ruby-engineer,  Headquarters Berlin Germany URL httpwwwzero44eu  zero44 is a B2B SaaS startup dedicated to developing software solutions for the maritime industry Our goal is to help them comply with and effectively manage carbon regulations vessel by vessel charter by charter Our customers are already benefiting from our strong offering towards the IMOs Carbon Intensity Indicator Currently we are working hard to provide an allinone solution for the maritime industry to manage the EU Emission Trading System  Following a successful first year and with a significant level of interest from the industry along with new investment we are seeking to expand our team and product features If you have a passion for building SaaSApplications and are keen on helping a fascinating centuriesold industry transition to carbon zero through the development of exceptional digital tools then this could be the ideal opportunity for you Our current tech stack  Ruby Rails and Sorbet  Sidekiq Postgres Terraform  TypeScript TailwindCSS and React Your missionIn this role youll be at the point where our product people and technical team come together to deliver a quality end result It will be your responsibility to collaboratively drive the entire product development flow from design amp development to deployments amp maintenance We are still at a very early stage so much of the tech stack is rapidly changing We are looking for someone who considers this an opportunity to make an impact  Your profileAs our backend engineer you will build digital products and applications from the ground up Youve shipped large webbased applications with many components and data structures You have proven ability to design complex scalable data structures You are comfortable writing complex queries in relational databases You have experience integrating complex 3rd party APIs You have a keen eye in detecting bottlenecks in existing data structures and strive to improve them Youre comfortable making technical decisions in the fastpaced everchanging environment of a startup company  Personality You see things through from start to finish You can manage yourself but you also work well with others You understand the importance of keeping things simple and flexible Fluent English and an excellent communicator A good sense of humour and a great team player Why us Build customer solutions with a purpose help our customers manage the transition to carbon zero  a challenge probably as big for the shipping industry as moving from sailing boats to steam ships in the 20th century Become a key member of our company with the chance to shape and lead its carbon trading offerings  Work directly with the founders of zero44  Be part of a positive inspiring culture of trust empowerment and constructive feedback Flexible home office rules and working hours A ride on one of these beautiful ships whenever they are somewhere near you Great office in the heart of Berlin Prenzlauer Berg   About usZERO44 was founded in January 2022 Our mission is to provide the maritime industry with digital solutions to reach carbon zero We are a Berlin based software company that combines a unique team of software and company builders with a passion for the maritime industry We are backed by Flagship Founders a company builder dedicated to digitising the maritime industry We believe that our planet needs action now The shipping industry has a long way to go to reach its ambitious climate targets We want to help by providing our brains hands and hearts To apply httpsweworkremotelycomremotejobszero44gmbhseniorbackendrubyengineer,2023-06-05,NaN,2023-06-05 21:20:10.310952
Toggl Database Reliability Engineer,https://weworkremotely.com/remote-jobs/toggl-database-reliability-engineer-2,  Headquarters Tallin URL httpstogglcomjobs   We are looking for a passionate Database Reliability Engineer to join the SRE Team to help us maintain and grow the resources to deliver the best time tracking tool to hundreds of thousands of users daily around the globe The salary for this position is 70000 annually You can work from anywhere in the world  About the Team We are a global team of 100 awesome people working from over 40 countries around the globe We hire globally you work locally  in the heart of London a beach outside of So Paulo or a quiet village near Florence the choice is yours Every few months we travel to meet up somewhere in the world and spend some quality time together We place a huge amount of trust in our people and we measure the outcomes rather than the work itself Our values fuel our results  The role As part of the SRE Team your main responsibilities will be Helping us maintain scale and monitor our PostgreSQL Databases in the Cloud to achieve a highly reliable platform Working alongside DB and Backend Engineers to optimize our current databases Mentoring other engineers across teams to increase the quality of our product and translate business requirements into sustainable database solutions About you We would love to hear from you if you are passionate about technology and enjoy monitoring automating and creatingmaintaining tools In particular we are looking for Experience managing PostgreSQL Databases  Great experience debugging and improving SQL Queries Experience in Networking Cloud Security and Monitoring Knowledge of technologies like Bash and Terraform Collaboration communication and ownership are key from day one  Bonus points for Knowledge of Ansible Knowledge in other areas like Google Cloud Platform OLAP Orchestration CICD Prometheus and Grafana  Benefits  Freedom to choose when and how much you work  we only measure results 24 days of paid time off a year plus your local holidays Inperson meetups for teambuilding expenses covered 46 weeks paid sabbatical depending on the tenure Laptop budget up to 2500 and it renews every 3 years 2000 budget to set up your home office and additional 300 every year after 3 years of tenure 250 per month for coworking space membership andor internet service at home 4000 per year contribution to use for training workshops and conferences 2000 per year contribution for any equipment or services to improve andor maintain your physical and mental health Support for buying tools you need for doing your best work even eyeglasses if you need a new pair  To apply httpsweworkremotelycomremotejobstoggldatabasereliabilityengineer2,2023-06-05,NaN,2023-06-05 21:20:10.311017
Builder Prime Senior DevOps Engineer,https://weworkremotely.com/remote-jobs/builder-prime-senior-devops-engineer,  Headquarters Staten Island NY URL httpsbuilderprimecom  SummaryHi Im the founder of Builder Prime a growing B2B SaaS startup helping home improvement companies grow their businesses I am a technical founder and was the sole developer until about 2 years ago I have long relied on using Heroku as a platform as a service but as the company is growing we need your expertise in running a worldclass operation This is where you come in I am looking for a Senior DevOps Engineer to join a small team and make a big impactWe already have the absolute best platform out there for home improvement contractors Our customers love our software and the support they receive from us Check out our reviews on Capterra and Facebook to see what some of our customers are saying about us We have a highly available platform see httpsbuilderprimestatuspageio with extensive observability tools Yet there is more to be done using your experience to improve and further mature our tech stack and operations This is a fulltime and longterm position that is 100 remote All of our meetings as well as any meetings with customers will be conducted remotely mostly over Zoom You will need to work during or close to US East Coast business hours Currently we try to meet as an entire company for an offsite retreat at least once per year and would cover your expenses to join us Why YOU Should ApplyThis is a unique opportunity to get in at the earlier stages of a growing software startup company We are profitable and growth is accelerating We need your help to continue that accelerationYou will be working directly with me the founder amp developer as well as the lead developer that has been working with me for the last couple years so there is no red tape or layers of management to deal with You will be able to influence and make real changes and see the results of those changes immediately You will be the keeper of the platform that makes a huge difference in businesses and that people love to use every single day Responsibilities and DaytoDayWe are a small and scrappy company so you will need to wear a few different hats Flexibility and adaptability are key traits that you will need to possess to be successful in this roleYour first priority in this role will be site stability You will be proactive in minimizing software failures and reducing the lead time between fixes We are currently running Java Spring on Heroku with AngularJS frontend connected to a multitenant PostgreSQL database The app is instrumented with Sentry NewRelic and Librato with aggregated logs through Papertrail Your next priority will be helping to speed up the different aspects of developing testing and releasing software We run a Kanbanlike process with weekly releases using GitHub Actions for our automated pipelinesIn addition to these top two priorities you may also be asked to interact directly with our service partners over email phone and Zoom meetings These types of interactions would typically be required for assessing new integrations or troubleshooting existing connectivity Finally I will be looking for you to play a role in the future direction of the platform I will look for your input on migration of our platform from Heroku to our new cloud hosted home as well as system architecture monitoring and scaling costeffectively This truly is a great opportunity to have a lot of influence on the future of the software and the business RequirementsIn this role you will need to take ownership and responsibility of the platform  you will shape and lead the direction of our entire cloud operations You will be given all of the tools and support to be successful without being told what to do every step of the way If this appeals to you then this may be the perfect position for youHere are some other qualifications that would make this role a good fit for you   You implement secure longterm solutions through simplification and automation You not only keep the lights on you make them shine brighter and better everyday  You can dive deep and identify failure patterns to resolve problems at their root and rarely in the middle of the night  You have 5 years of experience in a DevOps role working in a cloud hosted environment AWS GCP Azure Heroku Render etc You have 3 years of experience with SQL and wrangling relational databases You believe in infrastructure as code with a good knowledge of Git and a strong understanding of continuous integration and delivery  You must have a reliable and fast internet connection with at least 50 Mbs download and 10 Mbs upload speed That should be the actual speed based on how you connect not the theoretical speed that your ISP advertises You love the idea of efficiency You are constantly striving to make yourself more efficient and the idea of making other people more efficient excites you You are curious and love to learn and you love finding new ways to get things done better and faster You enjoy leaving a document trail so others can learn and follow your lead  Any knowledge or experience in the Construction or Home Improvement industry is a plusI cant wait to work with you learn from you and build something truly amazingBuilder Prime asks respectfully to only apply through the application form and not emailapply to them directly Recruiters and Agencies please do not contact Builder Prime directly  To apply httpsweworkremotelycomremotejobsbuilderprimeseniordevopsengineer,2023-06-05,NaN,2023-06-05 21:20:10.311085
Adblock Inc Frontend Engineer  Marketing,https://weworkremotely.com/remote-jobs/adblock-inc-frontend-engineer-marketing,  Headquarters San Francisco CA URL httpsgetadblockcom  Adblock Inc is a small team that serves tens of millions of people worldwide Our vision is to provide our users with simple intuitive tools to block distractions protect their privacy and put people in control of their internet experience Our productsAdblock Plus AdBlock and AdBlock VPNhave been downloaded hundreds of millions of times and work in all major web browsers as well as on macOS iOS Windows and Android devices  Our team has been fully remote since its inception and we each work from whatever location works best for us What unites us is a desire to give users control over their web experienceThe RoleWere rapidly growing our business to empower every individual to take control of their internet experience To do so we need to find effective ways to explain how our products can help enjoy a distraction free internet experience  Were looking for a Frontend Engineer to join our new Marketing Team and help us achieve our goals around growing our user base and optimizing our websites Youll be joining a team consisting of UX Design Engineering and Data Analytics tasked with finding the best ways to communicate with both existing and potential users explain our product offerings and convert free users to happy paying customers  What Youll Do  Create update maintain and improve web pages flows and conversion funnels Work closely with related roles teams and stakeholders to get things done concurrently and on schedule Work on implementing and measuring complex and ambitious split tests and in product messaging schemes Contribute to the development and discussion of ideas within the team  You Have  An interest in ad blocking internet privacy and similar subjects Experience working on growing and converting freemium user bases  Experience optimizing user experiences using bayesian split testing A thorough understanding of Vanilla JavaScript and an advanced grasp of HTMLCSS Detailed knowledge of website and web app development standards and best practices Experience developing internationalized websites and web based user experiences  Availability to collaborate with teammates in Europe on a daily basis at least 3PM to 7PM CEST Availability to travel to meet with teammates in the US and Europe at least twice a year Strong written and verbal communication skills English is required second languages are a plus Bonus Points For Experience with NodeJS Python PHP and bash ordered by importance  Experience with static website building automated browser testing and cloud function development eg Cloudflare workers Firebase functions  Experience with free and open source software and software communities especially privacy and security related  Why Youll Love Working at Adblock   Competitive Salary Our salaries are based on Radford data a widelyused global compensation benchmark to ensure we provide competitive pay We dont adjust your salary based on where you live  Comprehensive Benefits We offer a benefits package that includes medical and dental insurance coverage 401K matching 14 weeks of paid parental leave and more  Professional Growth We give team members the autonomy to do their best work Because were a small team youll be able to immediately see the impact of your work and grow with the team We also support professional development with training coaching and regular feedback  Fully Distributed Community Youll be able to work 100 remotely yet remain wellconnected to your colleagues We meet at least once a year for a weeklong offsite  Generous Vacation Policy We encourage our employees to take the time they need for a vacation to spend time with their families and to stay healthy by offering at least 28 days of paid leave  Office Equipment Well provide you with a setup of your choice based on what you need to work effectively Currently healthcare and retirement plans are only available in select countries including the US Wed Love to Work With You Were serious about our work but we dont take ourselves too seriously We want Adblock Inc to be a place where people love their work like their coworkers and treat everyone with respect and empathyWere a small team and our strength comes from our diversity We strive to create an inclusive environment where differences in race sexual orientation gender identity or expression political and religious affiliation socioeconomic background cultural background geographic location disabilities and abilities relationship status veteran status and age only make us strongerIf this role sounds exciting to you please click Apply for this position to submit your resume on our careers site  To apply httpsweworkremotelycomremotejobsadblockincfrontendengineermarketing,2023-06-05,NaN,2023-06-05 21:20:10.311152
Clarity Movement Co PRODUCT MANAGER,https://weworkremotely.com/remote-jobs/clarity-movement-co-product-manager,  Headquarters Berkeley CA URL httpsclarityio   SUMMARY Clarity seeks an experienced software and hardware product manager to join our globally distributed startup We aim to reduce air pollution by offering accurate air quality readings to organizations worldwide As a product manager at Clarity you will play a critical role in bringing cleaner air to the world by contributing to product discovery planning and management OUR COMPANY We are dedicated to reducing air pollution by making it possible to measure and understand air quality issues Our customers come from government NGOs community groups academia and industry We offer them accurate air quality readings at a previously unseen spatiotemporal scale through our air quality monitoring platform OUR PRODUCT Our lowcost air quality sensor nodes and addon modules are designed to acquire air quality readings The data is then translated into accurate measurements through our Cloudbased data pipeline which performs calibration and quality control The data is served to our users through our Clarity Dashboard and Customer API and our air quality experts manage to monitor projects remotely We call this SensingasaService YOUR ROLE Clarity seeks an experienced product manager to drive product development and strategy across our multidisciplinary product suite You will report to the CTO amp CoFounder and play a critical role in leading product innovation and delivering exceptional user experiences This highimpact position requires a combination of technical expertise strategic thinking and strong communication skillsResponsibilities  Lead with customercentricity and market awarenessChampion usercentered design methodologies conducting user research usability testing and gathering customer feedback Deeply understand user needs and pain points leveraging insights to drive product decisions and improvements Participate in customer calls and interviews organize customer feedback define and analyze product metrics monitor the competitive landscape support the creation of sales and marketing collateral provide internal product training and participate in marketing activities including webinars and conferences Stay abreast of industry trends emerging technologies and the competitive landscape to identify opportunities and potential threats  Drive product strategy and roadmap across hardware and software developmentTranslate customer insights into actionable development milestones for technical teams Steer the endtoend product development lifecycle from ideation to launch and beyond ensuring timely and successful delivery across our hardware and software portfolio Develop and communicate a compelling product vision and strategy aligned with business goals and market trends Define and prioritize product features and initiatives based on user needs business impact and technical feasibility Create and maintain a clear and actionable product roadmap ensuring it evolves to meet the markets changing needs Monitor and analyze key metrics and KPIs to evaluate product performance and iterate on features as neededTactical software work includes developing UX storyboards iterating as we build and test collecting user feedback through to release writing user documentation and managing rolloutsTactical hardware work includes onboarding hardware vendors to our platform finding synergies between their expertise and ours managing new hardware product pilots and learning from field deployments  Model leadership and crossfunctional stakeholder managementBecome a trusted resource among a rapidlygrowing team Collaborate with crossfunctional groups including engineering design marketing and operations Present product strategies roadmaps and performance updates to stakeholders ensuring alignment and support Build and nurture relationships with external stakeholders including customers partners and industry influencers Requirements A minimum of 5 years of experience in product management Strong understanding of software and hardware development process Proven passion for working with customers and applying lean product management principles Excellent prioritization and coordination skills for delivering multiple features simultaneously across teams and product lines Excellent communication and interpersonal skills with the ability to work effectively with crossfunctional teams Ability to translate technical information for nontechnical audiences Strong analytical and problemsolving skills Experience working in a fastpaced highgrowth startup environment Bachelors degree in a relevant field eg Computer Science Engineering Business You did well in your physics classes and can learn new highly technical topics quickly You have a passion for reducing air pollution and improving the environment POSITION DETAILS Fulltime position Reports to Chief Technology Officer and Cofounder Location Fully remote position but ideally to be located in the US Eastern EU Western or EU Central time zone BenefitsWorking at Clarity has its perks We are remotework friendly offer flexible working hours and encourage all employees to use their unlimited PTO We provide private medical and dental insurance and growth and development opportunities for all fulltime global employees Clarity holds regular hybrid virtual and inperson team and company events  Clarity Movement is an Equal Opportunity Employer We are committed to equal treatment of all employees regardless of race national origin religion gender age sexual orientation veteran status physical or mental disability or other basis protected by lawApplications will be reviewed on a rolling basis until the position is filledLearn more about Clarity Movement and our work on our website at httpswwwclarityioJoin our team and help bring cleaner air to the world   To apply httpsweworkremotelycomremotejobsclaritymovementcoproductmanager,2023-06-05,NaN,2023-06-05 21:20:10.311220
