title,link,description,pubdate,location,timestamp
Post Op: Service Reliability Engineer at Medical AI startup,https://weworkremotely.com/remote-jobs/post-op-service-reliability-engineer-at-medical-ai-startup,To support our growth were looking for an experienced and passionate Service Reliability Engineer to join our fully remote team Were seeking someone with solid infrastructureascode skills and experience implementing standards such as Cyber Essentials Plus ISO 270019001 and SOC2 to build and maintain our IT If youre a driven technical geek who thrives in the fastpaced environment of a seedpreseed startup we want to hear from youWhat youll doDevelop and maintain our infrastructure using Ansible and TerraformCollaborate with our team to integrate new services including devops and MLops infrastructure into our cloudsLead our certification process Cyber Essentials Plus ISO 27001Make a real impact in the way we do SRE as our first SREWhat were looking forSmart and gets things doneAt least two years of experience as a Service Reliability EngineerFull proficiency of infrastructureascode with TerraformVersatility  we are an early stage startupExperience working with high performance teamsDemonstrable contributions to significant projects or FOSS initiatives eg on GitHubExcellent communication and teamwork skills with the ability to work remotely Fluent English written and spokenWhy join Post OpContribute to meaningful projects that make a difference in peoples livesJoin a small but growing remote team offering plenty of room for personal and professional growth with highly skilled coworkersEnjoy the flexibility and worklife balance that come with a fully remote roleBe part of an inclusive supportive and diverse team that values creativity and innovation,2023-07-21,Anywhere,2023-07-21 06:27:30.509593
XM: Modern C++ Software Developer  Remote,https://weworkremotely.com/remote-jobs/xm-modern-cpp-software-developer-remote-2,Modern C Software Developer  RemoteReference Number CSD1022The Role We are looking for a Modern C Software Developer to join our software development team You will be working on internal software related to trading financial products monitoring tools alerting and reporting You will have the opportunity to offer your ideas suggestions and designs to help the team improve their quality of work The team strives to write clean decoupled and testable code with a clear separation of components and responsibilitiesThe key responsibilities of the role include Develop standalone applications and plugins in C 17 Use libraries such as BoostAsio for asynchronous TCP sockets Write unittests endtoend tests and stress testing Communicate with the team to identify business requirements Understand business requirements and develop systemsfeatures to meet them Develop code in accordance with the system design and coding standards with minimal supervision Review the code of associate developers Main requirements  BScMSc in computer science computer engineering or a related subject Experience in any objectoriented language either in a professional environment or on personal projects Strong knowledge and an active interest in objectoriented principles practices and design patterns Willingness to work with and learn modern C asynchronous programming and unittesting Excellent problem solving and troubleshooting skills Knowledge of any of the following will be a plus unittesting UML designBoostAsio FIX protocol MetaTrader API asynchronous programming profiling Outstanding communication and interpersonal skills including the ability to describe software designs at all technical knowledge levels Selfstarter with a passion for coding tinkering reading exploring and breaking things Very good written and verbal skills in English Benefit from Attractive remuneration package plus performance related reward Intellectually stimulating work environment Continuous personal development and international training opportunitiesType of employment Full timeLocation RemotePlease visit httpsbitly3Yljr8s to submit your online application for this position All applications will be treated with strict confidentiality,2023-07-21,Anywhere,2023-07-21 06:27:30.724160
"XM: Senior PHP Web Developers Cyprus, Greece or Remote",https://weworkremotely.com/remote-jobs/xm-senior-php-web-developers-cyprus-greece-or-remote-2,Reference Number SPHPWD1021 The roleAs our new Senior PHP Developer you will join an amazing team who is dedicated to taking the next step in software engineering You will make key decisions on software processes and use Kubernetes and Terraform on PHP Go React  Angular on AWS The team will keep you uptodate with the latest technology stacks and processes and help you see challenging projects from beginning to end The main responsibilities of the role include Design and implement new featuresprojects Maintain and refactor existing web applications such as the companys website registration forms Members Area and internal web services Research and integrate new web technologies Write tests that will run on a continuous integration server 247 to ensure code testability code coverage and quality conforms to the companys highest standards Resolve support tickets for IT related issues Main requirements BScMSc in information technology or any other relevant degree At least 3 years of experience in a similar position Very good knowledge of PHP 7 MySQL Redis Git Very good understanding of objectoriented programming principles Experience in creating and consuming web services Experience with modern PHP frameworks Experience in writing tests with PHPUnit Ability to research and adapt new web technologies that add value to the team Strong organisational skills with the ability to multitask and prioritise Problem solving and analytical skills Ability to work independently and integrate well within a team The following will be considered an advantage Experience in Symfony framework Experience in the development of REST APIs Experience in software development practices like design patterns SOLID principles DRY Very good understanding of security practices OWASP Experience with cloud providers eg AWS Experience in database query optimization Experience in creating composer packages Experience in frontend frameworks or libraries like Angular or React Benefit from Attractive remuneration package  Private health insurance Food allowance Intellectually stimulating work environment Continuous personal development and international training opportunities Type of employment Full timeLocation Cyprus Greece or Remote Please visit our website wwwxmcomcareers to submit your online application for this position All applications will be treated with strict confidentiality,2023-07-21,Anywhere,2023-07-21 06:27:30.895127
Builder Prime: Platform Engineer,https://weworkremotely.com/remote-jobs/builder-prime-platform-engineer,Time zones EST UTC 5 CST UTC 6 MST UTC 7 PST UTC 8 AKST UTC 9 HST UTC 10SummaryHi Im the founder of Builder Prime a growing B2B SaaS startup helping home improvement companies grow their businesses I am a technical founder and was the sole developer until about 2 years ago I have long relied on using Heroku as a platform as a service but as the company is growing we need your expertise in running a worldclass operation This is where you come in I am looking for a Senior Platform Engineer to join a small team and make a big impactWe already have the absolute best platform out there for home improvement contractors Our customers love our software and the support they receive from us Check out our reviews on Capterra and Facebook to see what some of our customers are saying about us We have a highly available platform see httpsbuilderprimestatuspageio with extensive observability tools Yet there is more to be done using your experience to improve and further mature our tech stack and operations This is a fulltime and longterm position that is 100 remote All of our meetings as well as any meetings with customers will be conducted remotely mostly over Zoom You will need to work during or close to US East Coast business hours Currently we try to meet as an entire company for an offsite retreat at least once per year and would cover your expenses to join usWhy YOU Should ApplyThis is a unique opportunity to get in at the earlier stages of a growing software startup company We are profitable and growth is accelerating We need your help to continue that accelerationYou will be working directly with me the founder  developer as well as the lead developer that has been working with me for the last couple years so there is no red tape or layers of management to deal with You will be able to influence and make real changes and see the results of those changes immediately You will be the keeper of the platform that makes a huge difference in businesses and that people love to use every single dayResponsibilities and DaytoDayWe are a small and scrappy company so you will need to wear a few different hats Flexibility and adaptability are key traits that you will need to possess to be successful in this roleYour first priority in this role will be site stability You will be proactive in minimizing software failures and reducing the lead time between fixes We are currently running Java Spring on Heroku with AngularJS frontend connected to a multitenant PostgreSQL database The app is instrumented with Sentry NewRelic and Librato with aggregated logs through Papertrail Your second priority will be to automate all the things so that you can focus on improvements that really matter You will steadily create a library of scripted run books to handle the majority of daily tasks in a secure and maintainable wayYour third priority will be helping to speed up the different aspects of developing testing and releasing software We run a Kanbanlike process with weekly releases using GitHub Actions for our automated pipelinesIn addition to these top three priorities you may also be asked to interact directly with our service partners over email phone and Zoom meetings These types of interactions would typically be required for assessing new integrations or troubleshooting existing connectivity Finally I will be looking for you to play a role in the future direction of the platform I will look for your input on the migration of our platform from Heroku to our new cloudhosted home as well as system architecture monitoring and scaling costeffectively This truly is a great opportunity to have a lot of influence on the future of the software and the businessRequirementsIn this role you will need to take ownership and responsibility of the platform  you will shape and lead the direction of our entire cloud operations You will be given all of the tools and support to be successful without being told what to do every step of the way If this appeals to you then this may be the perfect position for youHere are some other qualifications that would make this role a good fit for you You implement secure longterm solutions through simplification and automationYou not only keep the lights on you make them shine brighter and better every day You can dive deep and identify failure patterns to resolve problems at their root and rarely in the middle of the night You have 5 years of experience in a PlatformDevOps Engineer role working in a cloudhosted environment AWS GCP Azure Heroku Render etcYou have 3 years of experience with SQL PostgreSQL a plus and wrangling various relational databasesYou believe in infrastructure as code with a good knowledge of Git and a strong understanding of continuous integration and delivery You must have a reliable and fast internet connection with at least 50 Mbs download and 10 Mbs upload speed That should be the actual speed based on how you connect not the theoretical speed that your ISP advertisesYou love the idea of efficiency You are constantly striving to make yourself more efficient and the idea of making other people more efficient excites youYou are curious and love to learn and you love finding new ways to get things done better and fasterYou enjoy leaving a document trail so others can learn and follow your leadAny knowledge or experience in the Construction or Home Improvement industry is a plusI cant wait to work with you learn from you and build something truly amazingBuilder Prime asks respectfully to only apply through the application form and not emailapply to them directly Recruiters and Agencies please do not contact Builder Prime directly,2023-07-21,USA,2023-07-21 06:27:31.063429
ShipHero: Senior Site Reliability Engineer,https://weworkremotely.com/remote-jobs/shiphero-senior-site-reliability-engineer,Hello We are ShipHero httpsshipherocom We have built a software platform entrusted by hundreds of eCommerce companies large and small to run their operations and we continue to grow About US5 billion of eCommerce orders are shipped a year via ShipHero Our customers sell on Shopify Amazon Etsy eBay WooCommerce BigCommerce and many other platforms Were driven to help our customers grow their businesses by providing a platform that solves complex problems and is engineered to be reliable and fast We are obsessed with building great technology that is beautiful easy to use and is loved by our customers Our culture also reflects our ethos and belief that by bringing passionate talented and great people together  you can do great thingsOur team is fully remote the company has always been remote We communicate regularly using video chat and Slack and put a strong emphasis on asynchronous work so people have large chunks of uninterrupted time to focus and do deep workWe are seeking an experienced Site Reliability Engineer to join our growing team We are looking for someone with a recent track record of building and maintaining complex infrastructure within AWS Amazon Web Services You would be a fundamental team member focusing on building a solid foundation for the platform We seek excited and driven people to continue growing with the experience of working with talented engineers and helping others improveAbout YouYou understand that great things are accomplished when people and teams work togetherYou feel comfortable owning processes and tools for deploying to production and scalingYou understand modern web architectures and tiersYou have a solid understanding of security best practicesYou take pride in your craftYou have made a lot of mistakes and most importantly have learned from themYou are comfortable and even enjoy mentoring others in different skill setsYou have worked on medium and large projects that have gone to production and lived there for a whileYou have a passion for automating developing and improving complex workflowsYou have strong scripting skillsTech KnowledgeWe are looking for 6 years of production experience with AWS andAurora RDS MySQL Lambda S3 SQS Simple Queue ServicePractical application with Infrastructure and Application Monitoring We use Sentry Honeycomb and CloudWatchComfortable debugging running applications for memory leaks CPU and usage especially under Apache modwsgi Nginx and GunicornBroad knowledge of AWS cloud security AWS Inspector Guard Duty WAF  Security Hub infrastructureascodeThe skills to write infrastructureascode and automate routine activitiesA record of working with distributed teams across an organization to achieve goalsPython preferably 36Terraform including authoring modulesDocker and building images including multistage with secretsCICD automation we use GitHub Action AWS CodeBuild and CodePipelineThe RoleProvide handson configuration setup  maintenance of our development and production environmentsCollaborate with other teams on monitoring  debugging solutionsDeveloping automating and operating our cloud infrastructure platformRespond to incidents ensuring the restoration of services when requiredContribute to the teams backlog of activitiesBe part of oncall supportAutomate yourself and others out of everyday tasksAbility to estimate effort and ship on an agreed schedule Comfortable pushing yourself and your team members when challenges pop upLearn and push those around you to do the same  this is a craft that youre constantly improving uponImplement solutions that are pragmatic to get the platform builtHave the confidence to work with experienced and talented people to build great things you are not a rock star but a team player that takes the initiativeWe want everyone to be selfsufficient and firmly believe how we collaborate  communicate is of significant importance Here is a glimpse of how we roll httpsshipherocomcareerscommunicationguidelines,2023-07-21,Anywhere,2023-07-21 06:27:31.259467
SugarCRM: Account Executive,https://weworkremotely.com/remote-jobs/sugarcrm-account-executive,Time zones EST UTC 5 CST UTC 6 MST UTC 7 PST UTC 8 AKST UTC 9 HST UTC 10 AST UTC 4 NST UTC 330SugarCRM is seeking an experienced Account Executive to help grow new logos in North America  East Coast The role of the Enterprise Account Executive is to grow new business This is a great role for an experienced Hunter who knows how to work a territory to build a book of business and create long lasting relationships The Account Executive will be responsible for driving new opportunities with the goal of obtaining high margin longterm business and increasing market share Selling SaaS CRM and Marketing applications is a plus Additionally a preferred candidate will have a proven track record of exceeding quota experience selling a SaaS solution selling to the Clevel working large enterprises and carrying a quota in excess of 15 million This is a highprofile role within the organization with direct access to company executives and input on product directiondevelopment The role reports directly to the Vice President of Sales Enterprise AccountsImpact you will make in this roleMeet and exceed individual sales goals quota and activityPartner with our channel to drive joint opportunities to closeManage enterprise level sales opportunities at Fortune 1000sDevelop and execute plans to drive awareness of Sugars solutionsDocument and manage your sales pipeline in our CRM applicationCoordinate and manage a team selling processExpertise you will bring inExperience using and selling Sales Automation Customer Service Applications andor Marketing automation applicationsMinimum 5 years quota carrying sales in SaaS or related fieldsExperience closing complex opportunitiesA proven ability to manage to a defined forecast with stated quarterly objectivesStrong presentation written and verbal communications skillsBSBA or equivalentExpected salary range base 95000  110000 plus commission based on ARR sales depending on experienceWe understand that no candidate is perfectly qualified for any job Experience comes in different forms many skills are transferable and passion goes a long way Even more important than your resume is a clear demonstration of dedication impact and the ability to thrive in a fluid and collaborative environment We want you to learn new things in this role and we encourage you to apply if your experience is close to what were looking for We also know that diversity of background and thought makes for better problem solving and more creative thinking which is why were dedicated to adding new perspectives to the team Benefits and PerksBeyond a stellar work environment friendly people and inspiring work we have some sweet benefits and perks  Excellent healthcare package for you and your family Savings and Investment  401k match Unlimited Paid Time Off Paid Parental Leave Health and Wellness Reimbursement Program Travel Discounts Educational Resources  Career  Personal Development Program We are a meritbased company  many opportunities to learn excel and grow your careerOur company uses EVerify to confirm the employment eligibility of all newly hired employees To learn more about EVerify including your rights and responsibilities please visit wwwdhsgovEVerifyIf you require a reasonable accommodation to search for a job opening or submit an application please email recruitingsugarcrmcom with your request and contact information,2023-07-21,North America,2023-07-21 06:27:31.441730
